URL,Date,News_title,News_text
https://www.yahoo.com/news/mass-dismissals-education-department-civil-140000378.html,2025-07-08 14:30:00,Education Department dismisses thousands of civil rights complaints at an ‘unheard of’ pace,"The Education Department dismissed civil rights complaints at such a rapid clip this year that former officials and advocates are concerned about a core agency function amid Trump administration plans to make deep staffing cuts.

In court documents filed last week, the department disclosed that its Office for Civil Rights dismissed 3,424 complaints between March 11 and June 27 “consistent with OCR’s Case Processing Manual.” The documents state that 96 complaints were ""resolved"" because of insufficient evidence during an investigation — and another 290 complaints with voluntary agreements, settlements or technical assistance.

During that time period, OCR received 4,833 complaints, opened 309 for investigation and opened 26 directed investigations, according to a court declaration filed as part of acase that challenged the agency’s decisionto conduct a sweeping reduction in force. Unlike most investigations, directed or self-initiated investigations are launched by the agency without someone filing a formal complaint about a school, college or university.

“The nation’s students and schools deserve a robust federal civil rights enforcement office that is fully equipped and prepared to enforce the full range of rights Congress guaranteed in law,” Catherine Lhamon, the department’s civil rights chief under former Presidents Joe Biden and Barack Obama, said in a statement to POLITICO. “The Trump Administration’s own data reporting shows it has decimated its ability to fulfill its statutory duties, to the detriment of rights in school.”

The department has focused its civil rights efforts on stamping out campus antisemitism, ending protections for transgender student athletes and eliminating all traces of diversity, equity and inclusion in education since Donald Trump returned to the White House. Colleges and universities that have not adhered to Trump's directives have had millions of dollars in federal aid frozen, become the focus of federal investigations and faced a torrent of public criticism from Trump and congressional Republicans.

Civil rights advocates say they are concerned about the high number of dismissals because the Trump administration interprets federal civil rights laws that address sex-based discrimination and discrimination based on race, national origin and shared ancestry differently from the Biden administration.

Under Education Secretary Linda McMahon, discrimination in these categories no longer includes gender identity andLGBTQ+ challenges against book bans. They now include the Trump administration’srule on how schools must respond to sexual misconductand higher levels of scrutiny of antisemitism on campus andrace-inclusive programminglike affinity graduations.

The Education Department declined to answer a series of detailed questions about its civil rights work but said all of OCR’s actions align with federal law.

“OCR has taken unprecedented steps to streamline its functions according to demand: for example, amid a growing volume of Title IX complaints, OCR partnered with the Department of Justice to expeditiously investigate sex-based discrimination claims,” agency spokesperson Julie Hartman said in a statement. “OCR’s daily accomplishments under the Trump Administration disprove the rampant fear-mongering by irresponsible media, and evince that OCR is vigorously upholding its responsibilities to protect all Americans’ civil rights.""

Advocates fear this new policy agenda is taking a toll on the routine work of an office that is responsible for investigating a range of problems including campus sexual misconduct and claims of discrimination in special education.

McMahon has also pledged to enact Trump's policies even with a slimmed down staff. Seven of the department’s 12 regional civil rights offices across the country were eliminated during themassive reduction in force in March. Those offices are in Boston, Dallas, New York, Chicago, Cleveland, San Francisco and Philadelphia. A federal judge in Massachusetts, however,ordered those workers be called back,saying the mass layoffs “leaves OCR with the capacity to address only a small fraction of the complaints that it receives.”

By contrast, during the last three months of the Biden administration, OCR dismissed 2,527 cases, resolved 449 with resolution agreements for change, secured 146 successful mediations, and determined there was no violation in 119 cases.

The difference between the number of mediated or voluntary resolution cases recorded in the last three months of the Biden administration, when compared to the number of resolutions disclosed by the Trump administration within three months earlier this year, “reflects a shocking diminution of work output from the office,” Lhamon said.

One former agency official, granted anonymity due to fear of retaliation from the Trump administration, was stunned by the new data.

“That amount of dismissals in a three-month period is unheard of,” the former official, who worked in OCR and was at the department for about 20 years, said. “If they dismiss that amount of cases in a matter of three months, then they're not following the procedures. What it sounds like they're doing to me is they're just dismissing cases that they don't want to take the time to investigate, or put the resources into.”

There are few instances where the office will dismiss a complaint, they said. If the complaint doesn’t have enough information and OCR can’t get in touch with the person who filed it, that would be grounds for dismissal. They would also dismiss a case if someone were to complain about a school that doesn’t receive federal funding and therefore doesn’t fall within OCR’s jurisdiction.

“But those types of complaints are very rare,” the former official said. “Maybe one in a thousand.”

Similarconcerns about the number of dismissalsemerged during the first Trump administration as the agency sought to reduce a massive backlog of cases in 2017. OCR at the time closed more than 1,500 civil rights complaints and dismissed more than 900 outright in roughly two months after issuing a directive to agency investigators.

“We should be concerned about that amount, especially given the way that this administration has prioritized weaponizing civil rights laws and distorting these laws,” said Shiwali Patel, senior director of safe and inclusive schools at the National Women’s Law Center.

She said the number of dismissals signals that students and parents “can't rely on this administration to protect them from discrimination.”"
https://www.yahoo.com/news/portion-dayton-road-temporarily-closed-194051634.html,2025-07-18 23:15:00,Portion of Dayton road temporarily closed after sinkhole forms,"DAYTON, Ohio (WDTN) — The formation of a sinkhole is causing a portion of a Dayton road to close.

One southbound lane of Riverside Drive is closed after a 6 foot by 6 foot sinkhole formed at the intersection of Riverside Drive and Ryburn Avenue.

Both southbound lanes of Riverside Drive at Siebenthaler Avenue will close roughly after 9 a.m. on July 28. Southbound lanes of Riverside Drive will be closed at Ryburn and Siebenthaler avenues until just before 7 a.m. on July 30.

Police looking for suspect accused of entering window, stealing cigarettes

According to the city, the closure is needed to ensure inspection and repair can be conducted.

“To ensure there are no hidden voids beneath the surface, crews will need to remove additional pavement around the affected area,” said the city.

Dayton suggests southbound drivers on Riverside Drive take East Siebenthaler Avenue to North Main Street to East Hillcrest Avenue to Riverside Drive.

Copyright 2025 Nexstar Media, Inc. All rights reserved. This material may not be published, broadcast, rewritten, or redistributed.

For the latest news, weather, sports, and streaming video, head to WDTN.com."
https://www.yahoo.com/news/articles/16-mindboggling-photos-weather-scary-033101957.html,2025-08-23 04:30:00,16 Incomprehensible Weather Photos That Are Freakin' Me The Heck Out,"1.This hail storm in Nebraska that chipped away at this person's house. Imagine one of those golf ball-sized chunks getting hurled at you. No, thank you:

2.This incredible amount of rain that fully submerged an entire hiking trail:

3.This dooming sandstorm about to overtake a cargo ship:

Related:13 Tweets From Women This Week That Made Me Laugh So Hard I Might Need Medical Attention

4.And this haboob that made the city it was engulfing look like a town made of miniatures:

5.This area that was used to collect the sand that was displaced during Hurricane Milton. It's two palm trees high:

6.This Sheeheet sinkhole, which is a terrifying reminder that the ground can just plop down right under you at any given moment:

Related:17 Wild Screenshots Of People Caught Being Extremelyyy Selfish In Public

7.This 200-degree difference between two points on the same planet on the same day:

8.This wind that almost blew away the poor dog trying to go potty here:

9.This sunbeam that came through the window and completely melted a streak down this keyboard:

Related:25 People Share Stories Of The Most Unhinged And Uncomfortable First Dates They've Ever Been On, And I Am At A Complete Loss For Words

10.This blizzard that walled in an entire plaza with snow:

11.These intense storm clouds that turned a beach day into what the sky looks like when a villain approaches in a cartoon:

12.This volcano that thought, ""What could make me scarier? I know! Lightning coming out of my lava hole:""

13.This incredibly trippy cloud in Indianapolis that looks like the beginning of an alien invasion:

Related:19 Absolutely Delightful Posts From This Week That Made Me Feel Like Maybe The World Isn't A Complete Dumpster Fire After All

14.This hail falling...in the desert? It's incredibly satisfying seeing all of the little dimples it's leaving in the sand:

15.This freaky cloud that looks like a giant ocean wave:

16.Finally, this heartbreaking before-and-after that showcases the sheer power of a landslide:

Do you have an absolutely wild weather photo you'd like to share? I'd like to see it! Drop it in the comments below.

Also in Internet Finds:24 Hypocrites Who Were Destroyed With A Simple ""This You?"" Comeback

Also in Internet Finds:""My Alarm Bells Were Going Off"": People Are Sharing Their Wildest ""I F—ing Knew It"" Moments That Prove You Should ALWAYS Trust Your Gut

Also in Internet Finds:These 15 Hilarious Internet Fails From Last Week Made Me Laugh So Hard I Shed A Single Tear

Read it on BuzzFeed.com"
https://www.yahoo.com/news/articles/sinkhole-closes-part-midlothian-boulevard-201257226.html,2025-08-07 23:00:00,Sinkhole closes part of Midlothian Boulevard,"YOUNGSTOWN, Ohio(WKBN) – A portion of Midlothian Boulevard in Youngstown is closed due to a sinkhole.

Work began today to repair a sinkhole on Midlothian Boulevard — that opened up yesterday — causing the eastbound lanes right around I-680 to be closed.   The hole was caused by the collapse of a sanitary sewer line.  It created a hole 11 feet deep.

Read next: Local company looking to hire over 100 people

According to the city’s Department of Public Works, the eastbound lanes are closed between Shirley Road and Lemoyne Drive — in front of Steel City Bar and Grill — due to the collapse of a 30-inch sanitary sewer and manhole.

Repairs began Friday. A city official said that barring something unforeseen, the work should be done and the road reopened in a week or so.

The posted detour will be Interstate 680 South to U.S. Route 224 to I-680 North to Midlothian Boulevard.

Jon Rudder contributed to this report.

Copyright 2025 Nexstar Media, Inc. All rights reserved. This material may not be published, broadcast, rewritten, or redistributed.

For the latest news, weather, sports, and streaming video, head to WKBN.com."
https://www.yahoo.com/news/threat-public-broadcasting-nashville-public-232902857.html,2025-07-12 02:30:00,"‘A threat to public broadcasting’: Nashville Public Radio fears funding cuts to NPR, PBS","NASHVILLE, Tenn. (WKRN) — Nashville Public Radio told News 2 there will be an immediate impact if Congress passes President Donald Trump’s rescission package.

The proposal aims to eliminateover $1 billion from NPR and PBS. Trump gave Republicans an ultimatum if they don’t vote in favor of his funding cuts.

“We use Studio B for all of our live broadcasts and also for news presentations,” Kenda Lovecchio, vice president of development at Nashville Public Radio, said.

Nashville Public Radio has been a part of Middle Tennessee for more than 60 years.

“We’re 90.3 WPLN News and 91.1, your music discovery station,” Lovecchio said.

House approves Trump’s request to cut funding for NPR, PBS and foreign aid

After spending decades relying on listeners, those at Nashville Public Radio now fear they’re being silenced.

“I absolutely feel that there’s been a threat to public broadcasting, and also to the industry,” Lovecchio said.

NPR and PBS are both threatened as Trump pushes to take back over $1 billion of federal funding from the public broadcasters.

“I think it’s very unfair, it’s been very biased…it’s a waste of money,” the president has said in the past.

On Thursday, July 10, Trump wrote, in part, on Truth Social, “Any Republican that votes to allow this monstrosity to continue broadcasting will not have my support or Endorsement.”

U.S. Sen. Marsha Blackburn (R-Tenn.) appears to be in support. She posted on X Thursday afternoon that the rescission package would cut $9.4 billion in “wasteful spending” in order to “save taxpayer dollars and streamline the federal government’s work.”

Senate GOP gears up for test on Trump’s DOGE cuts

Meanwhile, Nashville Public Radio would lose $400,000 a year, which is 5% of its annual budget.

“The commitment that we receive through the Corporation for Public Broadcasting has been guaranteed. It’s been something that’s provided to us on an annual basis, and so it is a critical time because we are in need of finding a way to cover that lack,” Lovecchio said.

According to Lovecchio, the majority of funding comes from individuals in the community and corporate sponsorships. She added that support is needed now more than ever.

“This is a threat that further challenges our position, our field, our industry, and we feel that it’s just critical to local journalism to maintain the support from our community in order for us to continue and to thrive,” Lovecchio said.

You can help Nashville Public Radio byvisiting its website.

Copyright 2025 Nexstar Media, Inc. All rights reserved. This material may not be published, broadcast, rewritten, or redistributed.

For the latest news, weather, sports, and streaming video, head to WKRN News 2."
https://www.yahoo.com/news/miraculous-discovery-made-remote-island-175920793.html,2025-07-11 20:30:00,Miraculous Discovery Made on Remote Island After Teen Surfer Went Missing,"A missing teenager has been found alive on a remote island in Australia, almost 8 miles offshore. Darcy Deefholts, 19, was found in North Solitary Island off Wooli after being swept away while surfing. He had left his home on Wednesday afternoon to head toward Wooli beach, according to police.

After his son's disappearance, Terry Deefholts pleaded with community on social media to help locate Darcy, saying he was ""fearing the worst.""

“I am asking anyone with a seaworthy vessel to please meet me at the main Wooli boat ramp and take me to sea to help with the search,"" he wrote before describing the discovery as a""one-in-a-million miracle.""

While Darcy's bike, clothes and shoes were found at a local spot known as One Tree, his phone and smartwatch were left at home.

With over 1100 shares on his Facebook post, Terry posted, “We are overwhelmed by the community efforts in the search so far. There is only one thing we want now – our beloved boy to be found safe currently.""

Darcy is now receiving medical treatment, while his family is still processing the trauma.

“I haven’t had the chance to talk to him yet, I’m just so over the moon,"" said Terry. ""I’m still just processing everything. We’ve had no sleep and it has been a lot to deal with.""

""It's rare that we ever get to participate in a search with an outcome such as this,"" said rescuer Matthew McLennan, according to theAustralian Broadcasting Corporation. ""It was really heartwarming to see how many community members jumped to the call.""

Miraculous Discovery Made on Remote Island After Teen Surfer Went Missingfirst appeared on Men's Journal on Jul 11, 2025"
https://finance.yahoo.com/news/xrp-vs-bitcoin-better-buy-102700441.html,2025-07-09 11:15:00,Yahoo Finance,"Bitcoin is at a unique moment in its history, with widespread institutional adoption.

XRP is building the scaffolding it needs to be favored by institutions as well.

One of these assets is better for longer-term holding than the other is likely to be.

10 stocks we like better than XRP ›

Most investing decisions feel like choosing between two distant futures. In crypto right now, one such fork in the road is whether to buy an asset built on engineered scarcity, or one engineered for regulated utility and widespread use.

The question matters because capital is finally pouring into both lanes at once.Bitcoin(CRYPTO: BTC)is drawing record institutional inflows whileXRP(CRYPTO: XRP)is winning a few serious gigs to provide financial plumbing. The trade‑off between slow‑burn ""digital gold"" and faster‑moving payment rails has never been starker, so let's sort out which path fits which kind of investor.

Bitcoin currently trades around $109,000 as of July 7 despite a considerable amount of recent macroeconomic volatility.

The latest leg higher came from purchasing driven by institutions and holders of large sums of capital, not small-time investors seeking a thrill.BlackRock's Bitcoinexchange-traded fund (ETF), theiShares Bitcoin Trust ETF, took in more than $1.3 billion in fresh cash in the last week of June, part of a haul of more than $4 billion that all U.S. spot Bitcoin ETFs absorbed in the month.

Collectively, at least 116 public companies now hold a total of roughly 809,100 Bitcoins on their balance sheets, more than double the corporate stash a year ago.

Why does that matter? It's evidence that the ""demand"" portion of the supply and demand dynamics affecting the coin is very healthy. When paired with the favorable and ongoing action of thehalving process, one of the main factors affecting the coin's supply, it suggests that it's appropriate to be bullish about the coin.

In short, Bitcoin's issuance halves roughly every four years, crimping new supply just as ETF sponsors, corporates, and long‑term allocators compete for the float. Scarcity was always part of the asset's pitch, and now it is colliding with regulated distribution channels that make large buys painless for big buyers.

In theory, that should push the asset's price discovery into a narrower, mostly upward corridor, and for the long term. This catalyst is playing out right now.

The investment thesis for buying XRP is quite different.

It's priced near $2.28 today, and its ledger, XRPL, just activated an automated market maker (AMM) feature, letting any wallet convert assets on‑chain and earn fees from idle balances. That's a key feature for the chain's intended users, institutional investors.

Another important capability for courting that same audience is that XRPL bakes in regulator‑friendly tools, like authorized trust lines, blacklists, and the ability to freeze accounts so issuers can remain in good standing with anti-money laundering and know-your-customer laws.

That matters because tokenizing real‑world assets (RWA) so that they can be handled more easily by asset managers is becoming big business, and compliance tooling is essential to capturing that business. The RWA sector's value hit $24.8 billion in June, and it could balloon to $30 trillion by 2034, per some estimates. XRP is already attracting key projects on its chain, including a $693 million Treasury bond fund, giving users 24/7 access to short‑term government debt. As more assets are tokenized, having must-have assets like Treasuries on-chain will make the ledger an even more appealing place for institutional investors to park their capital.

In other words, with XRP the value-generating flywheel is liquidity at the scale that institutional investors need it. Each tokenized Treasury or corporate debt issue deepens its on‑ledger pools, reduces pricing inaccuracy for big transactions, and nudges newcomers to hold a small XRP reserve to transact.

Assuming regulators stay comfortable with XRPL's top‑down compliance controls, that adoption curve could steepen over the next three to five years.

Think of Bitcoin as a zero‑yield digital commodity whose upside comes from enforced scarcity meeting mainstream acceptance. Its payoff profile looks like a long-dated bond, with slow, steady, but potentially massive returns accruing across halving cycles for those who are patient.

XRP is more like a fast‑growing fintech stock. Success hinges on product‑market fit and execution. Yet it's because of this elevated risk that the coin's ramp‑up, if it happens, could dwarf Bitcoin's percentage gains, and those gains could occur sooner.

A balanced crypto portfolio might allocate 80% to Bitcoin for stability and 5% or so to XRP for higher risk exposure. The pair can coexist in the same account without any contradiction. Just be honest about your time horizon and risk tolerance before you choose your lane.

And if you're only interested in choosing one, you should choose Bitcoin today. XRP is a great coin, but it is simply not the safer option at these lofty prices.

Before you buy stock in XRP, consider this:

TheMotley Fool Stock Advisoranalyst team just identified what they believe are the10 best stocksfor investors to buy now… and XRP wasn’t one of them. The 10 stocks that made the cut could produce monster returns in the coming years.

Consider whenNetflixmade this list on December 17, 2004... if you invested $1,000 at the time of our recommendation,you’d have $695,481!*Or whenNvidiamade this list on April 15, 2005... if you invested $1,000 at the time of our recommendation,you’d have $969,935!*

Now, it’s worth notingStock Advisor’s total average return is1,053% — a market-crushing outperformance compared to179%for the S&P 500. Don’t miss out on the latest top 10 list, available when you joinStock Advisor.

See the 10 stocks »

*Stock Advisor returns as of July 7, 2025

Alex Carchidihas positions in Bitcoin and iShares Bitcoin Trust. The Motley Fool has positions in and recommends Bitcoin and XRP. The Motley Fool has adisclosure policy.

XRP vs. Bitcoin: Which Is the Better Buy Right Now?was originally published by The Motley Fool"
