URL,Date,News_title,News_text
https://www.yahoo.com/news/china-opens-tourists-trump-u-085602767.html,2025-07-09 10:00:00,China Opens Up to Tourists as Trump’s U.S. Closes Itself Off,"International travelers walk through an immigration checkpoint at Shanghai Pudong International Airport in China on May 30, 2025. Credit - VCG/Getty Images

As the U.S. under President Donald Trump increasingly closes itself off from the world, denying entry to tourists amid a crackdown on border controls and migration, its geopolitical rival China, which has long been known for its relative isolation, has loosened its travel restrictions to unprecedented levels.

By July 16, China will have expanded visa-free entry to 75 countries as part of a broader campaign to boost inbound tourism, which has already seen a surge. Last year, over 20 million foreigners visited China without a visa, doubling that of the previous year, according to China’s National Immigration Administration. Shanghai alonereceived 2.6 million overseas visitsin the first half of this year, around half of which were visa-free entries, a 45% year-on-year increase. China has been steadily pushing for more people to visit since reopening its borders in early 2023, after its“Zero-COVID” policiesappeared for a time as though they mightdrive the countryinto alasting isolation.

It’s also part of China’s effort to boost its soft power, especially at a time when the Trump Administration appears to be withdrawing the U.S. from the global stage. In recent months, Trump hasmovedto restrictinternational studentsfrom the U.S.,impose sweeping tariffson the rest of the world, andshutter USAID, whilereportsof tourists beingdetainedordenied entryby Immigration and Customs Enforcement havedeterredsome from visiting the U.S.

China’s response to U.S. actions—including thetargeting of Chinese international studentsandU.S. interventionin theIsrael-Iran War—has been relatively restrained, signalling the country’s desire to maintain cordial diplomatic ties to the U.S., especially amidtrade negotiations, while also advocating for multilateralism like never before.

The U.S. has “demonstrated its military capabilities, its commitment to allies, and its influence in crisis management” through Trump’seffortstobrokerpeace dealsaround the world, at times wielding the threat of force, but “these are not the metrics by which China measures its global role,” says Lin Jing, a research fellow at the Middle East Institute at the National University of Singapore. “Instead, China continues to showcase its consistency and stability, its non-aligned posture, and its support for a U.N.-centered international order.”.

“There’s recognition that when you don’t have people-to-people exchanges, you lose an important bulwark against populist rhetoric on both sides,” David Weeks, co-founder and chief operating officer of Sunrise International, a consulting firm that advises overseas universities on recruiting Chinese students,previously told TIME. “China thinks that we need more, not less, exchange if we have disagreements.”

In May, Chinese Ambassador Xie Feng emphasized the importance of people-to-people exchanges to U.S.-China relations, just as the U.S. announced enhanced screenings of student visa applicants from China and Hong Kong. “It is people-to-people ties that invigorate China-U.S. relations,” hesaidat his embassy. “We warmly welcome all American friends to travel in China, shop in China, succeed in China and take part in Chinese modernisation. Come and see the country with your own eyes.”

Inbound tourism could also help to rejuvenate China’s domestic economy, which the Chinese government hasprioritizedto mitigate against the worst effects of Trump’s tariffs as well as highyouth unemploymentand apersistent real estate crisis. China isopeningmore duty-free shops around the country in an effort to bolster spending within the country. Meanwhile, Chinese businesses, like‘Labubu’ toy retailer Pop Mart, havegained global popularity, boosting China’ssoft powerand interest around the world in visiting the country.

Here’s what to know.

Much of Europe, Asia, and parts of the Middle East are able to travel to China without a visa.

China began expanding its visa-free scheme after reopening its borders in 2023 after inbound travel plummeted during the pandemic. The countrysawjust 14 million visitors in 2023 as compared to 32 million in 2019.

Since then, Beijing hasintroduced or resumed visa-free entryfor visitors from nearly every European country, including France, Germany, Italy, the Netherlands, Spain, and most Asian countries, including Japan, Malaysia, Singapore, and South Korea. Citizens of five Latin American countries—Argentina, Brazil, Chile, Peru, and Uruguay—and Uzbekistan wereaddedto the scheme in June. Four countries in the Middle East—Bahrain, Kuwait, Oman, and Saudi Arabia—were alsograntedvisa-free entry last month. Azerbaijan willbecomeeligible on July 16, bringing the total to 75. (By comparison, nationals from 42 countries have visa-free access to the U.S. for tourism or business stays up to 90 days under theVisa Waiver Program.)

China’s scheme allows citizens of eligible countries to enter without a visa for up to 30 days.

“Our inbound tourism has already recovered to 70 to 80 per cent of pre-Covid levels. It could be fully recovered this year,” James Liang, chairman of China’s leading online travel service Ctrip,reportedly toldShanghai-based outlet The Paper. “There are still some bottlenecks to be addressed. If they are tackled, China’s inbound tourism could reach the world’s top tier in 10 or 20 years.”

China has alsoexpanded its transit policythat allows travellers from 55 countries to enter China without a visa for 10 days if they then depart for a different country from where they came. The transit policy includes 10 countries that are not part of the visa-free scheme: Canada, the Czech Republic, Indonesia, Lithuania, Mexico, Russia, the U.K., Ukraine, and the U.S.

China is also aiming toopen up Xinjiang—the Uyghur autonomous region that is under Western sanctions overhuman-rights concerns—to more domestic and foreign tourists. Earlier this year, local officials announced goals of bringing in at least 400 million annual visits to the region by 2030.

China’s opening up is happening against a backdrop of the U.S. tightening its visa rules.

Trump has targeted international students in hiscrackdownon universities across the U.S. His punitive moves have included attempting toremove Harvard’s abilityto enroll international students,targeting foreign-born studentsfor removal from the country, and quietly revoking the visas of thousands of international students (beforereversingthe move). He’s also heightened screening requirements for student visa applicants—especially those from China—including requiring applicantsmake their social media accounts “public” for vetting.

During his 2024 campaign, Trump alsovowed to reinstate his travel banon travellers from Muslim countries, and in June heannounced a new travel banon nationals from 12 countries and tightened restrictions on nationals from seven more. And he isreportedlyconsidering adding 36 countries to the travel ban list.

Several countries have issued advisories about travelling to the U.S., including China, whichadvisedits citizens to “fully assess the risks” before travelling to the U.S. because of “the deterioration in China-U.S. trade relations and the domestic security situation in the U.S.”

Some European countries, including the U.K. and Germany,issued warningsafter multiple European travellers were detained at the U.S. border, some for weeks. Others, including Denmark, Ireland, and the Netherlands,cautionedtransgender and nonbinary travellers about U.S. travel after Trump issued an executive order recognizing only two sexes, and several states have targeted trans people. Canada, too,warnedits citizens about potential delays, denial of entry, and device seizures. Some Canadians have alsolaunched a travel boycottof the U.S., after Trump repeatedly threatened to use “economic force” tomake Canada the 51st stateof the U.S.

Overseas travel to the U.S. has dropped 2.5% through April this year as compared to a year ago, Bloombergreported, with the largest drop of 10% happening in March after Trump announced tariffs on Canada, China, and Mexico. The World Travel & Tourism Councilestimatesthat the U.S. will lose out on $12.5 billion from tourism this year, although some suggest theshortfall could be as high as $29 billion.

Contact usatletters@time.com."
https://www.yahoo.com/news/investigating-claims-trump-admins-ice-013000018.html,2025-07-11 03:00:00,Investigating claims Trump admin's ICE funding surpasses Russia's military budget,"In the summer of 2025, a rumor spread online that lawmakers provided U.S. Immigration and Customs Enforcement with a larger budget than Russia gives its military. Although the numbers cited in these claims differed, most claimed ICE received roughly $170 or $175 billion.

However, total funding actually allocated to ICE was roughly $75 billion through September 2029 under U.S. President Donald Trump's One Big Beautiful Bill Act (OBBB) alongside a proposed — but not yet approved — base budget for the agency of $11.29 billion for fiscal year 2026. The $170 or $175 billion number appeared to come from estimates foroverallimmigration enforcement spending under the OBBB, not just funding specifically allocated to ICE.

These posts also alleged Russia's military budget was anywhere from $126 billion to $149 billion. Reputable think tanks estimated Russia's military funding at about $149 billion U.S. dollars in 2024 and $160 billion in planned spending for 2025.

Thus, potential ICE spending under the Trump administration for fiscal year 2026 did not surpass an estimate for Russia's planned military spending in 2025. However, it's possible the United States' overall immigration enforcement spending from Oct. 1, 2025, to Sept. 30, 2026, could exceed Russia's planned military budget in 2025. A direct comparison was not possible because the two countries use different budgeting timelines.

In the summer of 2025, a claim spread online that American lawmakers granted U.S. Immigration and Customs Enforcement (ICE) a bigger budget than Russia provided its military.

The rumor spread on platforms likeXandFacebook; while many claims included dollar amounts for both Russia's military and ICE, those numbers differed. For example, some posts alleged ICE received$175 billionin funding; others claimed the agency received$170 billionto spend. In comparison, claims listed Russia's military budget as anywhere from$126 billionto$149 billion.

These claims appeared to use legitimate — but outdated — sources to determine Russia's military budget while also conflating ICE's funding withestimatesfor overall immigration enforcement spending under U.S. President Donald Trump's tax and budget megabill known as the One Big Beautiful Bill Act (OBBA), which hesigned into lawon July 4, 2025.

A direct, entirely accurate monetary comparison of the two budgets was not possible, given differences in how the United States and Russia provide budget information — as well as theunstableexchange rate between Russia's currency, the ruble, and the American dollar, at least as of this writing.

However, potential ICE spending by Trump's administration for fiscal year 2026, which runs from Oct. 1, 2025 to Sept. 30, 2026, did not surpass reputable estimates for Russia's planned military spending in 2025. Still, it's possible that the United States' overall immigration enforcement spending in fiscal year 2026 could exceed Russia's potential military budget in 2025.

Snopes previouslydeterminedthe actual amount allocated to ICE under the Big Beautiful Bill andprovided contextfor a rumor that funds allocated to ICE exceeded spending for the U.S. Marine Corps.

Two major budget allocations were slated to be available to ICE for fiscal year 2026. The first was the base budget amount, known as the ""appropriations"" process. Although the presidentrequestedthese funds in May, as of this writing, the U.S. Congress had not yet approved his budget proposal. The Big Beautiful Bill, a budget ""reconciliation"" bill, was considered a supplement to the base budget.

The total proposedbase budgetfor ICE in fiscal year 2026 was $11.29 billion, according to the agency'sbudget requestdocument — an increase from $10.4 billion in fiscal year 2025 (seePage 5). According to the agency, the bulk of that amount, $10.88 billion, would need Congressional approval; the rest would come from fees, such as those imposed on travelers.

In addition to this base budget, ICE will receive another approximately $75 billion to remain available until Sept. 30, 2029, through theBig Beautiful Bill, as wepreviously reported.

There were two major provisions in the GOP bill allocating funds to ICE: the first provision, onPage 825, Section 90003, ""Detention Capacity,"" sent $45 billion to ICE specifically for immigration detention centers (emphasis ours):

SEC. 90003. DETENTION CAPACITY.

In addition to any amounts otherwise appropriated, there isappropriated to U.S. Immigration and Customs Enforcement for fiscal year 2025, out of any money in the Treasury not otherwise appropriated, toremain available until September 30, 2029,$45,000,000,000, for single adult alien detention capacity and family residential center capacity.

The second provision, starting onPage 904, appropriated $29.85 billion to ICE for the purposes of hiring, training, recruiting and retaining officers, facility upgrades, ""promoting family unity"" by keeping detained immigrants with their children, attorneys and legal staff, funding an office supporting victims of immigration crimes and ""fleet modernization"" — presumably a reference to updating ICE aircraft and vehicles.

SEC. 100052. APPROPRIATION FOR U.S. IMMIGRATION AND CUSTOMS ENFORCEMENT. In addition to amounts otherwise available, there is appropriated to the Secretary of Homeland Securityfor U.S. Immigration and Customs Enforcement for fiscal year 2025, out of any money in the Treasury not otherwise appropriated,$29,850,000,000, to remain available through September 30, 2029.

Add the two provisions together to arrive at $74.85 billion on top of the annual base budget proposed at $11.29 billion for fiscal year 2026. The Big Beautiful Bill also imposed additional fees on people facing various immigration enforcement actions, a portion of which would go to ICE's coffers (see pages 896 and 898 ofthe bill).

According to an April 2025publicationby theStockholm International Peace Research Institute, a highlyrespectedthink tank that collects global data on annual military spending, the ""planned total military expenditure in 2025"" for Russia was about 5.5 trillion rubles, equivalent to about $160 billion U.S. dollars — ""although the volatility of the exchange rate makes this estimate highly speculative,"" the institute warned onPage 8.

The actual amount spent, according to the institute'smilitary spending tracker, was about $149 billion U.S. dollars, assome claimsstated.

Aside from the constantly changing exchange rate for the ruble, it is also difficult to provide a direct comparison of Russia's spending with the ICE budget because in Russia budget yearsmatchwith calendar years, whereas in the United States budgets typically follow fiscal years. Fiscal year 2026, for example, runs from Oct. 1, 2025 to Sept. 30, 2026.

Furthermore, ICE'sbudget documentsdid not include how much the agency planned to budget from the Big Beautiful Bill's allocations for fiscal year 2026. As such, it was not possible to determine ICE's exact total annual budget, as the Big Beautiful Bill stipulated a single large infusion of money — the $75 billion — to remain available to the agency for multiple years, through Sept. 30, 2029.

Snopes asked ICE whether the agency can provide estimates for how much it planned to spend from Big Beautiful Bill allocations in fiscal year 2026 and awaits a response.

Still, adding the $74.85 billion (available over four years) to the proposed $11.29 billion (over one budget year) makes a total of $86.14 billion that could be allocated to ICE, far less than the $160 billion estimate for Russia's planned military spending in 2025.

Advocacygroupsandreputablenewsoutletshave made estimates ranging from$150 billionto $170 billionfortotal overall immigration enforcementspending under the Big Beautiful Bill. Alongside the $75 billion for ICE, the $150 billion-to-$175 billion amount would include, for example, U.S. Customs and Border Enforcement provisions, such as $46.55 billion allocated for the border wall and $4.1 billion to hire Border Patrol personnel (seePage 824).

U.S. Rep. Mark Harris, a Republican from North Carolina, also claimed in a July 3news releasethat the bill allocated $175 billion in ""new funding"" to ""finish securing the border."" Senate Budget Committee Chair Lindsey Graham, a Republican from South Carolina,reportedlytold journalists back in February that the Trump administration initially asked for $175 billion in immigration enforcement funding.

Snopes has not independently verified any of these estimates.

It is worth noting, however, that these $150 billion-to-$175 billion estimates were focused on the Big Beautiful Bill alone. In other words, they do not appear to encompasstotalamounts of spending on immigration enforcement. For instance, aside from the amount in the Big Beautiful Bill, the U.S. Department of Homeland Security requested $23 billion for U.S. Customs and Border Patrol's base budget (seePage 4).

U.S. lawmakers allocated $75 billion to ICE under the Big Beautiful Bill through Sept. 30, 2029, and Trump proposed an $11.29 billion base budget on top of that for fiscal year 2026, which Congress had not yet approved as of this writing. In contrast, a reputable think tank estimated Russia's planned military spending for 2025 at approximately $160 billion U.S. dollars, a figure subject to change due to the fluctuating exchange rate between Russian rubles and American dollars. Estimates foroverallimmigration spending, not just ICE's funding, ranged from $150 billion to $170 billion.

While direct comparisons are not possible because the two countries present financial information differently, ICE's potential budget for fiscal year 2026 does not exceed Russia's military budget for 2025. However, overall immigration enforcement spending in the United States for fiscal year 2026 could exceed the amount Russia's military might receive in 2025.

Information from Snopes' archives was included in this story.

""AILA Denounces Passage of Draconian Immigration Spending Bill: A $150 Billion Blueprint for Mass Deportation and Fear.""Aila.org, 1 July 2025, www.aila.org/library/aila-denounces-passage-of-draconian-immigration-spending-bill-a-150-billion-blueprint-for-mass-deportation-and-fear. Accessed 7 July 2025.

Aminu, Nasir. ""Russian Rouble Collapse Exposes Deep Problems in the Country's Economy.""The Conversation, 3 Dec. 2024, theconversation.com/russian-rouble-collapse-exposes-deep-problems-in-the-countrys-economy-244869. Accessed 8 July 2025.

Arrington, Jodey. ""Text - H.R.1 - 119th Congress (2025-2026): One Big Beautiful Bill Act.""Congress.gov, 2025, www.congress.gov/bill/119th-congress/house-bill/1/text. Accessed 7 July 2025.

Cooper, Julian. ""PREPARING for a FOURTH YEAR of WAR: MILITARY SPENDING in RUSSIA'S BUDGET for 2025.""Sipri.org, SIPRI Insights on Peace and Security, Apr. 2025, www.sipri.org/sites/default/files/2025-04/preparing_for_a_fourth_year_of_war-military_spending_in_russias_budget_for_2025.pdf. Accessed 8 July 2025.

Deng, Rae. ""Here's How Much the ICE Budget Would Increase under Trump's Megabill.""Snopes, Snopes Media Group, 2 July 2025, www.snopes.com/fact-check/ice-budget-big-beautiful-bill/. Accessed 8 July 2025.

Department of Homeland Security. ""Department of Homeland Security Fiscal Year 2026 Congressional Justification.""Department of Homeland Security, 25 June 2026, www.dhs.gov/sites/default/files/2025-06/25_0613_dhs_fy26-congressional-budget-justificatin.pdf. Accessed 7 July 2025.

Department of Homeland Security, and U.S. Customs and Immigration Enforcement.Budget Overview | Fiscal Year 2026 Congressional Justification. 25 June 2025, www.dhs.gov/sites/default/files/2025-06/25_0613_ice_fy26-congressional-budget-justificatin.pdf. Accessed 7 July 2025.

EXECUTIVE OFFICE OF THE PRESIDENT OFFICE OF MANAGEMENT AND BUDGET.Fiscal Year 2026 Discretionary Budget Request. 2 May 2025, www.whitehouse.gov/wp-content/uploads/2025/05/Fiscal-Year-2026-Discretionary-Budget-Request.pdf. Accessed 7 July 2025.

Federal State Statistics Service. ""PREFACE.""Archive.ph, 11 Feb. 2025, archive.ph/irONm. Accessed 8 July 2025.

Hesson, Ted. ""How the Republican Spending Bill Super-Charges Immigration Enforcement.""Reuters, 2 July 2025, www.reuters.com/world/us/how-republican-spending-bill-super-charges-immigration-enforcement-2025-07-02/. Accessed 8 July 2025.

Kapur, Sahil, et al. ""Trump's Border Czar Is 'Begging' for Money for Immigration Crackdown, Senate Budget Chief Says.""NBC News, 11 Feb. 2025, www.nbcnews.com/politics/congress/trump-border-czar-money-immigration-crackdown-graham-rcna191747. Accessed 8 July 2025.

Kim, Juliana. ""How Trump's Tax Cut and Policy Bill Aims to 'Supercharge' Immigration Enforcement.""NPR, 3 July 2025, www.npr.org/2025/07/03/g-s1-75609/big-beautiful-bill-ice-funding-immigration. Accessed 8 July 2025.

Pachico, Elyssa. ""Congress Approves Unprecedented Funding for Mass Deportation.""American Immigration Council, 1 July 2025, www.americanimmigrationcouncil.org/press-release/congress-approves-unprecedented-funding-mass-detention-deportation-2025/. Accessed 8 July 2025.

PBS News. ""4 Ways Trump's Big Bill Could Change the U.S. Immigration System.""PBS News, 25 June 2025, www.pbs.org/newshour/politics/4-ways-trumps-big-bill-could-change-the-u-s-immigration-system. Accessed 7 July 2025.

""Rep. Mark Harris Votes to Advance the One Big Beautiful Bill.""Congressman Mark Harris, 3 July 2025, markharris.house.gov/media/press-releases/rep-mark-harris-votes-advance-one-big-beautiful-bill. Accessed 8 July 2025.

""Russia's New Budget Law Signals Determination to See the War in Ukraine Through, according to New SIPRI Analysis | SIPRI.""Www.sipri.org, 13 Dec. 2023, www.sipri.org/media/press-release/2023/russias-new-budget-law-signals-determination-see-war-ukraine-through-according-new-sipri-analysis. Accessed 8 July 2025.

Senate Budget Committee.""One Big Beautiful Bill Act"". www.budget.senate.gov/imo/media/doc/the_one_big_beautiful_bill_act.pdf. Accessed 1 July 2025.

Stockholm International Peace Research Institute. ""About SIPRI | SIPRI.""Sipri.org, www.sipri.org/about. Accessed 8 July 2025.

---. ""SIPRI Military Expenditure Database.""Sipri.org, milex.sipri.org/sipri. Accessed 8 July 2025.

University of Pennsylvania. ""Guides: Public Policy Research Think Tanks 2019: Top Think Tanks - Worldwide (US and Non-US).""Guides.library.upenn.edu, guides.library.upenn.edu/c.php?g=1035991&p=7509972. Accessed 8 July 2025.

Ward, Myah. ""Trump Got $170 Billion for Immigration. Now He Has to Enact It.""POLITICO, Politico, 5 July 2025, www.politico.com/news/2025/07/05/trump-got-170-billion-for-immigration-now-he-has-to-enact-it-00439785?experience_id=EXYF89KVT5UQ&template_id=OTJIR2CRKUD6&template_variant_id=OTV1GDUJ5B1ZS&utm_content=topic/politics&utm_source=flipboard?is_magic_link=true. Accessed 8 July 2025."
