URL,Date,News_title,News_text
https://www.yahoo.com/news/genetics-not-just-parenting-skills-160521855.html,2025-07-08 16:45:00,"Genetics, not just parenting skills, decide how long your baby cries","How much a baby torments its parents with its cries is determined by its genes and not just parenting techniques, new research has shown.

After a study on hundreds of twins, a team of scientists in Sweden has concluded that how long a baby cries for is largely determined by genetic factors and not only its wellbeing.

The child's sleep quality and ability to be soothed during its first few months are also influenced by genetic predisposition.

""For parents, it may be a comfort to know that their child’s crying is largely explained by genetics, and that they themselves have limited options to influence how much their child cries,"" said study leader Charlotte Viktorsson from Uppsala University in Sweden.

The team's analysis is based on questionnaires completed by the parents of 998 same-sex identical or fraternal twins when the children were two months and five months old.

Among other things, the parents were asked how long the children cried, how often they woke up at night, and how long it took to calm them down. Twins were chosen because they share key factors such as the home environment, family situation and socioeconomic status, which also influence crying behaviour.

Identical twins develop from a single egg cell and therefore have identical genetic material (DNA), while fraternal twins are as genetically different as siblings born in different years. If identical twins are more similar in a particular trait than fraternal twins, we can infer that genetics play a role in the expression of that trait.

On average, more than an hour of crying every day

The survey revealed immense individual differences. For example, some children woke up as many as 10 times a night, while others almost never did.

On average, the twins cried for about 72 minutes daily at the age of two months, woke up more than twice a night and took about 20 minutes to calm down each time. By the age of five months, the average crying duration had decreased to 47 minutes, but the twins still woke up twice a night and took about 14 minutes to calm down.

However, it should be noted that a ""sibling effect"" may come into play: If one twin starts crying, the other often joins in. If both cry, it can take longer for them to calm down.

The clearest evidence for a predominantly genetic basis was found for the duration of crying. At the age of two months, genetics explained about 50% of how much the children cried, according to the study published in the journal JCPP Advances. By the age of five months, this figure had risen to 70%.

The number of night-time awakenings, however, was found to be far less influenced by genetics. Factors such as sleep routines and the environment in which the child sleeps could play a more significant role, the researchers suggested. However, the study does not allow conclusions to be drawn about particularly effective methods for addressing these issues.

When it comes to soothing, the environment appears to have a strong influence only in the first months of life. By the age of five months, the ability to be soothed was primarily determined by genetics, according to the survey data.

The researchers acknowledged limitations, noting that the data is based on parental reports and may not accurately reflect sleep and behaviour. Additionally, the results cannot automatically be applied to single children due to the interaction between twins and the higher demands placed on parents by having two babies. Both factors influence the measured outcomes.

However, an initial sample found no significant differences between twins and single children in terms of crying and soothing behaviour, although there were differences in the number of awakenings. Interestingly, twins woke up less frequently than single children.

The researchers did not explore potential reasons for this unexpected difference. It is possible that a baby feels more secure when its ever-present twin is sleeping nearby, or that it is less easily startled by night-time noises due to its busy environment.

How to soothe a crying baby in 13 minutes

Some time ago, another research team investigated how to calm babies most quickly and developed a minute-by-minute guide.

Parents were told to hold their crying child close to their body and walk at an even pace for about five minutes, avoiding abrupt movements, the researchers explained in the journal Current Biology. Once the baby has fallen asleep, parents should sit with the child for about eight minutes before laying it down to sleep.

The team also provided an explanation for the calming effect of walking: the so-called transport response. This innate effect is observed in many young mammals, such as mice and monkeys that are not yet able to care for themselves. The young animals calm down and their heart rate decreases when they are picked up and carried."
https://www.yahoo.com/news/flash-flood-warning-place-franklin-190430969.html,2025-07-14 21:15:00,Update: Flash flood warning in place for Hampden and Hampshire counties until Monday night due to thunderstorms,"An updated flash flood warning was issued by the National Weather Service on Monday at 5:55 p.m. in effect until 9 p.m. for Hampden and Hampshire counties.

""At 5:55 p.m., Doppler radar indicated thunderstorms producing heavy rain across the warned area. Between 1.5 and 2 inches of rain have fallen. Flash flooding is ongoing or expected to begin shortly,"" states the weather service. ""Flash flooding of small creeks and streams, urban areas, highways, streets and underpasses as well as other poor drainage and low-lying areas.""

Locations impacted by the warning include Southampton, Huntington, Russell, Westhampton, Chester, Blandford, Chesterfield, Worthington, Montgomery and Middlefield.

According to the weather service, ""Turn around, don't drown when encountering flooded roads. Most flood deaths occur in vehicles.""

Flash flood warning: Take action!

A flash flood warning is issued when a flash flood is either imminent or already occurring. In flood-prone areas, it's crucial to move immediately to higher ground. A flash flood is a sudden and violent inundation that can develop within minutes to hours, and it can even happen in areas not currently experiencing rainfall.

Flood warning: Take action!

A flood warning is declared when flooding is on the verge of happening or is already underway.

Flood advisory: Be aware:

A flood advisory is issued when flooding is not expected to be bad enough to issue a warning. However, it may cause significant inconvenience, and if caution is not exercised, it could lead to situations that may threaten life and/or property.

Flood watch: Be prepared:

A flood watch is issued when conditions are favorable for flooding. It does not mean flooding will occur, but it is possible.

In flood-prone regions or while camping in low-lying areas, understanding and following the weather service flood safety guidelines can be a lifesaver:

Move to higher ground:

If you reside in a flood-prone region or are camping in low-lying terrain, the first step to safety is relocating to higher ground.

Follow evacuation orders:

If local authorities issue an evacuation order, heed it promptly. Prior to leaving, secure your home by locking it.

Disconnect utilities and appliances:

If time allows, disconnect your utilities and appliances. This reduces the risk of electrical hazards during flooding.

Avoid basements and submerged areas:

Steer clear of basements or rooms where water has submerged electrical outlets or cords. This helps prevent electrical accidents.

Swift evacuation for your safety:

If you notice sparks or hear buzzing, crackling, snapping, or popping noises, evacuate immediately. Avoid any water that may be charged with electricity.

Stay away from floodwaters:

Never attempt to walk through floodwaters. Even just 6 inches of swiftly moving water can forcefully knock you off your feet.

Seek higher ground when trapped:

In the event you become trapped by moving water, make your way to the highest point available and contact emergency services by calling 911.

During heavy rainfall, there is a risk of flooding, especially in low-lying and flood-prone areas. Remember to never drive through water on the road, even if it seems shallow. According to the weather service, as little as 12 inches of rapidly flowing water can carry away most cars. Stay safe by being prepared and informed.

When heavy rain pours, the risk of flooding and treacherous roads rises. Here's your guide from the weather service to staying safe during downpours:

Beware of rapid water flow:

In heavy rain, refrain from parking or walking near culverts or drainage ditches, where swift-moving water can pose a grave danger.

Maintain safe driving distances:

Adhere to the two-second rule for maintaining a safe following distance behind the vehicle in front of you. In heavy rain, allow an additional two seconds of distance to compensate for reduced traction and braking effectiveness.

Slow down and drive with care:

On wet roads, slowing down is paramount. Gradually ease off the accelerator and avoid abrupt braking to prevent skidding.

Choose your lane wisely:

Stick to the middle lanes to minimize the risk of hydroplaning. Outer lanes are more prone to accumulating water.

Prioritize visibility:

Enhance your visibility in heavy rain by activating your headlights. Be particularly vigilant for vehicles in blind spots, as rain-smeared windows can obscure them.

Watch out for slippery roads:

The initial half-hour of rain is when roads are slickest due to a mixture of rain, grime, and oil. Exercise heightened caution during this period.

Keep a safe distance from large vehicles:

Don't follow large trucks or buses too closely. The spray created by their large tires reduces your vision. Take care when passing them as well; if you must pass, do so quickly and safely.

Mind your windshield wipers:

Heavy rain can overload the wiper blades. When visibility is so limited that the edges of the road or other vehicles cannot be seen at a safe distance, it is time to pull over and wait for the rain to ease up. It is best to stop at rest areas or other protected areas.

When stopping by the roadside is your only option, position your vehicle as far off the road as possible, ideally beyond guardrails. Keep your headlights on and activate emergency flashers to alert other drivers of your position.

By following these safety measures, you can significantly reduce risks and ensure your well-being when heavy rain pours down. Stay informed about weather conditions and heed advice from local authorities to make your journey safe and sound.

Advance Local Weather Alerts is a service provided by United Robots, which uses machine learning to compile the latest data from the National Weather Service.

Read the original article onMassLive."
https://finance.yahoo.com/news/600m-bullish-bets-liquidated-bitcoin-020943263.html,2025-08-02 07:30:00,Yahoo Finance,"Crypto markets experienced a sharp bout of volatility over the past 24 hours, with more than $630 million in leveraged positions liquidated across exchanges.

The bulk of the damage came from longs, which accounted for over $580 million of total liquidations, as traders were caught offside during an abrupt intraday sell-off.

Bitcoin (BTC) dropped to $115,200, erasing some of its recent gains but still maintaining a relatively stable posture compared to other majors. Its dominance rose slightly as altcoins bore the brunt of the correction.

Ether (ETH) fell to $3,687, while XRP (XRP) retraced under $3 despite strong recent headlines. Solana (SOL) pulled back to $170, and BNB (BNB) eased to $780 after a record run last week that punted it above $855.

Coinglass data shows the largest single liquidation was a $13.7 million ETH long on Binance.

Liquidations occur when traders using leverage (borrowed funds) are forcibly closed out of their positions because their collateral falls below required maintenance thresholds. This typically amplifies price volatility, especially in short timeframes, as liquidated positions create sudden selling or buying pressure depending on the side of the trade.

For traders, liquidation data provides insight into market sentiment and risk of positioning. High liquidation totals — particularly concentrated in one direction (e.g., longs) — often signal overextended positioning. This can indicate possible inflection points or impending reversals as the market resets.

Tracking real-time liquidation heatmaps and funding rates can help traders identify areas of forced selling or buying, often around key support/resistance levels, time entries or exits during high-volatility zones and gauge market leverage and risk-on/off behavior

Speculative altcoins were particularly affected. Solana-ecosystem tokens such as Fartcoin (FART), Pump.fun (PUMP) and Jupiter (JUP) all faced steep intraday corrections.

“We observe that tokens like Fartcoin and Pump.fun are less aligned with broader market beta and more reflective of high-volatility, sentiment-driven microcycles,” said Ryan Lee, Chief Analyst at Bitget, said in a Telegram message.

“The recent corrections — FART dropping 14% to retest its 100-day EMA near $1, JUP losing support at its 200-day EMA, and PUMP continuing its slide within a descending channel — appear to stem from profit-taking and waning short-term momentum, not from a systemic market shift.”

Lee added that Bitcoin’s relative strength, supported by ETF inflows and macroeconomic stability, reinforces the view that the pullback is isolated, not broad-based.

Bitcoin holding above $115,000 remains the market’s anchor. Unless that level breaks, the broader structure stays intact."
https://www.yahoo.com/news/articles/ash-cloud-hovers-over-sicilian-153138555.html,2025-08-26 16:00:00,Ash cloud hovers over Sicilian holidays as Mount Etna erupts again,"Mount Etna has once again erupted, meaning potentially major consequences for anyone visiting the popular holiday island of Sicily in the coming days.

The Italian Institute of Geophysics and Volcanology (INGV) reported strong ash emissions from the volcano's summit craters on Monday, prompting authorities to raise the highest alert level for air traffic.

Mount Etna, which rises to more than 3,300 metres, is Europe's largest active volcano. It erupts regularly and is under constant monitoring, with its spectacular displays attracting large numbers of spectators.

Catania's international airport remains open for now, as of Tuesday. However officials are recommending travellers check with airlines to determine whether the volcanic eruption is affecting already booked flights. Travellers can also find updates on theCatania Airport website.

A package holiday booked in the EU can also be cancelled without incurring fees if it is significantly disrupted by extraordinary circumstances. However this requires that the holiday destination is directly affected by the volcanic eruption.

Italy'sNational Institute of Geophysics and Volcanologyoffers detailed updates on the activity of Italian volcanoes (in English and Italian), covering Mount Etna and the Stromboli volcano on the island of the same name.

Experts generally advise regularly checking online resources like these before travelling to a volcanic region. Your country's foreign ministry will likely also offer advisories and travel warnings for your destination.

In many countries, national authorities provide warnings and information about natural hazards on their websites, often in English. Additionally, holidaymakers can ask for specific advice at hotel receptions or from their hosts.

Mount Etna had already erupted in June, with a huge column of smoke causing days of cancellations before the local airport could reopen.

There are over 1,500 active volcanoes worldwide, some of which are located in holiday regions. As such, volcanic eruptions are not uncommon, and for some intrepid travellers they are even reason to fly to a destination, not avoid it."
https://www.yahoo.com/news/articles/towering-yellowstone-geyser-little-indicator-171710586.html,2025-09-09 18:00:00,View towering Yellowstone geyser's 'little indicator' before eruption,"The Beehive Geyser in Yellowstone National Park is known for its towering eruptions, but also its irregularity in terms of when these eruptions occur.

But as theYellowstone Safari Companyexplained Tuesday via social media, there's a ""little indicator"" that signals an impending eruption.

The accompanying footage shows the indicator becoming active before the main event.

RELATED: Yellowstone tourist has tough choice during close bison encounter

The company explained: “If you see that little spout start spitting water, that means that any time within the next 20 minutes, you will be treated to a geyser eruption that is both longer and taller than Old Faithful!”

According to the park,Beehive Geyseris a “favorite performer” in the Upper Geyser Basin, but only erupts once or twice per day at unknown times.

Eruptions typically last 4-5 minutes, and water columns can shoot 150-200 feet, so it’s quite a show.

This article originally appeared on For The Win:Yellowstone's Beehive Geyser has 'indicator' to signal impending eruption"
https://www.yahoo.com/news/crucial-years-guides-parents-puberty-194110061.html,2025-07-13 22:30:00,‘The Crucial Years’ guides parents on puberty and mental health,"SHREVEPORT, La. (KTAL/KMSS) – Most people would say that raising kids when they are 12-14 years old is one of the toughest periods of parenting, but what if it didn’t have to be?

Dr. Sheryl Gonzalez Ziegler, Psy.D., an acclaimed expert in children’s mental health, explores how to lay the foundation for your child’s teenage years in her book, “The Crucial Years: The Essential Guide to Mental Health and Modern Puberty in Middle Childhood.”

Astrology and self-discovery: A guide to understanding your birth chart

The “crucial years,” which Dr. Ziegler refers to as the “forgotten years,” are ages 6-12 and sometimes go overlooked in terms of child development. What some parents don’t realize is that children at this age are still heavily influenced by their parents, despite no longer being toddlers.

“It’s the perfect time to actually instill the things that matter to you, where your kid will soak it up,” Dr. Ziegler said. “Then, as they enter those teen years, they’ll be prepared for the things you’ve been warning them about or teaching them because they got the information when their brain was ripe for listening to you.”

One of the biggest topics in Dr. Ziegler’s book is teaching children to regulate their emotions, which means the ability to handle and calm themselves amid an event. Self-regulation can provide several short- and long-term mental health benefits, and can be achieved by learning what your children’s “window of tolerance” is.

“We all have a window of tolerance, what we can tolerate,” Dr. Ziegler said. “Think about it when you’re traveling. The flight got delayed once, a little frustrating. The flight is now cancelled…For a lot of people, that’s outside of their window. Now they’re angry, they’re cursing, they’re calling people, they’re in someone’s face. They’re outside of the window of tolerance. That’s what life is like for a lot of kids.”

Shreve Library’s summer program highlights native wildlife

Dr. Ziegler uses several visual metaphors in her book, including the “volcano” and the “iceberg,” to help children visualize their feelings.

“The anger volcano…we have lava that bubbles underneath the surface and then eventually…it erupts,” Dr. Ziegler said. “When we have the eruption, it’s not just at the person that you’re mad at. It goes everywhere.

“The iceberg is all the stuff we can’t see under the surface. This is perfect for the kid who comes in, does their work, and seems happy…What was under the surface was, ‘I felt like a loser. I felt like nobody liked me. I felt like I was dumb.’ It’s truly like the tip of an iceberg, and then all the water underneath to let them know nobody can see what’s under there.”

Dr. Ziegler also cautions parents not to blame kids specifically for when they misbehave, but rather the factors that led them to lash out or cause trouble.

Shreveport orgs. collect donations for Texas flood victims

“We use those words like ‘always’ and ‘never,'” Dr. Ziegler said. “They’re powerful words that can instill in a kid, ‘See? I’m a bad kid. My parents say I always ruin dinner. I always do this. I never help.’ Remember, 6-12, they’re like sponges and they’re taking it in.”

When it comes to putting pressure on children, studies have found that students whose parents value achievement more than kindness do worse academically and socially.

“When kids get the message of ‘You need to be a straight-A student,’ what they hear is, ‘I only have value, you only love me if I get straight-A’s,” Ziegler said. “Versus if you say to them, ‘Kindness is above everything. Everything else will fall into place in life, but what’s most important is that you care about your neighbors, that you care about your friends, that you’re an upstander.’

“When we are happy human beings, we tend to do well in other areas of our lives. When we are pressured human beings, we tend to crumble. We tend to make mistakes because we feel nervous and anxious.”

Shreveport non-profit feeling impact of tariffs and federal cuts

One chapter that Dr. Ziegler wanted to highlight was “Preteens and Success,” which talks about screen time and its effects on children.

“I do think that today’s child honestly can’t be fully successful until they manage a healthier digital life,” Dr. Ziegler said. “It’s not an anti-screens chapter. It gives you the data that I think is important and specifically focused on 6-12 year olds, which is unique. There are some truly detrimental outcomes from them. However, they are part of our lives. So, here are some things you can do to set up boundaries, restrictions, and monitoring conversations.”

You can read that chapter and more in Dr. Ziegler’s new book, “The Crucial Years,” available onAmazon,Barnes & Noble, and other retailers.

Copyright 2025 Nexstar Media, Inc. All rights reserved. This material may not be published, broadcast, rewritten, or redistributed.

For the latest news, weather, sports, and streaming video, head to KTALnews.com."
