URL,Date,News_title,News_text
https://www.yahoo.com/news/american-apparel-welcomed-employees-vibrator-223647281.html,2025-07-09 04:30:00,American Apparel Welcomed New Employees With a Vibrator,"Before its infamous collapse,American Apparelwas a cultural force of the mid-2000s. The clothes were colorful, the ads were provocative, and the brand marketed itself as progressive with its proud motto: “Ethically Made, Sweatshop Free.”

But behind the scenes, beneath the indie sleaze and moral posturing, the company was quietly imploding. Now, thanks toNetflix’snew documentary anthologyTrainwreck, people finally have an inside look at what brought this once billion-dollar corporation to its knees.

Here are the most shocking revelations fromThe Cult of American Apparel:

FounderDov Charneywasn’t just building a brand—he was creating a look.

Former employees say they were hired on the spot simply because of their appearance: “I’m tall and skinny,” said one. Another claimed their “hipster meets bike messenger” style got them hired. In some cases, people with no fashion background were placed in senior roles.

Yes, it’s true.

New hires reportedly received Hitachi wand vibrators as part of their employee welcome kits.

A safe working environment? Not exactly American Apparel’s thing.

Charney didn’t just have a proclivity for sexual perversion; He also loved verbally abusing his staff!

Every week, he would hold mandatory company wide calls, during which he nominated a “fool of the week”—an employee who he believed “screwed him over.”

The whole thing was basically an exercise in ritualistic shaming.

Former American Apparel employees claim that they worked insane hours.

“On one two-week period, on top of the 80 hours that I worked, there was another 120-something hours of overtime I clocked,” Carson, one of the documentary’s subjects, said.

Charney reportedly treated Robert Greene’sThe 48 Laws of Powerlike gospel.

The book outlines how to manipulate and dominate in business and life, which people claim heavily influenced Charney’s leadership style.

When the company went public in 2007, he even appointed Greene to the board

By 2014,several womenhad accused Charney of sexual harassment. However, many employees were bound by contracts that funneled complaints into private arbitration, shielding the company from public lawsuits.

The Civil rights attorneyToni Jaramilla, who was featured in the documentary, explained: “It started with one woman, then another. In doing our due diligence, we found more who had experienced the same thing.”

Following a formal investigation, Charney was ousted for sexual harassment, discrimination, and misuse of company funds.

Today, American Apparel lives on in name only. It exists as a fully online store owned by Canadian manufacturer Gildan Activewear. But the brand’s cultural relevancy has long vanished, and along with it, so too has the “cult” that once surrounded it."
https://www.yahoo.com/news/gaza-authorities-suspend-key-services-192634283.html,2025-07-13 20:30:00,Gaza authorities suspend key services due to Israeli fuel blockade,"A fuel crisis in Gaza, caused by an Israeli blockade, has forced several municipalities to suspend key services, such as waste collection and sewage treatment, threatening to exacerbate disease and suffering in the war-torn territory.

In a joint statement, the affected municipalities in central and southern Gaza said they have had to halt these services because of Israeli restrictions on the import of petrol and diesel into the coastal strip.

The statement, which was signed by the municipal authorities of Khan Younis and Rafah, among others, also said that equipment for clearing rubble could not be used due to fuel shortages, and that wells had been closed.

The authorities said their attempts to secure fuel through international organizations had proven unsuccessful.

Much of Gaza lies in ruins after over 21 months of Israeli attacks, with many Palestinians living in severely overcrowded conditions.

A group of seven UN organizations providing humanitarian aid in Gaza warned on Saturday of the catastrophic consequences of the impending fuel shortage.

""Without adequate fuel, Gaza faces a collapse of humanitarian efforts,"" said a statement issued by the organizations, which include the United Nations Relief and Works Agency for Palestine Refugees (UNRWA) and the World Health Organization.

In hospitals, the lights are already going out, maternity and intensive care units are failing and ambulances are no longer able to respond to calls, the organizations said.

They stressed that bakeries and community kitchens, which feed the sealed-off territory's starving population, also depend on fuel to operate, as do water treatment and sewage plants.

""These conditions expose families to deadly disease outbreaks and push Gaza's most vulnerable even closer to death,"" the statement said.

Israel has been waging a relentless war in Gaza against Hamas since the Palestinian Islamist group and its allies launched unprecedented attacks on southern Israel on October 7, 2023.

Israel controls all access to the Gaza Strip and has severely restricted the entry of humanitarian supplies, including fuel.

Israeli officials have repeatedly claimed that the minimum amounts of fuel required are reaching Gaza."
https://www.yahoo.com/news/recent-orleans-building-collapse-reignites-225902547.html,2025-07-15 01:00:00,Recent New Orleans building collapse reignites need for engineer,"NEW ORLEANS (WGNO) — Brick by brick, building collapses in New Orleans have become an all too regular occurrence.

Just last week, part of ahistoric buildingon St. Louis Street came crashing down.

“No one wants to see buildings collapse. Buildings collapse for lots of different reasons,” said Director of the Office of Community and Economic Development Jeffrey Schwartz.

New Orleans advocates push for bike safety following bicyclist’s death

City of New Orleans Chief Building Official Jay Dufour says the building was already being monitored by the owners.

“Trying to get them into restoring, their brick, and then it got to the point where on doing that, while they were doing it, they had you know, quite a lot of bricks fall down on the sidewalk,” said Dafour.

Collapses often result in street closures, something Councilwoman Lesli Harris says causes all sorts of other problems.

“It’s always an interruption of our city service is and luckily, nobody was injured when it happened. But I do mourn, as you said, the loss of Maypop and some other businesses that had to shutter because of this,” Harris said.

In January, the city council approved bringing in an engineer to help address building collapses. However, the job is still open six months later.

Orleans Parish Coroner’s Office autopsies paused citing air conditioning outage

Councilman Oliver Thomas believes that if a survey of the building is done it’ll show how vibration plays a part in the collapses.

“Perpetual potholes, when you have infrastructure that is so unstable. Your car has to roll over it or around it, you are creating a certain amount of vibration that permeates through the infrastructure to the buildings,” Thomas said.

Determined to find a solution, Harris says another approach is necessary to see that an engineer is hired.

“We’re going to have to take another look at that and see how much if we need to increase the RFP. If we can publicize this more widely, via social media and other means rather than what we do currently,” Harris said.

WGNO reached out to the city about the challenges of finding an engineer but has not heard back.

Stay up to date with the latest news, weather and sports by downloading the WGNO app on theAppleorGoogle Playstores and by subscribing to theWGNO newsletter.

Caitlin Clark to miss WNBA All-Star Game, 3-point contest: ‘Incredibly sad and disappointed’

Airfare by algorithm: Delta leans into AI pricing — but is it a good thing?

New Jersey teacher gifted scratch-offs wins $500,000: ‘Life-changing’

Man who sent ‘So I raped you’ Facebook message pleads guilty to 2013 sexual assault

LGBTQ+ mental health hotline shuts down

Copyright 2025 Nexstar Media, Inc. All rights reserved. This material may not be published, broadcast, rewritten, or redistributed.

For the latest news, weather, sports, and streaming video, head to WGNO."
https://www.yahoo.com/news/russia-ukraine-trade-drone-strikes-152601840.html,2025-07-06 15:45:00,Russia and Ukraine trade drone strikes as Kyiv signs deals to boost drone production,"Russia and Ukraine struck each other with hundreds of drones on Sunday, throwing Russian air travel in disarray, shortly after Ukrainian President Volodymyr Zelenskyy announced deals with Western partners that would allow Kyiv to scale up drone production.

Photos circulating on social media showed crowds huddling at Russian airports including key international hubs in Moscow and St. Petersburg, as hundreds of flights were delayed or canceled due to Ukrainian drone strikes on Saturday and overnight, according to Russia’s Transport Ministry.

The flight disruptions hit Moscow’s Sheremetyevo and St. Petersburg’s main Pulkovo airports. Other airports in western and central Russia also faced disruptions.

Russian air defenses shot down 120 Ukrainian drones during the nighttime attacks, and 39 more before 2 p.m. Moscow time (1100 GMT) on Sunday, Russia’s Defense Ministry said. It did not clarify how many had hit targets, or how many had been launched in total.

Early on Sunday, Ukrainian drones injured two civilians in Russia’s Belgorod region near the border, its Gov. Vyacheslav Gladkov said.

Russia pounded Kyiv last week

The Ukrainian attacks came just days after Russia pummelled Kyiv with waves of drones and missiles overnight into Friday, in what Ukrainian officials called the largest such strike since Moscow’s all-out invasion. The seven-hour onslaught killed at least two civilians, wounded dozens more and caused widespread damage, Ukraine said, while Moscowramped up its pushto capture more of its neighbor’s land.

In total, Russia launched 550 drones and missiles across Ukraine that night, according to the country’s air force. The barrages have coincided with a concerted Russian effort to break through parts of the roughly 1,000-kilometer (620-mile) front line, where Ukrainian troops are under severe pressure.

Large-scale Russian drone strikes on Sunday injured three civilians in Kyiv and at least two in Kharkiv, Ukraine’s second-largest city in the northeast, officials said. A Russian attack involving Shahed drones also targeted port infrastructure in Mykolaiv in central Ukraine, according to local Gov. Vitaliy Kim. He reported warehouses and the port’s power grid were damaged but there were no casualties.

Hours later, Russia launched a glide bomb and a drone at the front-line town of Kostyantynivka in eastern Ukraine, killing four civilians and injuring a fifth, the prosecutor’s office said. The drone struck a car in which a married couple were travelling, killing the 39-year-old woman and 40-year-old man on the spot, it said.

Ukraine seeks to ramp up drone production

Zelenskyy said on Saturday that Ukraine had inked deals with European allies and a leading U.S. defense company to step up drone production, ensuring Kyiv receives “hundreds of thousands” more this year.

Zelenskyy did not name the U.S. business in his nightly video address to Ukrainians, but said Ukraine and Denmark have also agreed to co-produce drones and other weapons on Danish soil.

His remarks came days after the U.S.paused some shipments of military aidto Ukraine, including crucial air defense missiles. Ukraine’s main European backersare considering howthey can help pick up the slack. Zelenskyy said plans are afoot to build up Ukraine’s domestic arms industry, butscaling up will take time.

Ukraine has previously used homemade drones to hit high-value military targets deep inside Russia, demonstrating its capabilities and denting Moscow’s confidence. Last month,Kyiv said it destroyed more than 40 Russian planesstationed at several airfields deep inside Russia in a surprise attack.

Outmanned and outgunned, Ukraine’s army has also turned to drones to compensate for its troop shortage and shore up its defenses. While Russia hasramped up offensivesthis summer on two fronts in Ukraine, analysts say the front isn’t about to collapse.

On Friday, Zelenskyy said he had a “very important and productive” phone call that day with U.S.President Donald Trump, discussing possible joint drone production alongsideU.S-led efforts to end the war.

Speaking to reporters on Sunday, Trump described the call as “good”.

“He’s been hit very hard, as I said he would. He’s been hit very hard,” he said.

___

Michelle L. Price contributed to this report from Washington, DC.

Follow AP’s coverage of the war in Ukraine athttps://apnews.com/hub/russia-ukraine"
https://www.yahoo.com/news/east-texas-firefighters-deployed-help-010630940.html,2025-07-06 03:45:00,East Texas firefighters deployed to help central Texas flood victims,"TYLER, Texas (KETK) – As officials continue to try and help survivors of catastrophic flooding, several East Texas firefighters from Smith County and Lufkin have been deployed to assist in central Texas.

Here’s how to help flood survivors in Central Texas

Severe flooding has been reported in several counties in central Texas this weekend. In Kerr County, theKerr County Sheriff’s Officesaid 84 people have been found dead from the floods, including 56 adults and 28 children as of 2 p.m. on Monday.

The Longview Fire Department has deployed eight members from their Water Rescue Team as a part of the Texas A&M Task Force 1. The members have been in Kerrville since Friday and include one water group supervisor, one technical support specialist and a six person Swiftwater Rescue Team.

“Our members have been working in the Kerrville area since the early morning of July 4th. They were able to perform multiple rescues of people trapped in trees, vehicles and debris in some very difficult and dangerous conditions as a result of the catastrophic flooding,” the Longview Fire Department said. “They continue to work tirelessly alongside our many response partners from throughout the state and nation in support of Search and Rescue operations to locate those still missing.”

The Lufkin Fire Department deployed Engine 3 to Central Texas with captains Petty and Grace and firefighters Jernigan and Maskunas, as a part of theTIFMASprogram. The crew left just before 12 p.m. on Saturday in order to meet with other departments that are gathering together to form a strike team.

‘It was like a dam broke’: Kerr County flood survivors begin recovery process

On Friday, the Lufkin Fire Department also deployed Driver-Operator Byrum and Firefighter Barnes as a part of the Emergency Medical Task Force that’s assisting residents of central Texas.

Smith County Emergency Services District 2 said a member of their district was deployed to Llano on Friday to assist in search and rescue operations there. The district member was activated by the Texas State Operations Center as a part of the Texas A&M Task Force 2.

You can now stream KETK and FOX51 News live 24/7 on your smart TVwith KETK+,our brand-new app! No antenna, cable, or satellite needed—watch for free, anytime.Just download it on your Roku, Apple TV, or Fire TV and start streaming.

Copyright 2025 Nexstar Media, Inc. All rights reserved. This material may not be published, broadcast, rewritten, or redistributed.

For the latest news, weather, sports, and streaming video, head to KETK.com | FOX51.com."
https://www.yahoo.com/news/lightning-interrupts-bridal-shoot-no-165656647.html,2025-07-04 17:30:00,Lightning Interrupts Bridal Shoot with 'No Warning' as Photographer and Her Son Felt 'Electricity' in Legs: 'Lucky to Be Alive',"Brianna Pendley Photography

A group taking photos ahead of a wedding wound up in a local hospital after their bridal shoot was interrupted by a surprise lightning storm

North Carolina photographer Brianna Pendley, her son, bride Katie McDaniel and a friend were at Carvers Gap on Roan Mountain on Tuesday, July 1, when the storm began

""We were huddled in a small circle kinda laughing at what had just happened, then within literal milliseconds we were on the ground screaming,"" Pendley wrote on Facebook

A North Carolina photographer, her son and a soon-to-be bride ended up in the hospital after their bridal shoot was interrupted by a surprise lightning storm this week.

On Tuesday, July 1, Brianna Pendley was taking bridal photos for Katie McDaniel ahead of her wedding this month, when a thunderstorm quickly broke out at Carvers Gap on Roan Mountain, near the Tennessee border.

Pendley, who was joined by her young son Landry and a friend during the shoot, wrote onFacebookthat the group decided to head back down once they spotted rain, before it started ""violently hailing."" While in ""full-survival mode,"" the group opted to take shelter under trees.

Brianna Pendley Photography

Both Pendley and McDaniel also detailed the ordeal to NBC affiliateWCNCand ABC affiliateWSOC.

""We were huddled in a small circle kinda laughing at what had just happened, then within literal milliseconds we were on the ground screaming because lightning had struck the tree/ground that we were under,"" the photographer wrote on Facebook. ""I felt the electricity in my feet and legs, and saw smoke coming from the ground so I knew it wasn’t good.""

Never miss a story — sign up forPEOPLE's free daily newsletterto stay up-to-date on the best of what PEOPLE has to offer​​, from celebrity news to compelling human interest stories.

After seeing her son ""laid over to one side,"" the photographer and the rest of the group ran down the mountain ""covered in dirt,"" she revealed. ""Once the initial strike happened and we immediately fell to the ground, my first instinct was we got to get out of there,"" McDaniel told WCNC. ""I thought the tree was going to fall when the lightning struck it. I heard the cracking.""

Brianna Pendley Photography

""It was so quick that we literally went from standing to on the ground in the middle of a second,"" Pendley, who recalled seeing a ""very loud"" flash and ""smoke"" coming from the ground, added. ""If it would have killed us, we probably wouldn't know what happened.""

On the way down, the women and boy encountered another group on the mountain who said they ""heard the crying and screaming and were concerned,"" Pendley wrote on Facebook. During their visit to the hospital, the women and the child were told they were ""lucky to be alive because something like this normally ends in less fortunate outcomes.""

Both McDaniel and Landry sustained welts from the strike but the group was ""overall"" OK, Pendley wrote.

Pendley told WSOC that there was “no warning"" and ""no thunder"" ahead of the sudden storm. “It’s so unpredictable,” she said. “It happened like that. The storm was over in five minutes, and I don’t know if I’m going to be much of a hiker after that.”

As WCNC notes, citing the the National Lightning Safety Council, North Carolina was ranked among the top five states in terms of lightning-related deaths between 2015 and 2024.

Sjo/Getty

The National Weather Serviceencourages those outside without access to shelter amid lightning to ""immediately get off elevated areas such as hills, mountain ridges or peaks"" and ""never shelter under an isolated tree.""

""Long story short, I won’t be trusting the weather anymore and Landry says he’s never going outside again 🥲,"" the photographer wrote on Facebook, calling it ""a beautiful bridal session turned into a long night in the hospital.""

""We are so thankful that God kept all of us safe! Trauma bonded for life and still trying to process what happened, but alive 🥴""

Read the original article onPeople"
