URL,Date,News_title,News_text
https://www.yahoo.com/news/nasa-claws-back-thick-dust-031930476.html,2025-07-11 04:00:00,NASA 'claws back' thick dust layer in Cat's Claw Nebula,"July 10 (UPI) --NASA's James Webb Space Telescope has revealed thick, dusty layers of the Cat's Claw Nebula, a region of star formation about 5,500 light-years away in the constellation Scorpius, the agency has announced.

""It's the cat's meow,"" NASA said in arelease.

NASA focused the James Webb Space Telescope'sNear-Infrared Cameraon a single ""toe bean"" within a subset of toe beans in the nebula, which appear to contain young stars shaping the surrounding gas and dust in the star-forming region.

The discovery is the result ofyears of researchin this part of space.

""Three years into its mission, Webb continues to deliver on its design -- revealing previously hidden aspects of the universe, from the star formation process to some of the earliest galaxies,"" said Shawn Domagal-Goldman, acting director of the Astrophysics Division at NASA Headquarters in Washington.

Domagal-Goldman added that the discovery will inform future research in this largely unexplored nebular region and create more research opportunities for scientists as they pursue an understanding of dark matter, search for life in other parts of the solar system or seek to find Earth-like planets.

""The questions Webb has raised are just as exciting as the answers it's giving us,"" he continued.

The toe bean discovery will also give researchers an opportunity to study the turbulent cloud-to-star formation process."
https://www.yahoo.com/news/secret-operation-finds-multiple-card-025053421.html,2025-07-11 04:45:00,Secret Service operation finds multiple card skimming devices in the Mid-South,"MEMPHIS, Tenn.– It’s video you’ll only see on Your News Leader. Law enforcement agents uncovered an unsuspecting device used to steal your credit card information at a North Memphis grocery store.

The discovery was part of a secret service operation that took place this week to combat a crime targeting lower-income families.

For the last two years, WREG Investigators have told you about the drastic rise in a ruthless crime. Criminals use devices to illegally capture EBT card information. They often duplicate the card and drain SNAP benefits within minutes of being deposited into a person’s account.

It’s a tactic known as skimming.

This week, the U.S. Secret Service gathered federal, state, and local partners for a highly coordinated operation to combat it.

“We couldn’t do this without you. We do not have the manpower to go out and check the numbers that we have,” Mark Switzer, special agent in charge of the Memphis field office, said in a morning briefing Tuesday.

The goal was to find the illegal skimming devices while also educating businesses on what to look for. Twelve teams saturated West Tennessee and North Mississippi on Tuesday and Wednesday, and WREG Investigators got an exclusive look.

“With a partnership with the USDA, we’ve identified a number of point-of-sale terminals for EBT cards and some potential points of compromise,” Switzer said.

We went out with one of the teams as they went from business to business inspecting ATMs, gas pumps, and point-of-sale terminals for skimming devices.

“These things get placed right on top of the point-of-sale terminal,” Switzer said.

They look like the real deal. They capture the data as each button is pushed while also pushing the real buttons underneath.

Switzer said the systems are becoming more sophisticated. Sometimes the criminals work in groups overseas. Other times, they gather the data and sell it on the dark web.

“There’s a number of levels of criminals that are out there getting a hold of this information and then using it for their own purposes, whether that be for personal gain or whether that be to finance some type of other criminal activity,” Switzer said.

Agents pried off the skimming device they found at the grocery store in North Memphis. It unveiled a keypad and reader attached by double-sided tape stuck to the real one.

It was marked as evidence. Agents will now work to find out who installed it and how long it’s been there.

“It’s estimated that every skimmer that is recovered is about $1 million worth of fraud that we prevent,” Switzer said.

Agents went to more than 400 businesses. They inspected 2,200 point-of-sale terminals, 857 gas pumps, and 234 ATMs. Four skimming devices were found.

Based on that number, it’s estimated this operation prevented around $4 million worth of fraud. These operations have been taking place across the country and are believed to have stopped more than $200 million in theft.

Switzer said chip readers on EBT cards would also help combat the fraud.

“The ability exists to be able to skim cards with chip readers, but it’s very few and far between,” he said.

In Tennessee, EBT cards don’t have embedded microchips like you have on your bank card. They use a magnetic stripe, which is an older technology, making it much easier to compromise.

TheUSDA admitschip cards are “an important step to ensure that SNAP benefits are protected,” but it’s up to the state to take that step.

Only a handful of states have or will soon offer EBT cards with chips. The Tennessee Department of Human Services stated it’s “exploring all available options to ensure effective fraud mitigation and protection for customers.”

“We live paycheck to paycheck,” Katherine Jones saidin a recent interview.

The grandmother is an authorized representative on her daughter’s account. Thieves compromised her card and drained the family’s SNAP benefits in April and in May.

“It’s just frustrating that, you know, people can so easily access your information and use it without a care in the world,” she said.

Switzer said that’s why this work is vital.

“While they lose, there’s the potential that taxpayers lose as well,” he said. “Their taxes are going to help offset some of this.”

In 2022, U.S. Congress approved replacing stolen benefits, but that came to an end in December.

States can choose to replace the benefits, but Tennessee hasn’t opted in.

How the FBI says you can protect yourself against skimming:click here

TDHS advises customers to take proactive security measures by usingebtEDGEto protect their benefits, including:

Utilization of card-freezing features

Regular PIN updates

Monitoring account activity for suspicious transactions

Reporting unauthorized transactions immediately to mitigate further losses

The ebtEDGE mobile app allows customers to log-in securely using touch ID or facial recognition instead of entering a user ID and password. The ebtEdge mobile app is available from the Apple App Store for iPhone and the Google Play Store for Android devices.

For more information on how to download theebtEDGEmobile app,customers can find instructional videos by clicking here.

Copyright 2025 Nexstar Media, Inc. All rights reserved. This material may not be published, broadcast, rewritten, or redistributed.

For the latest news, weather, sports, and streaming video, head to WREG.com."
https://www.yahoo.com/news/cause-death-revealed-missing-mother-033945627.html,2025-07-11 06:00:00,Cause of death revealed for missing mother found dead at L.A. homeless encampment,"The death of a mother and Army veteran whose body was found at a homeless encampment in Los Angeles was ruled an accident and due to drug use.

On May 12, Lucrecia Macias Barajas, 46, wasfound dead inside a sidewalk tentthat was reportedly locked in the Westlake District near downtown L.A.

Inside the tent were the bodies ofBarajasand a man, now identified asFredy Pojoy Sajqui, 39.The nature of their relationship was unclear.

On July 9,the L.A. County medical examiner’s office announcedboth Barajas and Sajqui died from the effects of fentanyl and methamphetamine. Their deaths were also ruled accidental.

In early May, Barajas’ daughters said she left her home on the Saturday before Mother’s Day, and that was the last time they heard from her.

After she was missing for several days and family members were unable to reach her, they eventually traced her cell phone signal to an encampment near downtown where he daughter made the grisly discovery.

Neighbors said at least one of the bodies found in the tent had been partially eaten by dogs.

Los Angeles police had investigated the case as a suspected overdose despite the family’s objections. Her daughters said they’re unsure why their mother went to the encampment that day, but at the time, they believed thecircumstances surrounding her death were suspicious.

Born in Nicaragua, Barajas fled with her family in 1986 amid the country’s civil war. She later joined the U.S. Army between the late 1990s and early 2000s. She was the mother of six children.

Her daughters told the Los Angeles Timesthat they believe their mother started using methamphetamine in 2017 as a way to manage raising six children, working full-time and battling stage 3 lymphoma. They were reportedly unaware of their mother’s drug use at the time, though they said she eventually became sober.

Barajas’ loved ones described her as a generous person who often delivered food to those struggling on the streets.

“Lucrecia was a wonderful person and served our country,” said Stephanie Torres, a longtime friend.

“She had her whole life ahead of her,” said Amely Becerra, Barajas’ daughter. “She was still so young.”

The homeless encampment where Barajas was found has remained a chronic issue for many residents, who say the area attracts criminal activity, drug use and safety hazards.

Neighbors said the district has been neglected by city officials and despite repeated complaints, nothing is being done to curb the growing problems.

Copyright 2025 Nexstar Media, Inc. All rights reserved. This material may not be published, broadcast, rewritten, or redistributed.

For the latest news, weather, sports, and streaming video, head to KTLA."
https://www.yahoo.com/news/why-us-airlines-charging-solo-050000477.html,2025-07-11 06:30:00,Why US airlines are charging solo travellers more (and Ryanair is doing the opposite),"Travelling solo can be tricky enough without having to pay a special premium for the privilege. So singletons and solo adventurers alike may be raising an eyebrow at news from the States that three of the country’s biggest airlines – American, United and Delta – are charging higher prices for lone passengers.

In some cases, the difference is hefty: the US travel websiteThrifty Travelerfound that single passengers on a United flight from Chicago to a smaller city in Illinois (Peoria) were being charged $269 to fly, compared to just $181 for those travelling as a pair – a saving of one third.

It isn’t an isolated example. Another US travel website,The Points Guy, carried out a detailed analysis of some 3,000 domestic flights on a single day in the States and found that 7 per cent of them were charging a higher price to passengers having the audacity to travel alone.

Why the premium? While airlines are notoriously secretive about their pricing methods, one reason being put forward is that the algorithms may assume that those travelling on their own are more likely to be business customers who are less likely to object to the higher rates.

Curious to check the phenomenon for myself, I spent 15 minutes on the United website and was soon able to find a live example of this dual pricing in action: an economy flight from Chicago to Lexington whose per-person price dropped by $58 when I included a second passenger, from $283 to $226.

Even more curiously, the tax breakdown on the United website showed that the tax per passenger was actually slightlylesswhen two passengers were on the same booking – meaning that the higher rate was entirely down to airline policy.

Bad news, then, for anyone planning their own solo venture across the States. But given that American airlines have long set the trends on things like baggage fees, is there any chance that this depressing trend could soon take hold on this side of the pond too?

Consumer experts told me they had not seen any examples of European airlines charging single passengers more. But when I conducted my own research by testing flight prices on Ryanair, I found what appeared to be the opposite phenomenon.

Looking at flights from Stansted to Podgorica, for example, I was quoted £142.69 for a basic fare as a solo traveller, but £157.69 (each) for two passengers on the same flight. Likewise, a one-way flight from Stansted to Prague jumped from £71.54 to £82.04 when I added a second passenger.

I was able to find more examples of the same thing happening, with the price jumping between 10 and 15 per cent when a second passenger was added to the booking. All of these flights had one thing in common: namely that the single passenger was told there was “only one seat left at this price”.

Anyone who has booked a Ryanair flight will have seen similar messages appearing. But even if there’s only one discount seat left, you might assume that someone booking two tickets would get the last remaining bargain price plus the next cheapest seat on offer – but you’d be wrong.

When I contacted Ryanair, they told me that “our system defaults all passengers in the booking to the next available fare class”. In short, that means that if there is only one seat left at the cheapest price, then it will only be available to customers purchasing a single ticket.

By contrast, if you were booking as a couple, the system would automatically allocate you into the first pricing bracket in which two seats were available, even if that means leaving that discount seat on offer for someone else to snap up at a later time.

Of course, there’s nothing to stop you booking the tickets separately and getting the cheaper price. But how many travellers are going to have the foresight to do that?

I was surprised to find out that couples were potentially losing out. Particularly since the consumer experts at Which? told me that the usual pattern is to see singletons paying more when it comes to holiday deals. In 2023,they revealedthat solo travellers were charged an average of 47 per cent more when paying a Tui package holiday.

Likewise, it is common for some cruise companies to levy an extra surcharge on solo holidaymakers, on the basis that they are taking up a room which was likely designed for two paying customers.

“Companies should be up front about any pricing practices they are using or single supplements so travellers can make informed decisions and choose the best holiday for them,” saysWhich?’s travel expert Rory Boland.

“To avoid paying over the odds, we’d recommend looking for companies that waive single supplements. Make sure you’re getting a good deal by comparing the total against the per person price of a couple’s package.”

But where does that leave the United and Ryanair examples, where an airline is charging passengers different prices for exactly the same seats based on whether they are booking on their own or not?

The expert consensus is that the practice is another example of so-called “dynamic pricing”, where airlines adjust their ticket prices to meet the strength of demand. The practice certainly isn’t illegal, but it can be controversial: particularly when the algorithms are such a tightly-guarded trade secret.

In practice, though, most customers have made their peace with dynamic pricing for airline tickets on the basis that it usually means cheaper getaways in the long run (particularly when you can plan ahead). But the nature of that flexibility means that there will always be some passengers who end up losing out.

As always, the best way to avoid ending up in that category is to make sure you do your homework in advance when booking flights – particularly if you happen to be planning on a solo flight from Chicago any time soon.

Broaden your horizons with award-winning British journalism. Try The Telegraph free for 1 month with unlimited access to our award-winning website, exclusive app, money-saving offers and more."
https://www.yahoo.com/news/host-nicole-curtis-hgtvs-rehab-123630939.html,2025-07-11 13:15:00,HGTV's 'Rehab Addict' featuring Detroit home postponed: Nicole Curtis tells why,"Nicole Curtis isrehabbing a Detroit home in season nineof the hit HGTV show ""Rehab Addict"" that premiered June 24.

And after two episodes, fans will have to wait until the fall to see the rest of the home's rehabilitation, Curtis announced in an Instagram post on Tuesday, July 8.

""I appreciate your support and understanding for the late notice. It's just a lot of hours (my hours) to get a show on air and we (my family and me) thought — why are we giving up summer when we have the ability to do this in the fall?"" Curtis posted on Instagram. ""Thank you to the power at be at HGTV that were receptive to our idea.""

""Lottery Dream Home,"" a show where lottery winners set out to find their dream places, is airing on HGTV in that time slot instead, according to Curtis' Instagram post.

""Fun fact, David Bromstead was my pregnancy beach buddy as we were filming and living next to each other in Gulf Shores, Alabama for Beach Flip,"" according to the post.

Those episodes have just been added to HBO Max and Discovery+, according to the post.

A spokesperson for Curtis did not immediately confirm if there is an exact date set for ""Rehab Addict"" to begin airing again.

This article originally appeared on Detroit Free Press:HGTV's 'Rehab Addict' postponed until fall, Nicole Curtis says"
https://www.yahoo.com/news/learn-tinker-play-springfield-museums-112542385.html,2025-07-11 13:15:00,"Learn, tinker and play at the Springfield Museums this summer","SPRINGFIELD — Families can turn up the heat on summer fun while staying cool in air-conditioned halls at theSpringfield Museums.

Now open seven days a week through Aug. 15, the museums are offering a slate of activities including hands-on exhibitions, live entertainment on the Quadrangle Green, and music inspired by cultures from around the globe.

Most summer activities are included with Museum admission, and that cost is waived for Springfield residents with proof of residence.

“I am hoping that visitors and their families leave the museums this summer thinking ‘I’ve learned something new,’” said Abby Garner, Family Engagement Coordinator for the Springfield Museums, in an interview with The Republican. “Whether that is from the planetarium, one of our musical performances, the additional activities we are offering, or from one of our visiting exhibits.”

Some of the Museums’ summer activities are returning favorites, like the return of Giant Bubbles with Mr. Vinny, a show on the Quadrangle each Friday afternoon that encourages children to watch, chase and pop bubbles. The Toe Jam Puppet Band, a children’s entertainment troupe that combines music, puppetry and storytelling, also returns.

Other activities, like hands-on experiences in the Cat’s Corner, Hasbro Games Art Discovery Center and Spark!Lab, were curated by the Museum’s education staff for this year’s summer programming.

In theCat’s Corner, located inside of The Amazing World of Dr. Seuss Museum, guests can read some of Ted Geisel’s stories and take part in facilitated art activities. In theHasbro Games Art Discovery Center, located inside of the George Walter Vincent Smith Art Museum, guests can participate in activities that range from arts and crafts to dress-up and puppet play. Inthe Spark!Lab,located inside of the Springfield Science Museum, make projects inspired by inventions and innovations in American history, or invent something totally new.

“Activities can change from week to week in our drop-in spaces, so there are new experiences often for visitors looking to visit more than once this summer,” Garner said.

The summer schedule also offered the opportunity for more live music at the Museums.

“We’ve had musical performances on and off throughout the years, and they’re always really special events, especially when the weather’s nice and we can have them out on our Quadrangle Green and kids can dance and sing and play,” said Larissa Murray, Director of Education for the Springfield Museums. “But we wanted to make it more of a featured event, something that you could plan for as opposed to it just happening now and again.”

Wednesdays are a strong turn-out day for the Museums, Murray explained, making it the perfect opportunity to test out a new music program.

As a result, the Springfield Museums are offering a “Music on Wednesdays” program this summer, with a different group or performer scheduled each week. The live music begins on July 9 with the Community Music School of Springfield performing Bomba y Plena music from Puerto Rico and West African-inspired drumming and dance.

“Kids can be exposed to styles of music that are perhaps outside of their knowledge, whether it’s African drumming, brass bands, or Latin jazz,” Garner said.

Other bands on the line-up include the GOZA Latin Band on July 16, the Community Music School on July 23, the Expandable Brass Band on July 30, The Airborne Comedians on Aug. 6 and Fiesta del Norte Mariachi on Aug. 13.

Admission to the concerts, offered from noon to 2 p.m. each Wednesday, is included with Museum tickets.

New to the Springfield Museums’ summer programming this year is Tinker Thursdays, an hourlong workshop offered weekly in the Museum School. Topics vary each week, but each has a connection to science, technology, engineering, the arts and mathematics.

“Our team wanted to offer new ways to experience the Springfield Museums for our young visitors and invite them into the Museum School spaces, including our art studios,” said Emma Lewis, Museum School and Lecture Coordinator.

Each Tinker Thursday workshop is led by Museum School staff and is open for ages 7 to 14.

Just some of the Tinker Thursday events on offer include “Doctor for a Day” on July 17, in which young guests are invited to don lab coats and use real stethoscopes as they learn about the heart and how to take a pulse; and “Plush Stuff” on July 24, where young seamsters can create their own decorative pillow and learn how to use a sewing machine.

No matter what the topic is, no experience is required.

“We hope kids will walk away with a new perspective on the Springfield Mu-seums and the different ways you can learn, as well as a cool completed project and confidence in their new skills,” Lewis said.

Tinker Thursday workshops are $10 and $8 for members in addition to museum admission, and tickets to workshops can be purchased on the Museums’ website or in-person on the day of the event.

The Springfield Museums are open Monday through Saturday, from 10 a.m. to 5 p.m., and Sunday, from 11 a.m. to 5 p.m. Tickets can bepurchased onlineat a base price of $25 for adults, $13 for ages 3 to 17, $16.50 for seniors 60 and older and students with ID, and free for children 3 and under. Reduced ticket prices are available for Museum members, and Springfield residents are always admitted free.

Tickets include admission to the Springfield Science Museum, the Michele and Donald D’Amour Musuem of Fine Arts, the Lyman and Merrie Wood Museum of Springfield History, the George Walter Vincent Smith Art Museum, the Dr. Seuss National Memorial Sculpture Garden and the Amazing World of Dr. Seuss Museum.

For more information about visiting the Museums, call 413-314-6436 or email welcomecenter@springfieldmuseums.org.

Read the original article onMassLive."
