URL,Date,News_title,News_text
https://www.yahoo.com/news/detroit-police-7-citys-youth-155008881.html,2025-07-03 17:45:00,Detroit Police: 7 of the city's youth shot in less than a week,"Seven of the city's youth were shot in less than a week, a spate of violence Detroit Police Chief Todd Bettison blamed on disputes and easy access to weapons.

Bettison spoke of the teen victims on Wednesday night, June 2, before his biweekly ""Walk-A-Mile Wednesdays"" in the community. All the shootings have the same theme, he said — they've stemmed from some sort of argument with feelings of disrespect and shame and have resulted in violence. They include a 4-year-old bystanderkilled while playing at a park, and a 15-year-old killed over a pair of shoes.

And ""the common denominator is, these teens shouldn't have guns,"" he said. ""When it comes to parental responsibility, check your teens' rooms. Ensure that they don't have access to your firearms. Because when they do, things like this happen.""

Children getting shot and killed isn't something the city should normalize, Bettison said. So when it comes to fighting violent crime in Detroit, he made a promise: ""I will not stop, ever.""

The stretch of bloodshed began Friday, June 27, when 4-year-old Samir Josiah Grubbs was shot to death before he could make it up the slide's ladder at Skinner Playfield and 18-year-old Dayvion Shelmonson-Bey was killed, too. A 17-year-old was also shot and survived. Bettison also said that two teenagers were arrested in the case, but charges haven't been filed by prosecutors as of Thursday, July 3.

An argument over shoes on Sunday, June 29 was settled with gunfire at a home on Mark Twain Street, Bettison told the Free Press. A 15-year-old was killed, and his sister, 13, was grazed by a bullet. That same day, a 16-year-old was shot and killed on Margareta Street.

And on Tuesday, July 1, a 17-year-old was shot in the head at the Martin Luther King Jr. Homes and was in critical condition.

Violent crime overall is down in Detroit, according to city data. Homicides are down 20% as of July 1, compared with this time last year. Nonfatal shootings are down 30%.

But the number of youth shot this week is what Bettison and community violence intervention leaders in the cityhave been working to avoidduring the summer months that often bring more violence to the city.

Both say they have been proactive in their approach — Detroit police deployed its park units and started cracking down against illegal activity like unlawful block parties and street racing starting in the spring, and violence intervention groups have engaged youth in summer programs and inserted themselves in disputes in order to de-escalate and prevent further bloodshed.

There's not a single issue to point at when dealing with youth gun violence, said Quincy Smith of the violence intervention group Team Pursuit. There are layers, he said, like poverty, family instability, and a lack of abundance of resources. Many times, the motivation for violence is money, he said.

""If we had the abundance of resources, employment opportunities, access to these types of things, their mindset wouldn't even be on violence, because they would be too preoccupied with things that would be more productive,"" Smith said.

There's also a culture of violence that many young people have just accepted, he added — ""they call it crash out time.""

And while Smith said there's not one single issue one can point to for the reasons behind gun violence, he did point to the state legislature as part of the solution and urged them to fund public safety, including violence intervention groups, and the social detriments that are the root causes of violence.

""Our legislatures have to do what's right. They've got to step up to the plate,"" he said. ""In the meantime, we're losing babies.""

Andrea Sahouri covers criminal justice for the Detroit Free Press. Contact her atasahouri@freepress.com.

This article originally appeared on Detroit Free Press:Detroit Police: 7 of the city's youth shot in less than a week"
https://www.yahoo.com/news/long-island-teen-critical-condition-154943918.html,2025-07-03 17:45:00,Long Island teen in critical condition after motorcycle accident: Police,"LONG ISLAND (PIX11) — A teen lost control of their motorcycle and crashed into a pole in Lindenhurst early Thursday morning, according to Suffolk County Police.

The teen was taken to a local area hospital in critical condition, police said. The motorcycle was impounded for a safety check, and detectives are investigating the crash.

More Local News

Detectives are asking anyone with information on the crash to call the First Squad at 631-854-8152.

Spencer Gustafson is a digital content producer from Long Island who has covered New York state and city news since 2023. See more of his workhere.

Copyright 2025 Nexstar Media, Inc. All rights reserved. This material may not be published, broadcast, rewritten, or redistributed.

For the latest news, weather, sports, and streaming video, head to PIX11."
https://www.yahoo.com/news/13-old-hit-car-while-155740139.html,2025-07-03 17:45:00,13-year-old hit by car while riding bike in South Memphis,"MEMPHIS, Tenn. — A 13-year-old boy was hit by a car while riding his bike Tuesday morning in South Memphis, police say.

Officers say they responded to a crash in the 300 block of Olive Avenue and Sardis Street around 11:10 a.m. They say a boy was found at the scene suffering from a cut on his right eye and abrasions on his back.

The boy told police he was riding his bike across South Wellington at Olive Avenue when he was hit by a car.

Caregiver charged with stealing over $40K from vulnerable adults

He says he believes the vehicle was a blue van. The driver did not stay on the scene and continued driving northbound on South Wellington towards Trigg, police say.

The boy was then taken to Le Bonheur Children’s Hospital.

While in the hospital, the 13-year-old was given a juvenile summons after police say drugs and money were found in the waistband of his shorts during his examination.

Police say the drugs tested positive for Marijuana.

Copyright 2025 Nexstar Media, Inc. All rights reserved. This material may not be published, broadcast, rewritten, or redistributed.

For the latest news, weather, sports, and streaming video, head to WREG.com."
https://www.yahoo.com/news/rare-tidal-wave-cloud-creates-165942295.html,2025-07-03 17:45:00,Rare Tidal Wave Cloud Creates Panic in Portugal (Video),"A viral video has been bopping around, with scenes like a disaster movie, as beachgoers in Portugal begin to flee the beach when an ominous, tsunami-like cloud begins to crash over the sand. It’s a rare, although natural phenomenon; and naturally, people panicked.

The video comes from Praia de Buarcos, a beach enclave about 88 clicks north from Supertubos and Peniche, where the World Surf League holds their annual Championship Tour contest. And the event happened over the weekend, turning a sunny beach day into a strange, stormy, and panicked scene in a matter of minutes. See the footage below:

“It was nuts to have experienced this rolling cloud in the north of Portugal,” one witness wrote onX, also supplying another angle of the cloud, which is perhaps even scarier, even more unusual than the one in the video above. “Felt like a tsunami out of a movie! Apparently it was 150km long, stretching from Figueira da Foz all the way up to Vila do Conde, which is close to where I was.”

Related: Psychic Predicts Devastating Tsunami on July 5th, 2025

So, what was it?

According to the cloud experts (real thing), it was an Arcus Cloud, also known as a “roll cloud.” For more information, here’s theCloud Appreciation Society(also a real thing, and side note, how do we join?):

“They form as the cold air that is dragged down by all the precipitation falling within the storm splays outwards upon reaching the ground. As it spreads around the storm, it burrows beneath the warmer, less-dense air at ground level. This is lifted most forcefully in the direction of the cloud’s movement, forming a ‘gust front’, in which the warmer air’s moisture can condense into water droplets that appear as the shelf of cloud.”

Related: 60-Foot Rogue Wave Captured in Pacific Ocean (Video)

Rare Tidal Wave Cloud Creates Panic in Portugal (Video)first appeared on Surfer on Jul 3, 2025"
https://www.yahoo.com/news/teen-boy-killed-hit-run-151940541.html,2025-07-03 17:45:00,Teen boy killed in hit-and-run crash while bicycling in McHenry County; suspect vehicle sought,"MCHENRY COUNTY, Ill. — Deputies in McHenry County are searching for a driver involved in a hit-and-run crash that left a teen boy dead on Wednesday night.

According to officials from the McHenry County Sheriff’s Office, the crash unfolded just after 9:30 p.m. Thursday along Terra Cotta Road near the intersection of Deering Oaks Lane in unincorporated Crystal Lake.

Read more: Latest Chicago news and headlines

Deputies said the victim, a 15-year-old boy, was riding bicycles with another teen in the area when he was struck from behind by a southbound vehicle.

Authorities believe the vehicle was possibly a dark red 2017-2018 Jeep Cherokee.

Following the crash, deputies said the driver fled the scene.

The teen suffered serious injuries in the crash and was taken to the hospital, where he was later pronounced dead.

According to deputies, at the time of the crash, the teen had a red taillight activated.

A search is now underway for the driver involved in the crash.

LATEST CASES: Missing people in Chicagoland

Deputies say the crash is now being investigated by the McHenry County Sheriff’s Office Major Crash Investigation Unit and the McHenry County Coroner’s Office.

Authorities are also asking the public and local body shops and/or dealerships to give them a call if they spot a dark red 2017-2018 Jeep Cherokee with front end damage.

Tips can be phoned in at 815-338-2144.

Copyright 2025 Nexstar Media, Inc. All rights reserved. This material may not be published, broadcast, rewritten, or redistributed.

For the latest news, weather, sports, and streaming video, head to WGN-TV."
https://www.yahoo.com/news/west-plains-police-investigating-fatal-143638791.html,2025-07-03 17:45:00,West Plains Police investigating fatal pedestrian crash on U.S. Highway 63,"WEST PLAINS, Mo. — One person is dead after a car hit a pedestrian on U.S. Highway 63 on Tuesday, July 1, police say.

According to the West Plains Chief of Police, Brian Bunch, officers were called to U.S. 63 near the bridge over McFarland Drive for a motor vehicle accident just after 10 p.m. Police learned that a 50-year-old man from West Plains was walking south on US 63 and was hit by a passing vehicle.

The pedestrian in the crash was pronounced dead at the scene, and the next of kin have been notified. The driver in the crash was not injured, Chief Bunch says.

The West Plains Police Department is currently investigating the crash.

Copyright 2025 Nexstar Media, Inc. All rights reserved. This material may not be published, broadcast, rewritten, or redistributed.

For the latest news, weather, sports, and streaming video, head to KOLR - OzarksFirst.com."
https://www.yahoo.com/news/dauphin-county-crews-perform-rescue-151528861.html,2025-07-03 17:45:00,Dauphin County crews perform rescue after car crashes down ravine,"DAUPHIN COUNTY, Pa. (WHTM)– Crews performed a rescue Wednesday night after a vehicle crashed down a 50-foot ravine in Dauphin County.

According toSwatara Fire 91 on Facebook, multiple fire crews responded to Interstate 283 at mile marker 1.5 at 11 p.m. for a reported multi-vehicle crash with injuries. Firefighters reported that a vehicle left the roadway and drove into a tree line before going missing.

Close

Thanks for signing up!

Watch for us in your inbox.

Subscribe Now

Firefighters said rescue and truck crews entered the tree line and found the vehicle at the bottom of a 50-foot ravine. Crews had to clear trees and set up a rope haul system to lift the victim back to the roadway.

Crews were able to extricate the victim and transfer them to EMS safely. Their current condition is unknown at this time.

Crews from the Harrisburg Bureau of Fire, the Lower Swatara Fire Department, the Steelton Fire Department, and the Middletown Volunteer Fire Department assisted at the scene.

Copyright 2025 Nexstar Media, Inc. All rights reserved. This material may not be published, broadcast, rewritten, or redistributed.

For the latest news, weather, sports, and streaming video, head to ABC27."
https://www.yahoo.com/news/emergency-crews-responding-report-possible-143040201.html,2025-07-03 17:45:00,Pilot severely injured in plane crash in remote area north of Hart Park,"BAKERSFIELD, Calif. (KGET) — A pilot survived, but suffered serious injuries after their plane crashed in a remote area north of Hart Park early Thursday morning.

A call went out with reports of the possible aircraft crash at around 6:45 a.m. in a remote area near Round Mountain Road and Pyramid Road in northeast Bakersfield.

Emergency responders located the downed aircraft in the hills. Rescuers were able to reach the pilot and began treatment for injuries. Firefighters carried the injured pilot to a waiting medical helicopter who was then taken to a hospital for treatment of life-threatening injuries, Kern County Fire Capt. Andrew Freeborn said.

Never miss a story: Make KGET.com your homepage

The cause of the crash is under investigation.

Copyright 2025 Nexstar Media, Inc. All rights reserved. This material may not be published, broadcast, rewritten, or redistributed.

For the latest news, weather, sports, and streaming video, head to KGET 17 News."
https://www.yahoo.com/news/tow-truck-bandits-rushing-crash-152419289.html,2025-07-03 17:45:00,‘Tow truck bandits’ are rushing to crash scenes: L.A. drivers warned,"Drivers have been warned to be on the lookout for fraudulent tow truck drivers looking to take advantage of distressed motorists across Los Angeles.

“These ‘tow truck bandits’ monitor radio traffic and rush to crash scenes, posing as helpful tow truck operators,” the Los Angeles County District Attorney’s Officeposted on InstagramWednesday.

The post goes on to say that once the operators tow your car, they demand outrageous fees or refuse to return the vehicle until the inflated charges are paid.

“This is fraud—and it’s illegal,” the DA’s Office states.

Motorists were urged to watch out for the following red flags after an accident:

Tow trucks that show up before you call a tow company or police

Tow drivers who insist on taking your car to a specific body shop

Tow drivers that offer a ride share for you

The post also shared tips to protect yourself:

Wait for police to arrive at the scene before agreeing to have your vehicle towed

Ask officials whether anyone from emergency services called a tow truck for you and if so, which company

Verify the tow truck company with your insurance or the California Highway Patrol

Do not sign any documents until you have spoken with your insurance company

Drivers were urged to report suspected tow truck fraud to local law enforcement or the California Department of Insurance at 800-927-4357.

Copyright 2025 Nexstar Media, Inc. All rights reserved. This material may not be published, broadcast, rewritten, or redistributed.

For the latest news, weather, sports, and streaming video, head to KTLA."
https://www.yahoo.com/news/tbi-former-cheatham-county-corporal-153917623.html,2025-07-03 18:30:00,TBI: Former Cheatham County corporal indicted on assault charges,"CHEATHAM COUNTY, Tenn. (WKRN) — A former corporal in Cheatham County has been indicted on assault charges following an investigation led by the Tennessee Bureau of Investigation, officials said.

At the request of 23rd Judicial District Attorney General Ray Crouch, TBI agents began investigating a complaint involving Cheatham County Corporal Ryan Creech on Jan. 6, 2025.

CRIME TRACKER |Read the latest crime-related reports from across Middle Tennessee

Officials said the complaint alleged that Creech used inappropriate force when responding to a crash. During the course of the investigation, agents reportedly determined that, during an altercation, Creech put his hands around the neck of a person involved in the crash.

The Cheatham County Grand Jury returned indictments on Tuesday, July 1, charging Creech with one count of assault/threat of bodily injury and one count of aggravated assault/strangulation.

⏩Read today’s top stories on wkrn.com

According to the TBI, Creech turned himself in to Cheatham County Jail on Wednesday, July 2. He was reportedly booked on a $6,000 bond.

Authorities said Creech is no longer employed by the Cheatham County Sheriff’s Office. No additional information was released.

Copyright 2025 Nexstar Media, Inc. All rights reserved. This material may not be published, broadcast, rewritten, or redistributed.

For the latest news, weather, sports, and streaming video, head to WKRN News 2."
https://www.yahoo.com/news/record-breaking-july-4th-72-183429306.html,2025-07-03 19:15:00,Record-Breaking July 4th: 72 Million Americans Set To Travel,"If you feel like the roads and airports have been busier lately, you’re not imagining things.

72 million Americans will travel at least 50 miles from home between June 28 and July 6, a 2.4% jump from last year, and a whopping 7 million more travelers than in 2019.

Almost 62 million travelers, or 85% of all holiday voyagers, will hit the road by car. That’s the highest number ever recorded for the July 4th travel period.

AAA’s Texas officesuggeststhat road trippers should plan ahead:pack an emergency kit, check those tires, and don’t forget to fill up before heading out.

Last year, AAA came to the rescue nearly 700,000 times during the holiday week for everything from dead batteries to flat tires and, yes, drivers locking themselves out of their cars.

Gas prices are friendlierthan many expected, too.

Despite some recent jitters in the oil market driven by conflict in the Middle East and the looming hurricane season, summer gas prices remain the lowest since 2021, under the Trump administration.

For Texans staying close to home, popular routes include the classic Houston-to-Galveston stretch down I-45, which is expected to see heavy traffic in both directions on weekends.

From July 3 to July 6, the Texas Department of Public Safety willintensify patrols statewideas part of Operation CARE (Crash Awareness Reduction Effort). The initiative aims to keep roads safer by targeting risky driving behaviors such as speeding, driving under the influence, and failing to follow the state’s Move Over, Slow Down law.

As previously reported byThe Dallas Express, officers issued around 5,000 speeding tickets, more than 1,500 citations to uninsured drivers, and hundreds of tickets to people not wearing seatbelts during their July 4th crackdown in 2024. In addition, DPS arrested 212 people for DWI and another 250 on various felony charges last year.

If your plan involves a TSA line, you’ll have plenty of company.

More than 5.8 million people are expected to fly over the holiday period, a slight increase over last year’s record. The average domestic round-trip ticket price sits around $810, up 4% from last summer.

Travel expertssuggest booking midweek flights, such as Tuesdays and Wednesdays, for better deals and fewer headaches, according to AAA.

Beyond cars and planes, nearly 4.8 million Americans will travel by bus, train, or cruise. That number is just shy of the pre-pandemic record set in 2019.

Where are Americans going?

When it comes to destinations, it’s amix of classic summer hotspots and bucket-list cities.

Domestically, Orlando, Seattle, and New York top the charts. Alaska cruises are also peaking, and Hawaii’s beaches are calling, according to the report.

Internationally, Canadians will see many American tourists in Vancouver, while Rome, Paris, and London remain the European favorites.

Timing Is Everything

If you’re driving, when you leave matters as much as where you’re going.

According to traffic data firm INRIX, theworst times to be on the road are generally afternoon and early evening hours, especially on July 2 and July 6.

The best strategy?Hit the road early, before noon, and try to avoid the midday bottlenecks.

AsDXhas previously reported, late-night driving on weekends can be especially deadly in the Lone Star State, regardless of whether it’s a holiday weekend or not.

Data based on NHTSA crash records from 2019 to 2023 revealed that the hoursbetween 9 and 10 p.m. are the deadliest on Texas roads. On average, 254 fatal crashes occur during this hour each year, accounting for more than 6% of the state’s total, the highest number among the ten most populous states in America."
https://www.yahoo.com/news/tow-truck-driver-killed-car-173100905.html,2025-07-03 19:15:00,Tow truck driver killed by car in New Jersey: Police,"NEW JERSEY (PIX11) — A New Jersey tow truck driver was killed after being hit by a car while assisting another vehicle on the side of I-287 in Morris County, according to police.

Daniel Ortiz, 24, of Hopatong, was hit by a Jeep that drove onto the shoulder of I-287 South, where Ortiz was towing a car just before noon on Thursday.

More Local News

The Jeep hit Ortiz, the tow truck and the disabled car, police said.

Ortiz was taken to a nearby hospital, where he was later pronounced dead as a result of his injuries. Police said the driver of the Jeep sustained minor injuries.

The crash is still under investigation, according to police.

Spencer Gustafson is a digital content producer from Long Island who has covered New York state and city news since 2023. See more of his workhere.

Copyright 2025 Nexstar Media, Inc. All rights reserved. This material may not be published, broadcast, rewritten, or redistributed.

For the latest news, weather, sports, and streaming video, head to PIX11."
https://www.yahoo.com/news/thp-1-injured-crash-highway-163512455.html,2025-07-03 19:15:00,THP: 1 injured after crash on Highway 66 in Hawkins County,"HAWKINS COUNTY, Tenn. (WJHL) — One person was injured during a crash on Highway 66 in Hawkins County on Thursday morning.

Tennessee Highway Patrol (THP) reports a 2011 Dodge Caravan was traveling south on Highway 66 near Beech Grove Road just after 7:30 a.m.

The Dodge reportedly went off the roadway into the ditch and rolled onto the driver’s side.

JCPD identifies person killed in head-on collision

The driver was injured in the crash, THP reported.

TheHawkins County Rescue Squad statedthe driver had to be extricated from the vehicle.

Highway 66 South was closed for almost two hours and reopened just after 9:30 a.m., according to the rescue squad.

Copyright 2025 Nexstar Media, Inc. All rights reserved. This material may not be published, broadcast, rewritten, or redistributed.

For the latest news, weather, sports, and streaming video, head to WJHL | Tri-Cities News & Weather."
https://www.yahoo.com/news/3-car-crash-leaves-multiple-170020941.html,2025-07-03 19:15:00,3-car crash leaves multiple injured in Okaloosa County,"OKALOOSA COUNTY, Fla. (WMBB) – A vehicle crash on the State Road 20 and Bay Drive intersection involving two SUVs and a pick-up truck left one driver and one passenger seriously injured.

According to a news release, this three-car collision occurred at 8:35 a.m.

The first SUV carried a 63-year-old male driver who sustained minor injuries and a female passenger with serious injuries, both out of Niceville.

The second SUV had a 73-year-old driver from Niceville who also had serious injuries. The pick-up truck held a 58-year-old male driver from DeFuniak Springs who suffered minor injuries.

Florida Highway Patrol officials reported that the first SUV was traveling eastbound in the inside lane of State Road 20, approaching the intersection of Bay Drive.

The second SUV was at an east-facing stop in the inside lane, as the pick-up truck was also stopped facing west in the left turn lane in the same intersection.

At this intersection, the first SUV failed to stop, colliding with the second SUV.

The second SUV was then propelled forward onto the westbound lanes, coming into contact with the pick-up truck.

The first SUV continued traveling eastbound until being forced off the road by an Okaloosa County Deputy Sheriff.

The driver claimed they were unable to stop their vehicle after the first collision.

Copyright 2025 Nexstar Media, Inc. All rights reserved. This material may not be published, broadcast, rewritten, or redistributed.

For the latest news, weather, sports, and streaming video, head to mypanhandle.com."
