URL,Date,News_title,News_text
https://www.yahoo.com/news/anti-slavery-document-1847-reveals-041108374.html,2025-07-03 05:00:00,A volunteer finds the Holy Grail of abolitionist-era Baptist documents in Massachusetts,"GROTON, Mass. (AP) — Jennifer Cromack was combing through the American Baptist archive when she uncovered a slim box among some 18th and 19th century journals. Opening it, she found a scroll in pristine condition.

A closer look revealed the 5-foot-long (1.5-meter-long) document was a handwritten declaration titled “A Resolution and Protest Against Slavery,"" signed by 116 New England ministers inBostonand adopted March 2, 1847. Until its discovery in May at the archives in Groton, Massachusetts, American Baptist officials worried theanti-slavery documenthad been lost forever after fruitless searches at Harvard andBrown universitiesand other locations. A copy was last seen in a 1902 history book.

“I was just amazed and excited,” Cromack, a retired teacher who volunteers at the archive, said. “We made a find that really says something to the people of the state and the people in the country. ... It speaks of their commitment to keeping people safe and out of situations that they should not be in.""

The document offers a glimpse into an emerging debate over slavery in the 19th century in the Northeast. The document was signed 14 years before the start of the Civil War as a growing number of religious leaders were starting to speak out against slavery.

Split over slavery

The document also shines a spotlight on a critical moment in the history ofthe Baptist church.

It was signed two years after the issue of slavery prompted southern Baptists to split from northern Baptists and form theSouthern Baptist Convention,the nation’s largest Protestant denomination. The split in 1845 followed a ruling by the American Baptist Foreign Mission Society prohibiting slave owners from becoming missionaries. The northern Baptists eventually became American Baptist Churches USA.

“It comes from such a critical era in American history, you know, right prior to the Civil War,” said the Rev. Mary Day Hamel, the executive minister of the American Baptist Churches of Massachusetts.

“It was a unique moment in history when Baptists in Massachusetts stepped up and took a strong position and stood for justice in the shaping of this country,” she said. “That’s become part of our heritage to this day, to be people who stand for justice, for American Baptists to embrace diversity.”

A risky declaration

Deborah Bingham Van Broekhoven, the executive director emerita of the American Baptist Historical Society, said many Americans at the time, especially in the North, were “undecided” about slavery and weren't sure how to respond or were worried about speaking out.

“They thought it was a southern problem, and they had no business getting involved in what they saw as the state’s rights,” Van Broekhoven said. “Most Baptists, prior to this, would have refrained from this kind of protest. This is a very good example of them going out on a limb and trying to be diplomatic.”

The document shows ministers had hoped “some reformatory movement” led by those involved in slavery would make their action “unnecessary,” but that they felt compelled to act after they “witnessed with painful surprise, a growing disposition to justify, extend and perpetuate their iniquitous system.”

“Under these circumstances we can no longer be silent,” the document states. “We owe something to the oppressed as well as to the oppressor, and justice demands the fulfillment of that obligation. Truth and Humanity and Public Virtue, have claims upon us which we cannot dishonor.”

The document explains why the ministers “disapprove and abhor the system of American slavery.”

“With such a system we can have no sympathy,” the document states. “After a careful observation of its character and effects and making every deduction with the largest charity can require, we are constrained to regard it as an outrage upon the rights and happiness of our fellow men, for which there is no valid justification or apology.”

Who signed the document?

The Rev. Diane Badger, the administrator of the American Baptist Church of Massachusetts who oversees the archive, teamed up with the Rev. John Odams of the First Baptist Church in Boston to identify what she called the “Holy Grail” of abolitionist-era Baptist documents. Her great-grandfather was an American Baptist minister.

Since its discovery, Badger has put all the ministers' names on a spreadsheet along with the names of the churches where they served. Among them was Nathaniel Colver, of Tremont Temple in Boston, one of the first integrated churches in the country, now known as Tremont Temple Baptist Church. Another was Baron Stow, who belonged to the state's anti-slavery society.

Badger also is working to estimate the value of the document, which is intact with no stains or damage, and is making plans to ensure it is protected. A digital copy could eventually be shared with some of Massachusetts' 230 American Baptist churches.

“It’s been kind of an interesting journey and it’s one that’s still unfolding,” Badger said. “The questions that always come to me, OK, I know who signed it but who didn’t? I can go through my list, through my database and find who was working where on that and why didn’t they sign that. So it’s been very interesting to do the research.”

The Rev. Kenneth Young — whose predominantly Black Calvary Baptist Church in Haverhill, Massachusetts, was created by freed Blacks in 1871 — called the discovery inspiring.

“I thought it was awesome that we had over hundred signers to this, that they would project that freedom for our people is just,” Young said. “It follows through on the line of the abolitionist movement and fighting for those who may not have had the strength to fight for themselves against a system of racism.”

___

This story was first published on July 3, 2025. It was updated on July 4, 2025 to correct that the document shed light on the debate over slavery in the 19th century, not the 18th century."
https://www.yahoo.com/news/shuttle-discovery-could-leave-virginia-025033543.html,2025-07-03 05:00:00,Shuttle Discovery could leave Virginia for Texas,"CHANTILLY, Va. (DC News Now) — The Space Shuttle Discovery may take one more flight, to a possible new home in Houston, Tx.

The shuttle has been on display at the Udvar Hazy Center since it flew its final mission in 2012.

But a provision in the so-called “Big Beautiful Bill” would clear the way for Discovery to be moved.

Dozens took to the streets in Oxon Hill for community walk to address concerns

“I’m not conceding a loss,” said Chris Browne, director of the Smithsonian National Air and Space Museum, which includes Udvar Hazy.

He’s not giving up the shuttle without a fight.

“The Discovery is in its rightful place,” Brown said. “We have the legal means to keep it there.”

NASA, according to Browne, transferred ownership of the shuttle to the museum in 2012.

Texas Senators John Cornyn and Ted Cruz co-sponsored the legislation to move the shuttle.

“Houston has long been the cornerstone of our nation’s human space exploration program, and it’s long overdue for Space City to receive the recognition it deserves by bringing the Space Shuttle Discovery home,” Cornyn said in a statement.

Discovery flew 39 missions into orbit around the Earth during its history from 1984 through 2012, as the shuttle traveled nearly 150 million miles.

“Houston has long stood at the heart of America’s human spaceflight program, and this legislation rightly honors that legacy,” Cruz said in a statement.

Discovery has helped attract well over a million visitors a year to the museum. They hope the shuttle doesn’t leave.

“That would be really, really sad,” said Oscar Pozo Ortiz, a regular visitor to the shuttle with his family.

Virginia Senator Tim Kaine introduced an amendment to keep discovery where it is. But it appears to have failed to make it into the final version of the bill.

Copyright 2025 Nexstar Media, Inc. All rights reserved. This material may not be published, broadcast, rewritten, or redistributed.

For the latest news, weather, sports, and streaming video, head to DC News Now | DC, Virginia, Maryland News, Weather, Traffic, Sports Live."
https://www.yahoo.com/news/dead-body-discovered-near-park-043819071.html,2025-07-03 07:00:00,Body discovered near park in Morgan Hill amid search for missing woman,"MORGAN HILL, Calif. (KRON) — The Morgan Hill Police Department is investigating the discovery of a body near Anderson Lake County Park on Wednesday evening.

MHPD said they were alerted to the incident at 7:30 p.m.

Morgan Hill PD confirmed to KRON4 a person was flying a drone near the Woodchoppers Flat Picnic Area on East Dunne Avenue when they captured video of a “possible body” then called police.

Serial liquor thief caught with 71 bottles of tequila in Cupertino: SCCSO

Police officers and sheriff’s deputies arrived at the scene to confirm that it was a deceased individual, said Morgan Hill PD.

The discovery comes amid the search forMarissa DiNapoli, an 18-year-old Morgan Hill womanwho has been missing for four days. DiNapoli was last seen in the company of her boyfriend, Martin Mendoza.

Mendoza, who has been identified as a person of interest in the disappearance, is not cooperating with investigators, according to police.

On Thursday morning, Morgan Hill PD told KRON4 that at this time, they are not able to identify the body due to the condition it is in. A medical examiner is currently working to identify the body.

Copyright 2025 Nexstar Media, Inc. All rights reserved. This material may not be published, broadcast, rewritten, or redistributed.

For the latest news, weather, sports, and streaming video, head to KRON4."
https://www.yahoo.com/news/scientists-astonished-highly-toxic-feature-101503779.html,2025-07-03 12:00:00,Scientists astonished by highly toxic feature found in popular vape products: 'So high I thought our instrument was broken',"A new study has revealed a deeply troubling health risk hidden inside some of the most popular disposable vapes on the market — one that researchers say could be even more dangerous than traditional cigarettes.

According to the research, from theUniversity of California, Davis, several disposable vape brands emit lead, nickel, and antimony at levels far above safety limits — with one device releasing more lead in a single day than nearly 20 packs of cigarettes.

Published inACS Central Science, the study tested seven devices from three well-known disposable vape brands. Using a lab instrument that mimicked 500 to 1,500 puffs, researchers found that metal concentrations in the vapor increased with each use.

""When I first saw the lead concentrations, they were so high I thought our instrument was broken,"" said lead authorMark Salazar. That discovery launched a deeper analysis, uncovering that metals were either present in the e-liquid itself or leaching from internal components like leaded bronze parts and degrading heating coils.

Four devices emitted nickel and lead at levels that surpassed thresholds for neurological and respiratory harm. Two exceededcancer risk limitsdue to high antimony levels — a known carcinogen.

These devices are especially popular with teens and young adults — the same group most vulnerable to the effects of heavy metal exposure, including long-term damage to brain development and lung function.

Many of the disposable vapes tested are also technically illegal in the U.S. but continue to flood the market through online sellers and unregulated distributors. The speed at which new products hit the shelves has far outpaced both regulation and scientific research.

On top of health risks, disposable vapes pose a serious environmental challenge. With built-in batteries, plastic casings, and metal parts, they are notoriously difficult to recycle — often ending up in landfills, where they can leak toxins into the environment.

While stronger regulations are essential, there are meaningful steps individuals can take to protect themselves and their communities. For someone who uses disposable vapes, learning more about what's inside and the long-term implications it can have — and considering safer options or limiting use — can make a real difference.

When it comes to disposal, many local e-waste programs — including mail-in options through Big Sky Recycling or electronics takeback at Best Buy — can help keep harmful materials out of landfills.

And for those looking to go a step further, swapping outsingle-useitems in daily life — like plastic bottles or disposable batteries — is a small but empowering way to reduce waste and breathe a little easier, both literally and figuratively.

Do you worry about having toxic forever chemicals in your home?

Majorly

Sometimes

Not really

I don't know enough about them

Click your choice to see results and speak your mind.

Join ourfree newsletterfor weekly updates on the latest innovationsimproving our livesandshaping our future, and don't missthis cool listof easy ways to help yourself while helping the planet."
https://www.yahoo.com/news/green-crab-discoveries-ketchikan-show-130007475.html,2025-07-03 14:15:00,Green crab discoveries in Ketchikan show the invasive threat is spreading in Alaska,"The European green crab, as pictured here, is an invasive species that threatens native fish populations. The invasive crabs were first discovered in Alaska in 2022 at Annette Island, and their numbers in the state have grown dramatically. In June, their shells were found in Ketchikan. (Photo by Emily Grason/Washington Sea Grant)

On a sandy beach in a state park in Ketchikan, a group of local beachcombers encountered something ominous: shells of two invasive European green crabs, shed as part of the creatures’ growth process.

Thatdiscovery, made during a June 6 beach survey that was part of a class held by the University of Alaska Southeast Ketchikan campus, led to more in the community.

It makes Ketchikan the newest known Alaska beachhead in a northward invasion of non-native crabs that are known to wreak havoc on native species and habitats.

European green crabs, firstconfirmedto be in Alaska when their shells werediscovered in 2022on Annette Island in the far southeast corner of the state, are likely here for good, said the UAS professor who was one of the class instructors and helped lead the beach surveys.

“They have continued to spread. They will continue to spread,” said Barbara Morgan, who isbased in Ketchikan. “They are expected to spread through Southeast Alaska, probably most of Southcentral — kind of the southern coast of Southcentral. And maybe, depending on water temperature and how tolerant they are to the colder water temperatures, they might go up into the really southern part of the Bristol Bay area, too.”

In time, they could threaten some of Alaska’s most important habitats for salmon and other fish.

The crabs eat salmon fry, juvenile native crabs like Dungeness and other fish, and they mow down eelgrass beds that are important Alaska fish habitat.

“Green crab could potentially damage Alaska’s multi-billion dollar fisheries industries, especially for salmon, crab, and mariculture operations,” the National Oceanic and Atmospheric Administration haswarned.

European green crabs werefirst foundin waters of the U.S. East Coast in the 1800s, believed to have been transported in ships’ ballast water. In 1989, the first green crabs were discovered in U.S. West Coast waters, also believed to have been carried accidentally in ballast water. Over the following years, they spread northward. The first sightings inBritish Columbiawere in 1998.

The Alaska first discovery, at Annette Island, was about 30 miles south of the beach site where Morgan’s class found the crab shells in June. And last summer, green crab shells were found at Gravina Island, just west of Ketchikan.

An eventual discovery in Ketchikan was largely expected. But the precise site of the June 6 discovery — atRefuge Cove State Recreation Site— was a bit surprising because of the nature of the site, Morgan said.

Green crabs generally prefer estuarine areas, places where freshwater and saltwater meet, and places with thick eelgrass, she said. But the Refuge Cove beach site is sandy and not an estuary, and thus not considered to be a prime spot for the crabs.

Crabs’ upper shells, called carapaces, are discarded periodically as the animals grow and need larger shells. Discovery of the molted shells suggests that the invasive crab were in the larval stage when they were pushed by currents north to Alaska, Morgan said.

After the first two shells were found during the class survey, the discoveries in the community “snowballed,” with additional shells found at Refuge Cove, plus more at other sites along the Ketchikan road system, she said. It is likely that there are more at other sites that are less accessible for surveys, she said.

The species’ name can be confusing because the crabs are not necessarily green, Morgan said. They can be brown or yellow or reddish, or a mixture of colors, she said. Meanwhile, some native crabs that do belong in Alaska are green, including kelp crabs, and should not be mistaken for the invaders, she said.

The “European” part of the name is not accurate, either, she said. “Yes, they came from Europe; they’re not in Europe anymore,” she said.

Morgan and other invasive species experts are trying to spread awareness — and the message about what the crabs look like. Telltale signs come from the shape of the shells, which have three bumps between the crabs’ eyes and five spikes on either side.

The Metlakatla Indian Community, a Tribal government on Annette Island, has been particularly active in combatting European green crabs.

The Tribe established a detection program in 2020 and made the first discovery of shells in 2022, as well as the Gravina Island discoveries last year.

Through its program, the Tribe has also trapped thousands of European green crabs. The total had reached about 3,000 as of last summer, according to the Department of Fish and Game, and it continues to grow.

In just the past month, the Tribal team trapped over 300 of the live crabs on Gravina Island, said Ian Hudson, a fisheries biologist who coordinates the Tribe’s European green crab program.

“This year there has been an explosion in numbers, and we’re not at all surprised that Ketchikan is finding carapace,” he said by email.

Metlakatla’s efforts are highlighted in the Alaska Department of Fish and Game’s2023-2028 planfor combatting European green crabs. That plan lays out steps for prevention, early detection, rapid response and control.

But by now, full prevention may not be possible anymore, Morgan said.

With millions of European green crabs on the West Coast, and with currents that continue t send their larvae north, it is highly unlikely that all incursions could be prevented, she said.

“Even if we get rid of all of them in Alaska, we would need to build a fence across Dixon Entrance, a fine net. And that’s obviously not going to happen,” she said, referring to the maritime border site between Canada and Alaska.

Instead, she said, “functional eradication” like what the Metlakatla Indian Tribe is doing with trapping is likely to be increasingly important, with focuses on key sites important to native species like salmon and Dungeness crab. Baseline surveys can help identify those areas that need to be most protected, she said.

While the European green crab is considered to be among the world’s most damaging invasive species, it is not the only one that threatens Alaska’s environment and fishing industry.

Another example is elodea, a freshwater plant often used in aquariums. First found in Eyak Lake in Cordova in 1982, it has spread to other lakes and streams in Southcentral and Interior Alaska. Potential economic losses — to commercial sockeye salmon and to recreational floatplane pilots — could be well over $1 billion, Tobias Schwoerer, a University of Alaska Fairbanks economist,estimated in a 2017 study.

Invasive northern pike in Southcentral Alaska, which have proved to bepersistent, also pose ecological and economic threats. The fish prey on salmon, trout and other native species. The Department of Fish and Game has aprogramto remove invasive pike and try to limit their spread.

For now, much of the work to combat nonnative species is coordinated by the Alaska Invasive Species Partnership, a coalition of government agencies, university experts, nonprofits and community organizations.

The partnership has advocated for years for the establishment of a more robust organization within state government, an invasive species council, to organize wider protection and rapid response, if needed.

Bills pending in the Alaska Legislature would do that. One measure,House Bill 191, made it through one committee. A Senate version,Senate Bill 174, had two hearings.

In past years, similar bills progressed through the Legislature but failed to make it to final passage. The most recent was in 2022, when a bill to establish a state invasive species councilpassed the Houseby 33-2 margin but failed to reach the Senate floor before that session’s adjournment.

Proponents hope results in the coming session will be more successful.

The sponsor of the current House bill, Rep. Rebecca Himschoot, I-Sitka, worries not only about green crabs moving their way through Southeast Alaska but also invasive plants like knotweed that have appeared in important community spots like Harbor Mountain.

“Each year, there’s more knotweed and less salmonberries,” she said in an interview late in the session. She hopes the bill will win final passage next year, she said.

Sen. Forrest Dunbar, D-Anchorage, is another proponent of an invasive species council.

He said he has been aware of invasive species since his childhood in Cordova, where he and a friend earned money from a neighbor by killing invasive black slugs at about a nickel apiece. Later, as a member of the Anchorage Assembly, he worked on efforts to remove invasivechokecherry trees, which were introduced as ornamentals but have since crowded out native species along the city’s greenbelts.

Dunbar acknowledged concerns that an invasive species council would cost the state money because it would require a dedicated employee in the Department of Fish and Game. But he argues that failing to set up such a council would cause more expense in the long run.

“I would say, we can’t afford to not prevent invasive species from entering Alaska,” Dunbar said in an interview near the end of this year’s session. “It is very expensive to have invasive species to start pushing out native species.”

Correction: The article incorrectly stated the number of hearings that Senate Bill 174 had. It had two.

SUBSCRIBE: GET THE MORNING HEADLINES DELIVERED TO YOUR INBOX"
