URL,Date,News_title,News_text
https://www.yahoo.com/news/19-old-indicted-violent-attack-163907153.html,2025-07-03 17:45:00,"19-year-old indicted for violent attack, rape of minor in Tel Aviv","The two met through the TikTok app on June 16, three days after the strikes on Iran sent the country into emergency mode.

Content warning: This article contains detailed descriptions of a violent attack of physical and sexual nature that may be disturbing and upsetting. Reader discretion is advised; please proceed with caution.

David Lacks, 19, was indicted on Thursday for theviolent attackand rape of a 15-year-old girl in Tel Aviv.

The two met through theTikTokapp on June 16, three days after the strikes on Iran sent the country into emergency mode.

The girl lied about her age, saying she was 17. They met that Monday and spent the day in Rosh Ha’ayin together.

The next day, on June 17 at around 3 p.m., Lacks picked her up in his car from her house, driving towardsHayarkon Parkin Tel Aviv. On the way, he told her he had alcoholic beverages in his bag. He drank a full cup of Arak, while she drank some Arak mixed with lemonade.

When they arrived at the park, they sat on the grass and began to kiss. During the kiss, he bit her upper lip hard, making it swell.

He then poured a full cup of Arak down her throat. She got dizzy and laid down on the grass to steady herself, but he laid on top of her, on her stomach, and bit her face, close to her right eye, and on her left cheek and ear, hurting her.

She began to scream, asked that he stop, and told him he was hurting her. He responded that he enjoyed seeing her in pain.

She reached for his hands in an attempt to push him off of her, but he pulled off her shirt and bra, bit and aggressively sucked her nipples, leaving bruises, “all for the sake of debasement and his own sexual pleasure,” reads the indictment.

At around 5:15 p.m., a siren went off, signaling a missile launch, and they together ran to a nearbyshelter. She cried the whole time.

When the all-clear signal was sent out, they smoked a cigarette together outside. Lacks put out the cigarette on her left arm, saying, again, that he enjoyed seeing her in pain, and leaving a cigarette-butt-shaped burn mark.

They then returned to the park; she was dizzy from all the alcohol and fell to the floor, lying on her stomach. He grabbed her behind and aggressively massaged it.

He then told her to follow him out to an area close to some nearby trees so he could urinate. He left his pants down, his genital area exposed, and asked if she wanted to have sex with him.

She said no, and he asked instead if she would service him anyway. She said no, he asked again, and after she again refused and turned to leave, he grabbed her by her hair, turned her around, and rubbed himself up against her.

He again asked if she wanted to have sex, and she again refused.

He raped her then, holding her by her head.

She managed to break from his grasp and turned to leave, but due to her intoxicated and incapacitated state, she again lay on the grass. He lay next to her and put his hand into her underwear. She tried to swat it away, but he pressed on.

He then grabbed her hand and forced it into his pants to touch him, asking her if she “knows how to suck well, with teeth.” She responded negatively, and he asked her, again and again, if he could put it in her mouth. He eventually did that, against her will, until he finished.

He was arrested on June 22. The charges against him are rape, indecent acts with force and assault, aggravated assault, and personal injury.

The prosecution noted that her recollections of the event were consistent in questioning, and that her parents and sister bore witness to her physical and emotional state after the attack. The victim also told a close friend what had happened to her.

Lacks denied all the charges against him.

Elem, an association for teens-at-risk, said in response: “We believe [her]... It is up to all of us to take responsibility and face reality. This necessitates a thorough and fundamental check of how the system handles cases like these.” It added that it deals with hundreds of sexual assault cases in teens-at-risk every year.

“We have to remember that sexual assault victims won't always be able to come forward. When such an attack takes place, not just the victim but their entire circle gets hurt.”"
https://www.yahoo.com/news/southern-california-mayor-stripped-title-151941537.html,2025-07-03 17:45:00,"‘This was a power grab’: Southern California mayor stripped of title, responsibilities","PalmdaleMayor Richard J. Loawas stripped of his title and removed from all committee and city assignments Tuesday night, pending an investigation into “confidential allegations.”

The dramatic move unfolded during acontentious city council meeting.

The events began when City Attorney Alexandra Halfman requested Loa recuse himself from a confidential agenda item, citing an alleged conflict of interest. Loa questioned the addition of the item and its confidentiality.

Following an hour-long closed session, Councilwoman Andrea Alarcón introduced an emergency agenda item based on “information that was just recently brought to light,” she stated.

Despite Loa’s objections, the council — excluding Loa — unanimously voted to remove him from all committees and committee assignments and strip him of his mayoral title, pending the outcome of the investigation.

In a statement released Thursday evening to KTLA, Loa called his dismissal “political theater,” and said his removal was not the result of a “legitimate process,” but was instead a power grab by his former colleagues.

“The council added a so-called ’emergency item’ in violation of the Brown Act and proceeded in closed session, without notice, evidence, or public input. That’s not how democracy works,” Loa wrote in a list of grievances provided to KTLA.

He continued by saying he has not been told by any members of the council what he’s been accused of, alleging that the council engaged in a “secret trial” that lacked due process.

“If this is how they treat the Mayor, imagine what they’re doing to staff and residents behind closed doors,” the statement reads.

Loa was appointed to the Palmdale City Council in 2018 and served as Mayor Pro Tem three times before becoming mayor on Jan. 1, 2025.

In 2022, the city eliminated direct mayoral elections, opting for an annual rotation among council members. However, in April, the council voted to scrap that system, allowing the mayor and mayor pro tem to be chosen by a majority council vote and granting the council authority to replace a mayor mid-term. Loa was the lone dissenter in April’s vote,according to the Antelope Valley Press.

Mayor Pro Tem Laura Bettencourt will assume mayoral duties in the interim.

Loa, meanwhile, says he plans to continue to fight the decision and claimed the truth would eventually come out.

“I will not be intimidated into silence,” he said.

Copyright 2025 Nexstar Media, Inc. All rights reserved. This material may not be published, broadcast, rewritten, or redistributed.

For the latest news, weather, sports, and streaming video, head to KTLA."
https://www.yahoo.com/news/people-not-holding-back-discovering-164329784.html,2025-07-03 17:45:00,"""Half-A**ed, Just Like The Policies"": President Trump's One-Day-Old Detention Center Is Already Falling Apart, And People Are Roasting Him","On July 1, President TrumptouredFlorida's new immigration detention camp, dubbed ""Alligator Alcatraz,"" located in the Florida Everglades. Along with Florida Governor Ron DeSantis during a press conference, they touted how quickly the facility was set up: in just under eight days.

(If you, too, are squinting trying to read President Trump's hat, I zoomed in on it — and it says ""GULF OF AMERICA: Yet Another TRUMP Development."")

Related:A Clip Of Donald Trump Getting Angry After Being Fact-Checked Is Going Mega Viral, And It Sums Up His Entire Presidency In A Nutshell

For a little background, Gov. DeSantis used anemergency orderto seize the Dade-Collier Training and Transition Airport area from Miami-Dade County, and CBSreportsthat it was paid for by funds from ""FEMA's shelter and services program, an initiative created by Congress to support groups and cities receiving migrants and asylum-seekers released from federal custody along the U.S.-Mexico border.""

Accordingto CBS, the ""facility will have up to several thousand beds to house, process and deport individuals who were in the country illegally.""

Environmental groups have alreadyfiled suitto stop the detention center from opening until a full environmental review has been completed.

Well, it looks like all that speedy building may have resulted in some less-than-ideal conditions.Anna Eskamani, aDemocrat congresspersonrepresenting Florida's 42nd district, shared avideoon TikTok illustrating what the place looks like already:

@annaforflorida / Viatiktok.com

Asummer rainstormduring the press conference caused water to seep underneath the tent and onto the floors (around a bunch of electrical cords, no less).

Anna said in a caption on the video, ""Flooding already happening at the Trump/DeSantis interment camp in the Everglades that iscosting us more than $450M. Not only is this an environmental disaster, but it is inhumane & not even close to being safe! We do NOT need this! Imagine if this time and money went into affordable housing instead.""

Here's even more water, pooling in front of the door.

Related:5 Absolutely Horrifying Ways Republicans Are Explaining Why They're Fine With People Losing Healthcare

Unsurprisingly, commenters did not hold anything back. ""Let the weather and incompetence do the job before anyone is sent there.""

""they always seem to have money to hurt people. but money for public transit, or schools, or community health care? sorry we're broke.""

Related:Donald Trump Just Commented On Potentially Pardoning Diddy And Said The Most Donald Trump Thing Ever

""Imagine building something in a swamp and expecting it not to flood.""

""Can you imagine what would happen in a hurricane?""

The video also made its way over to Twitter (X), where people continued to share their thoughts. ""The flooding at 'Alligator Alcatraz' is a glaring example of the systemic neglect and human rights violations inherent in migrant detention centers.""

""Aren't there STANDARDS for what constitutes a 'detention center'?""

Related:Hillary Clinton Just Hit On One Of Donald Trump's Biggest Insecurities With Three Words

""'We finished it in one week'. This is what you get when you do things half-assed. Just like the policies...""

Regarding the rainfall in the area, the local Naples Daily Newsreportedthat it gets around 60 inches of rain per year. And prior to the flooding, State Division of Emergency Management Executive Director Kevin Guthrie told them that ""the untested site constructed in eight days can withstand Category 2 winds of 110 mph, significantly less than the three major storms that impacted Southwest Florida the past three years."" However, the National Park Servicesaysthat the ""Everglades National Park lies within one of the most active hurricane areas of the United States.""

The Miami Herald alsoreportedin late June that ""In the event of a hurricane, Division of Emergency Management officials [said] that detainees and staff would be evacuated from the site. The agency added that it is developing a disaster plan.""

After yesterday's rainstorm, theTampa Bay Timesreported that Stephanie Hartman, the deputy director of communications for the Division of Emergency Management, said the issues had been resolved. “Overnight, the vendors went back and tightened any seams at the base of the structures that allowed water intrusion during the heavy storm, which was minimal.”

If you'd like to watch the full video, you can do so below. And I'd love to know: What do you think? Do you have concerns about this new detention center? Let us know in the comments.

@annaforflorida / Viatiktok.com

Also in In the News:Zohran Mamdani Just Delivered The Most Epic Response After Trump Called Him A ""100% Communist Lunatic""

Also in In the News:Uhhh, People Zoomed Into This Picture Of Donald Trump And Found A Scary Surprise

Also in In the News:""This Is A Sad Day For America"" — MAGA Supporters Have A LOT To Say About Trump's ""Big, Beautiful"" Tax Bill, And It's Not What I Was Expecting

Read it on BuzzFeed.com"
https://www.yahoo.com/news/traffic-east-longmeadow-july-3rd-150313989.html,2025-07-03 17:45:00,"Traffic in East Longmeadow for July 3rd concert, laser show","EAST LONGMEADOW, Mass. (WWLP) – The July 3rd concert and laser light show takes place at Mapleshade School in East Longmeadow on Thursday night, which will impact traffic in the area.

Massachusetts drivers brace for July 4 travel rush

Mapleshade Avenue between Porter Road and Elm Street will be reduced to one-way traffic at about 5:00 p.m. Drivers can head westbound on Mapleshade from Porter and Pleasant towards Elm Street. The eastbound lane from Elm Street towards the school will be closed.

If you’ll be attending, be aware of changes to parking. Parking will be permitted off to the side of the westbound lane/north side of Mapleshade Avenue, but will be prohibited on the eastbound/south side of Mapleshade Avenue to make sure there is enough room for emergency vehicle access. No parking will be available on Breezy Knoll Road. Signs will be posted around the area, and police will also be there to direct traffic.

A limited number of handicap parking spaces are made available at the Mapleshade School. Parking will be available in the parking lot at Birchland Middle School, and also on some of the nearby neighborhood streets.

The concert starts at 7:00 p.m. with the laser show following at 9:00 p.m.

WWLP-22News, an NBC affiliate, began broadcasting in March 1953 to provide local news, network, syndicated, and local programming to western Massachusetts. Watch the22News Digital Editionweekdays at 4 p.m. on WWLP.com.

Copyright 2025 Nexstar Media, Inc. All rights reserved. This material may not be published, broadcast, rewritten, or redistributed.

For the latest news, weather, sports, and streaming video, head to WWLP."
https://www.yahoo.com/news/portion-road-youngstown-closing-due-150412494.html,2025-07-03 17:45:00,Portion of road in Youngstown closing due to emergency sewer repair,"YOUNGSTOWN, Ohio(WKBN) – A portion of S. Schenley Road is closing due to an emergency sewer repair.

A news release from the city Department of Public Works states that S. Schenley northbound will be closed between Canfield and Kirk roads.

The road is expected to reopen on Monday, July 7.

During the closure, traffic to St. Christine’s Church will be maintained, the release stated.

Copyright 2025 Nexstar Media, Inc. All rights reserved. This material may not be published, broadcast, rewritten, or redistributed.

For the latest news, weather, sports, and streaming video, head to WKBN.com."
https://www.yahoo.com/news/between-cancer-exercise-patients-know-160024005.html,2025-07-03 17:45:00,The link between cancer and exercise that patients should know,"We all know that regular exercise has many benefits, including reducing the risk of chronic diseases such as diabetes and heart disease.

Exercise also improves outcomes in patients with cancer, according to a new study published in theNew England Journal of Medicine. Patients with cancer who participated in a structured exercise program in a randomized-controlled trial lived longer without cancer recurrence and had a lower risk of dying within the trial period compared with people in the control group.

I was curious why and how exercise reduces cancer risk, and what everyone should know about incorporating exercise programs in their lives. To find out, I spoke with CNN wellness expert Dr. Leana Wen. Wen is an emergency physician and adjunct associate professor at George Washington University. She previously served as Baltimore’s health commissioner.

CNN:Why are the results of this study so important?

Dr. Leana Wen:Previous research suggested that exercise could be beneficial for cancer survivors, but this is the first randomized trial that demonstrates exercise after cancer treatment can reduce recurrence and improve survival.

Researchers recruited nearly 900 patients from 55 cancer centers across six countries who had been treated for either stage III or high-risk stage II colon cancer. Even after cancer treatments such as surgery followed by chemotherapy, colon cancer comes back in anestimated 30%of patients, according to the American Society of Clinical Oncology. Many patients with recurrence of their colon cancer end up dying from their disease.

The patients in the new study were randomized to two groups. The control group received standard health education materials promoting healthy eating and physical activity. This is the current standard-of-care that is provided to patients in remission from their cancer.

The other group participated in a structured exercise program that involved working with a health coach for physical activity guidance and supervised exercise sessions. During the initial six months, patients had twice-a-month coaching sessions. After that period, they met with coaches once a month, with extra sessions available if needed.

Participants randomized to the structured exercise group had significantly higher improvements in physical function as measured by distance they could walk in six minutes and predictedVO2 max(your oxygen uptake), both indicators of cardiovascular fitness.

The two groups were followed for an average of about eight years. During this period, 131 patients in the control group had recurrence of their cancer, compared with 93 in the structured exercise group. In the control group, 66 people died, compared with 41 in the structured exercise group.

People in the structured exercise group had a 28% lower risk of developing recurrent or new cancers compared with those who followed standard-of-care protocols. Members of the exercise group also had a 37% lower risk of death in the trial period.

This study is important because its rigorous methodology confirms what previous research had suggested: Exercise extends disease-free survival for patients with cancer and should be incorporated as part of holistic treatment for patients to reduce their risk of recurrent and new cancers.

CNN: How might results of the study change treatment for patients with cancer?

Wen:Imagine if there were a clinical trial for a new drug that found it lowered the risk of developing recurrent or new cancers by 28% and lowered the risk of death in the trial period by 37%. Patients and doctors would hail this as a tremendous development and would be eager to try this new therapeutic.

That’s the magnitude of the findings in this study. I believe they have the potential to substantially change cancer treatment protocols. Currently, after patients receive treatments such as surgery, chemotherapy and radiation, they are given advice to exercise, but many probably do not engage the services of a health coach or trainer. Their oncologists and primary care doctors may not be asking about their physical activity regimen during follow-up care.

I hope this will change, in view of these results. Patients can be counseled to have an “exercise prescription,” and health care providers can follow up to track their exercise activity. Perhaps insurance companies could even consider reimbursement for a health coach for patients with cancer; this could be seen as an investment to reduce the need for costlier chemotherapy and other treatments down the line.

CNN: Why and how does exercise reduce cancer risk?

Wen:Population studies havelong shownthat regular physical activity is associated with lower risks of developing certain cancers. There areseveral theoriesas to why this is the case. One is that physical activity helps people stay at a healthy weight, which is notable because obesity is a risk factor for developing some cancers. In addition, exercise is thought to help regulate some hormones that are implicated in cancer development and to reduce inflammatory response that could also be involved in cancer.

CNN: How much exercise do people need?

Wen:TheUS Centers for Disease Control and Prevention recommendsthat adults participate in at least 150 minutes of moderate to high-intensity exercise per week. For someone who is exercising five times a week, that’s about 30 minutes at a time of exercises such as a brisk walk or jog, riding a bike or swimming.

The benefits of these exercise minutes are cumulative, meaning that individuals don’t need to do them all at once to have an effect. People who are unable to commit a period of time to exercise could consider how they could incorporate physical activity into their daily routines. Could they take the stairs instead of the elevator at work? If they do this five times a day, that could be as many as 10 minutes of exercise. Could they take a 10-minute phone meeting while walking in their neighborhood instead of sitting at a desk? Could they park a bit farther away to get in a few more minutes of physical activity? Small changes add up.

CNN: What other advice do you have for people who want to begin exercise programs?

Wen:Many studies show that while it’s ideal to get the recommended 150 minutes a week of exercise, there is asignificant benefitfrom even a small amount of physical activity. The best advice I can offer is to not let the perfect be the enemy of the good — start with what you can.

For instance, consider the idea of “exercise snacks,” or bursts of activity that could be as short in duration as 15 or 30 seconds. These are as simple as doing a few squats or performing household chores. Getting up from your chair and just moving around helps, which is especially important for desk-bound workers whoneed additional exerciseto counter the negative health impacts of sitting.

Sign up forCNN’s Fitness, But Better newsletter series. Our seven-part guide will help you ease into a healthy routine, backed by experts.

For more CNN news and newsletters create an account atCNN.com"
