URL,Date,News_title,News_text
https://www.yahoo.com/news/tearful-mother-begs-firefighters-let-170134229.html,2025-07-04 17:30:00,Tearful Mother Begs Firefighters to Let Her onto Scene of California Fireworks Explosion Where Her 3 Sons Worked: ‘I Want to Search for My Kids’,"Seven people remain missing after an explosion at a fireworks facility in Esparto, Calif., on July 1

Mother Marisol Ramos said she wants to search the explosion scene for her three missing sons, despite authorities warnings of potential dangers

“Let us do it,” a tearful Ramos toldToday

A mother who said her three children worked at theCalifornia fireworks facility that was the scene of an explosionis pleading with fire officials to let her help in the search for her loved ones.

Marisol Ramos recently toldTodayon Friday, July 4, that she has not heard from her three sons since the Tuesday, July 1, explosion in Esparto. Seven people were unaccounted for, according to officials.

Authorities said at the time they could not move forward with the search until the scene was safe due to the potential dangers.

Ramos, who immediately went over to the facility on the evening of the disaster, toldTodaythat she hasn’t received any answers since the incident.

“Let us do it,” a tearful Ramos said. “I’m willing to go in … I want to search for my kids.”

According to the family, the missing brothers are Jesus Ramos, 18, John Ramos, 22, and Joel ""Junior"" Melendez, 28, Fox affiliateKTVUreported.

Syanna Ruiz, the girlfriend of Jesus Ramos, told local outletKSBWthat Tuesday was her boyfriend's first day on the job at the facility.

""We have a baby on the way,"" she said. ""They were saying that there was a warning beforehand, but somebody is behind this. There's no way that this just happened.""

Ruiz also told ABC affiliateKXTVthat Jesus was ""excited"" for the ""new chapter"" in their lives. He was working alongside Johnny and Junior.

""They were all three incredible men who had so much coming for them,"" she said. ""And I'm just praying to God someway, somehow, that they're okay.""

In aWednesday, July 2, update, officials said emergency responders have been working to gain access to the facility “to conduct recovery operations and bolster investigative efforts for the explosion investigation.” They added that the scene “remains active and hazardous with explosions continuing to occur throughout the afternoon and evening.”

Kent Porter/The Press Democrat via AP

The County of Yolo, where Esparto sits, said in anupdateon Thursday, July 3, that progress has been made in stabilizing the site and evacuation orders have been reduced in certain areas due to improved ground conditions and real-time risk assessments. It also said that utility crews are working to restore power to the affected areas.

“Field crews remain in the area to monitor evolving hazards and ensure public safety,” the county said in its update.

""Due to the presence of known explosive materials on site, explosive ordinance disposal experts are working alongside fire personnel to ensure safety during suppression activities,” the county’s update further stated.

Area residents recalled feeling and hearing Tuesday’s massive blast.

“Initially people thought it was a plane crash or something like that,” Yolo County librarian Diana Lopez toldThe Sacramento Bee.“Most of us didn’t know there was a fireworks facility so close by.”

“It felt like an earthquake,” Jairo Frausto, 14, told the newspaper.

The fireworks facility reportedly housed large pyrotechnics for aerial displays in Northern California, including for events scheduled for the July 4th holiday on Friday, perThe New York Times.

Kent Porter/The Press Democrat via AP

Devastating Pyrotechnics, the fireworks company, issued a statement on its website that read: ""Our hearts and thoughts are with those we lost, their families, and everyone impacted in our community. We are grateful for the swift response of law enforcement and emergency personnel. Our focus will remain on those directly impacted by this tragedy, and we will cooperate fully with the proper authorities in their investigation.""

Local officials, however, have not confirmed whether there were any casualties from the incident, theTimesreported.

CAL FIRE is leading the investigation into the incident, said officials.

PEOPLE contacted the County of Yolo on Friday, July 4, for additional updates.

Read the original article onPeople"
https://www.yahoo.com/news/westbound-interstate-76-reopens-rollover-130352545.html,2025-07-04 17:30:00,Westbound Interstate 76 reopens after rollover crash Friday morning,"DENVER (KDVR) — Five people have been transported to the hospital following a rollover crash in the 11400 block of westbound Interstate 76 early Friday morning.

The road was closed between CO 2/Colorado Boulevard and CO 44/104th Avenue (Commerce City) at Mile Point 16 in response to the crash, but has since reopened to traffic as of 8:14 a.m.

I-70 reopens after 1 person, dog die in crash near Eisenhower Tunnel

The Commerce City Police Department said one of the individual’s was taken to the hospital with serious bodily injury. The cause of the crash is under investigation.

Copyright 2025 Nexstar Media, Inc. All rights reserved. This material may not be published, broadcast, rewritten, or redistributed.

For the latest news, weather, sports, and streaming video, head to FOX31 Denver."
https://www.yahoo.com/news/train-collides-truck-railroad-crossing-155703659.html,2025-07-04 18:30:00,Train collides into truck at railroad crossing,"GARFIELD COUNTY, Colo. (KREX) – An Amtrak train hit a truck Thursday at a railroad crossing near New Castle, but thankfully no injuries were reported.

According to the Garfield County Sheriff’s Office, the train didn’t derail. Although the crash wasn’t as bad, GCSO said it could have been much worse.

“Look. Look again. And always expect a train. Even if you’ve crossed the tracks a hundred times, take the extra second. It could save your life,” the sheriff’s office stated.

GCSO also said if anyone is struck in their vehicle on the track, immediately get out of the car, move away from the tracks and call 911.

The Amtrak was heading to Grand Junction when the crash occurred.

Copyright 2025 Nexstar Media, Inc. All rights reserved. This material may not be published, broadcast, rewritten, or redistributed.

For the latest news, weather, sports, and streaming video, head to WesternSlopeNow.com."
https://www.yahoo.com/news/several-children-injured-crash-dunwoody-172233417.html,2025-07-04 19:00:00,Several children injured in crash at Dunwoody 4th of July parade,"Police said multiple children and an adult were injured in a crash involving pedestrians during the Fourth of July parade Friday.

Dunwoody police said it happened on Mount Vernon Road at Dunwoody Village Parkway. No one is in critical condition and most were transported to nearby hospitals.

The driver of an F-150 Lightning paused to switch drivers and continue on in the parade. During the switch, the new driver mistakenly hit the accelerator, which caused the vehicle to lunge forward.

[DOWNLOAD:Free WSB-TV News app for alerts as news breaks]

The truck hit a person, knocking her to the ground, police said. When the driver hit the brakes, the trailer disconnected and caused several people on it to fall off.

Officials are still actively investigating the crash and have no other information to release at this time, they said.

[SIGN UP:WSB-TV Daily Headlines Newsletter]"
https://www.yahoo.com/news/did-speeding-play-role-diogo-184953165.html,2025-07-04 20:30:00,Did Speeding Play a Role in Diogo Jota's Death?,"As the soccer world mourns the death of Liverpool and Portugal star Diogo Jota, authorities continue investigating the cause of the deadly car crash in Spain early on July 3.

Jota's brother, André Silva, also a professional soccer player, was also killed in the wreck.

A source close to the sub-delegate of the Spanish government in Zamora revealed the crash is being investigated as “a possible speeding incident,"" according toCNN, citing the UK's PA News Agency.

The crash occurred around 12:30 a.m. local time in Zamora, a city in northwestern Spain.Mundo Americareportedthat the Lamborghini is expected to be a Huracán model, ""according to the only recognizable feature after the accident: the rims.""

Authorities told CNN the incident was caused by a “burst tire while overtaking."" The vehicle that Jota and his brother were in left the road and subsequently caught fire, officials said.

It is not known which brother was driving the Lamborghini that the brothers were traveling in.

""At this moment in time it is impossible to say at exactly what speed the car was going but that is something the Civil Guard investigators will be able to detail at least approximately in their final report from things like the skid marks,"" a spokesperson for the Civil Guard law enforcement agency, which is leading the investigation,told ABC News Australia.

Their remains were moved to the nearby town of Puebla de Sanabria, a source close to the sub-delegate of the Spanish government in Zamora told CNN.

A reportin the Portuguese-language siteRecordsaid Jota and his wife, Rute Cardoso, attended a friend's wedding over the weekend.

According toRecord, Jota and his brother were heading to Liverpool, ""following by car trip to Santander (Spain) from where he would follow by ferry to the south of England and then to Liverpool.""

Jota married his long-term partner, Cardoso, less than two weeks before the crash. The couple has three children.

Related: Diogo Jota Crash Scene Photos Show Torched Lamborghini

Did Speeding Play a Role in Diogo Jota's Death?first appeared on Men's Journal on Jul 4, 2025"
https://www.yahoo.com/news/death-top-russian-oil-executive-193341198.html,2025-07-04 20:30:00,Death of top Russian oil executive fuels fresh scrutiny of elite's 'window falls',"The unexplained death of a topRussian oilexecutive on July 4 is fueling renewed scrutiny over the rising number of high-profile Russian officials and businessmen who have died under mysterious circumstances, specifically, have fallen out of windows.

Andrei Badalov, vice president of Transneft, Russia's largest state-controlled pipeline transport company,diedafter falling from the window of his apartment inMoscow.

Russian state news agency TASS, citing law enforcement sources, claimed the preliminary cause of death was suicide.

While Russian authorities often label these falls as suicides or accidents, others suggest something more deliberate may be at play.

Ivan Stupak, a Ukrainian military analyst and former security service (SBU) officer, said it's likely that Russia's own security services are behind many such deaths.

""They can pressure a person in one way or another. It's a well-known tactic — either you kill yourself, and your family is left in peace with what they have, or they start arrests, imprisonments, and leave everyone destitute,"" he told the Kyiv Independent.

Since early 2022, dozens ofRussian businessmen, state officials, and industry leaders have died under questionable circumstances.

While many of these cases have officially been labeled as suicides, others involve alleged murder-suicides, mysterious accidents, or unexplained falls.

In April 2022,Vladislav Avayev, vice president ofGazprombank, one of Russia's largest banks, was found dead in Moscow alongside his wife and daughter. Preliminary findings claimed Avaev shot them before turning the gun on himself.

Just days later, former Novatek gas producer executiveSergei Protosenya, his wife, and daughter were discovered dead at a villa in Spain.

Spanish mediareportedthat Protosenya allegedly killed his family and then hanged himself, though the case remains unresolved.

Stupak suggested that not all of the deaths are politically motivated — some may stem from internal business rivalries.

""Apart from business disputes, it could also be a case of unpaid debts, borrowed money, or even embezzlement,"" he said.

Among the most striking patterns is the recurrence of deaths caused by ""falling out of a window."" At least seven such incidents have been reported since 2022.

In September 2022,Ravil Maganov, chairman of Russia's second-largest oil firmLukoil, died after falling from a hospital window in Moscow.

While Lukoil's official obituary cited a ""serious illness,"" state media later reported he had allegedly committed suicide.

""Either you mysteriously die, or you end up behind bars.""

That same year, United Russia lawmakerPavel Antonovwas found dead at a hotel in India, lying in a pool of blood beneath his window.

Indian police said Antonov fell from the third floor, and local mediareportedthat he had been ""depressed"" over the recent death of a friend, who had died in the same hotel days earlier.

Most recently, on Feb. 6, Russian singer-songwriterVadim Stroykindied during a raid by Russian security forces.

Human rights group OVD-Info reported that Stroykin fell out of a 10th-floor window of hisSt. Petersburgapartment while officers were conducting a search linked to his alleged donation toUkraine's Armed Forces.

Russian media called the death a suicide. Stroykin had previously condemned Russia's invasion of Ukraine and criticized PresidentVladimir Putindirectly.

Physically throwing someone out of a window would require at least two people, making it a loud and risky operation. Yet sometimes, the intent may be precisely to send a message, Stupak added.

""Look at what happened with (Yevgeny)Prigozhin. He could've been poisoned somewhere inAfrica, and they could have easily blamed it on spoiled bananas. But they chose a demonstrative, public execution,"" he said.

Wagner Group founder Prigozhin and other Wagner leadersdied in a suspicious plane crashinside Russia in 2023. The crash came two months after Prigozhin led a brief rebellion against the Kremlin.

""So, this could be a warning to others, showing what happens if you don't pay your debts, refuse to hand over business shares, or go against Putin,"" he added.

In Russia's system, even high-ranking officials aren't safe from internal purges.

""Just recall the case ofTimur Ivanov, Russia's deputy defense minister,"" Stupak said. ""He's a Hero of Russia. Yet he was imprisoned, everything was confiscated, and his family was left with nothing.""

On July 1, Ivanov wassentencedto 13 years in a penal colony for bribery and embezzlement, the harshest punishment handed down in a recent wave ofcorruptioncases targeting senior defense officials.

""This shows just how ruthless the regime can be,"" he said. ""Either you mysteriously die, or you end up behind bars.""

Stupak believes the trend will only continue, driven by infighting and shrinking economic opportunity.

""There are noWestern companiesleft, and domestic business is stagnating. Not every business group can boast of keeping up its volumes,"" he said.

""Those who refuse to cooperate,"" he said, ""end up either in prison or out the window.""

Hi, this is Tim. Thank you for reading this article. The Kyiv Independent doesn't have a wealthy owner or a paywall. Instead, we rely on readers like you to keep our journalism funded.  If you liked this article, considerjoining our community today.

We’ve been working hard to bring you independent, locally-sourced news from Ukraine. Considersupporting the Kyiv Independent."
https://www.yahoo.com/news/us-teen-drivers-admit-looking-190026439.html,2025-07-04 20:30:00,US Teen Drivers Admit to Looking at Their Phones For 21% of Every Trip,"A survey of more than 1,000 American teen drivers has found they spend about 21 percent of each drive looking at their phones. This is despite the majority of states in the US banningall types of phone usagefor young drivers.

The research team, including scientists from Harvard University, began by interviewing 20 high school students with driver licenses about their attitudes, social norms, and perceived behavioral control on the road.

Students from suburban and rural areas in Northeast and Western states were specifically recruited, because these teenagers were more likely to drive than those in cities.

In this group, about 70 percent admitted to spending some time looking at their phone while driving. The most common reason for this dangerous distraction? Entertainment, accounting for 65 percent of mobile phone use behind the wheel, followed by texting (40 percent) and navigation (30 percent).

Related:A 'Silent Epidemic on Wheels' Is Killing Us, And We Need to Talk About It

These teenagers explained that phone use was often motivated by ""communication with family and friends"", ""being productive"", and ""being entertained while driving"". They were aware of the accident risk and reduced visibility, and felt that keeping their phone out of reach, using ahands-free device, andbeing well-restedimproved their behavioral control.

While participants acknowledged that the important people in their lives would not want them driving distracted, they believed their friends and family did it too, which suggests the behavior is widely normalized (and the importance of setting a good example, mom and dad).

Their responses allowed the researchers to put together a 38-question survey that they took to a further 1,126 high school-age drivers (18 years old on average) from suburban and rural areas around the US.

This was when they found that young drivers spent an average of 21.1 percent of their time on the road looking at a phone. Around 26.5 percent of these glances were estimated to last longer than two seconds, a duration that puts drivers at5.5 times greater risk of a crash.

""We found that while young drivers recognize the advantages of using smartphone features like GPS, they also understand the heightened risk of accidents associated with distracted driving,""sayslead author Rebecca Robbins, a behavioral scientist from Mass General Brigham.

""Encouraging the use of 'Do Not Disturb' mode, keeping phones out of reach, and ensuring teens get adequate sleep are effective strategies to mitigate this dangerous behavior.""

While the blanket ban on phone use while driving seems straightforward, it's obviously not a foolproof solution. Robbins and teambelievethat if we want to address the serious issue of distracted driving among young people, it is imperative to understand the ""predisposing, reinforcing, and enabling factors to this risky behavior.""

While the survey's results are not necessarily representative of the wider population in the US or around the world, this concerning snapshot points to some practical approaches to making our roads safer.

For instance, one of the strongest beliefs these teenagers held was that distracted driving could afford them the ability to ""be productive"". The team suggests campaignsdebunking this beliefcould be an effective approach.

""Distracted driving is a serious public health threat and particularly concerning among young drivers. Driving distracted doesn't just put the driver at risk of injury or death, it puts everyone else on the road in danger of an accident,"" Robbinssays.

This research was published inTraffic Injury Prevention.

Oldest Egyptian DNA Reveals Secrets of Elite Potter From Pyramid Era

Zapping Volunteers' Brains With Electricity Boosted Their Maths Skills

Ruins of Ancient Temple Belonged to Mysterious Pre-Inca Civilization"
https://www.yahoo.com/news/woman-72-dies-fatal-fourth-175020745.html,2025-07-04 20:30:00,"Woman, 72, dies in fatal Fourth of July crash in Middleborough","A 72-year-old woman was killed in afatal Fourth of July crash in Middleborough.

The crash happened Friday, July 4 at 8:27 a.m. in the area of 446 Wareham St. (Route 28), Middleborough police said.

Upon arrival, officers found a car that had left the road and crashed into a wooded area. The woman driving the car, identified as Susan Sumner, of Middleborough, was pronounced dead at the scene.

The crash prompted State troopersto closethe ramps from I-495 to Route 28 (Exit 8) just after 9 a.m., Massachusetts State Policepreviouslytold MassLive. The interstate wassaidto have been completely reopened as of 12:50 p.m.

The crash remains under investigation by the Middleborough Police Department alongside State Police detectives attached to the Plymouth County District Attorney’s Office and CRASH Investigative Team.

Police: Holyoke man arrested with drugs and cash

Fatal Fourth of July crash in Middleborough under investigation

Holyoke Firefighters investigate blaze in basement

Read the original article onMassLive."
https://www.yahoo.com/news/denver-police-investigating-crash-involving-163322561.html,2025-07-04 20:30:00,Denver police investigating crash involving bicycle,"DENVER (KDVR) — Police are on the scene of a crash involving a bicycle that occurred on Friday morning,according to a post on X from the Denver Police Department.

DPD said the crash involved a bicycle and a motorist and that one person sustained serious injuries.

The incident occurred at the intersection of West 17th Avenue and King Street.

The driver remained on the scene of the crash. Delays are expected while investigators are in the area.

Copyright 2025 Nexstar Media, Inc. All rights reserved. This material may not be published, broadcast, rewritten, or redistributed.

For the latest news, weather, sports, and streaming video, head to FOX31 Denver."
https://www.yahoo.com/news/man-seriously-hurt-concrete-truck-200017487.html,2025-07-04 21:15:00,Man seriously hurt after concrete truck rolls,"A man was seriously hurt after the concrete truck he was driving rolled over.

[DOWNLOAD:Free WHIO-TV News app for alerts as news breaks]

On July 3, around noon, first responders were called to a crash on State Route 117 near Township Road 100.

A concrete truck had rolled, trapping the driver inside, according to the Huntsville Volunteer Fire Department.

TRENDING STORIES:

Ohio man accused of threatening to ‘unalive’ politicians over bill he was ‘unhappy’ about

Driver dead after truck hits Kettering home

Local man dies after drowning in Virginia hotel pool

Firefighters were able to free the driver and said he had abnormal breathing.

Medlflight was called to the crash and flew the driver to Ohio State University Hospital.

Information about the driver’s current condition was not available.

We will continue to follow this story.

[SIGN UP:WHIO-TV Daily Headlines Newsletter]"
https://www.yahoo.com/news/georgia-state-employee-charged-dui-202725590.html,2025-07-04 22:15:00,"Georgia state employee charged with DUI after crash in state vehicle, GSP says multiple vehicles hit","An employee of the Georgia Department of Community Supervision, a criminal justice agency of the state, was charged with driving under the influence in a state vehicle and causing a crash.

According to the Georgia State Patrol, was called to investigate in the aftermath of an incident involving multiple crashes on Interstate 20 in Douglasville.

[DOWNLOAD:Free WSB-TV News app for alerts as news breaks]

GSP said the Douglasville Police Department were investigating a single vehicle crash involving a white Honda Accord that hit a guardrail shortly before midnight on Thursday.

While they investigated, a black Ford Explorer belonging to the Department of Community Supervision struck an orange Toyota Corolla that was driving in the left lane in the same area, causing the Explorer and Corolla to spin.

TRENDING STORIES:

Thieves break into Marietta restaurant months away from opening, cause $100K in damage

Several children injured in crash at Dunwoody 4th of July parade

Whippet danger: Family warns nitrous oxide use can be deadly

This caused the Explorer to then hit the back of a Mitsubishi Outlander that was in the center lane of the highway at the time.

Then the still-spinning Explorer hit a Lexus that was parked in the left shoulder before coming to a stop.

I-20 East was closed for several hours for officials to perform an investigation and clean up.

When GSP got to the crash site, troopers learned that the driver of the explorer, Alexis Friendly, a community supervision officer, was driving under the influence.

Friendly was arrested at the scene by troopers out of Post 4 in Villa Rica before being taken to a hospital for treatment of minor injuries.

The driver of the Corolla hit by Friendly in the Explorer was taken first to Douglas Wellstar before being flown to Kennestone Hospital due to serious injuries.

In a statement toChannel 2 Action News, the Georgia Department of Community Supervision said they were aware of Friendly’s arrest and accusations that she was driving under the influence and they are performing an investigation as well.

Friendly was immediately suspended, according to the department. They are unable to provide additional comment as the investigation is active.

Jail records show Friendly remains in custody without bond, charged with the following:

Driving with ability impaired by alcohol, drugs or toxic vapor

Following too closely

License to be carried and exhibited on demand

Failure to maintain lane

Serious injury by vehicle

Safety belts, required usage

Speed restrictions basic rules

[SIGN UP:WSB-TV Daily Headlines Newsletter]"
