URL,Date,News_title,News_text
https://www.yahoo.com/news/mysterious-object-headed-solar-system-134503988.html,2025-07-05 15:30:00,Mysterious Object Headed Into Our Solar System Is Coming From the Center of the Galaxy,"Folks, it's official: the object that astronomersrecently spottedblowing through the outer solar system came from interstellar space.

Yesterday, the intriguing stranger was named A11pl3Z. Now, it's earned the esteemed designation 3I/ATLAS — that ""I"" standing for ""interstellar.""

3I/ATLAS is currently located between the orbits of the asteroid belt and Jupiter, theNew York Timesreports, where it's about 416 million miles away from the Sun, NASAsaid. That's equal to four and a half times the distance between the Earth and our star.

But it's approaching fast. As we speak, 3I/ATLAS is hurtling toward the inner solar system at a speed of about 130,000 miles per hour — a ""thousand times over the speed limit on a highway,"" Harvard's Avi Loebquipped.

""This thing is traveling pretty fast,"" Paul Chodas, director of the Center for Near Earth Object Studies at NASA's Jet Propulsion Laboratory in California, told theNYT.

""If you trace its orbit backward, it seems to be coming from the center of the galaxy, more or less,"" Chodas added. ""It definitely came from another solar system. We don't know which one.""

3I/ATLAS is only the third confirmed interstellar object to reach our Sun's domain — hence the ""3."" The first was 'Oumuamua, spotted in 2017, which became famed for its unusually elongated shape. The second, dubbed Borisov, was a comet thatspectacularly began to break apart.

Provisionally, this latest visitoralso appears to be a comet, making it the second known ""rogue"" comet in history.

Its discovery and confirmation as an extrasolar visitor were a collaborative effort.What initially appearedto be an asteroid was first flagged Tuesday by a telescope in Chile that's part of the Asteroid Terrestrial-impact Last Alert System (ATLAS).The International Astronomical Union's Minor Planet Center quickly added the intriguing object to its list of confirmed near-Earth objects. So did NASA and its Jet Propulsion Laboratory.

Soon, more than 100 observations from telescopes across the globe poured in, including ""tentative reports of cometary activity,"" the Minor Planet Center said Wednesday, providing enough data to designate it 3I/ATLAS.

""There's no uncertainty"" about its interstellar origins, Chodas told theNYT, because it's moving too fast to come from our own solar system.

We can only speculate how it got here. Per theNYT, it probably formed as a comet around another star, before a gravitational interaction, perhaps apassing star, booted it out of itshome system.

How large 3I/ATLAS is is also a matter of some debate. If it were a rocky asteroid, the interstellar interloper would have to be about 12 miles wide to reflect the levels of light we're seeing, according to theNYT,which is what astronomers initially estimated.

But since it's a comet, it's much harder to say. Comets owe their luminous appearance to a halo of gas and dust known as a coma, which is released when the object is heated up by sunlight. These comas appear much larger than the solid object at their center, and their tails even more so; Borisov's was nearly 100,000 miles long, astronomersestimated, or about 14 times the size of the Earth.

""You can't infer the size of the solid object from the brightness of the coma,"" Chodas told theNYT. ""So it's too early to say how big this object is.""

The good news is that there will be plenty of time to study 3I/ATLAS, which hasn't always been the case in our limited encounters with interstellar visitors; 'Oumuaua, for instance, vanished after just a few weeks.

""It'll be easily observable for astronomers around the world,"" Chodas told theNYT. ""It should be visible well into next year to large telescopes.""

3I/ATLAS is expected to reach its closest approach to the Sun around October 30, NASA said, at a distance of about 130 million miles, putting it inside the orbit of Mars.

More on:Scientists Investigate What Happens If You Snort Moon Dust"
https://www.yahoo.com/news/send-them-home-promote-tougher-035900361.html,2025-07-05 16:00:00,"'Send them home': To promote tougher policies, report claims Spokane's homeless aren't from here","Jul. 4—Half of the homeless people in Spokane aren't from here and should be given bus tickets home, more strictly enforced by police and cut off from long-term services, according to a recent report released by the Spokane Business Association, a prominent political advocacy group funded by businessman Larry Stone.

A week after the report's release, the association proposed an amendment to the city's charter, which if approved by voters would reshape the city's homelessness laws and force Spokane to shift funding away from affordable housing, firefighting equipment and other priorities to fund emergency shelters, more visible police patrols and other policies recommended in the report.

Critics in City Hall have dismissed the report as unscientific, unhelpful and politically motivated ahead of the November elections, when several seats currently or recently occupied by progressives are being challenged by candidates more in line with the Spokane Business Association's policy goals.

But the report's author and the organization sponsoring the survey argue the data is concrete proof that Spokane's homelessness policies aren't only not helping people get off the streets, they're attracting people from elsewhere who are drawn to the city by lax law enforcement.

Just over 50% of the roughly 230 homeless people surveyed for the association said they moved to the city after becoming homeless.

This contradicts the federally mandated ""point-in-time"" counts, annual standardized surveys that try to reach every homeless person living on the streets or in a shelter. The point-in-time counts have their own flaws, as the authors of Spokane County's 2024 report readily acknowledged. But of the 2,021 people surveyed in last year's point-in-time count, roughly 80% said they lived in Spokane County before becoming homeless.

Robert Marbut, President Donald Trump's ""homeless czar"" from 2019 to 2021 and the consultant contracted to conduct the survey, argues his data is more accurate because he also asked where people were born, went to high school and whether they have family in Spokane.

It is not clear why these additional questions would sway the data by 30 points, but Marbut's recommendations for dealing with this influx are clearer, and consistent with the ""Velvet Hammer"" approach he has pitched cities across the country for at least a decade: Spokane has to get tougher with the homeless, pressuring them into treatment or departure.

Gavin Coley, an executive of the Spokane Business Association, argued Marbut's expertise lent the report more authority than it lost from a lack of cited sources, and dismissed as ""deeply political"" a recent article from Range Media that turned to an expert in homeless research to pick apart the report's methodology and conclusions.

Cooley believes the media and politicians are overly focused on attacking the data and not paying enough attention to the conclusions Marbut reaches with that data.

""You can certainly note the deficiencies as you see them ... but I think it'd be a pity to miss the higher level order of what's being recommended,"" Cooley said.

Every effort should be made to send people back where they came from, particularly if they've been in Spokane for less than 90 days, according to the report. Those who stay should be cut off from long-term services, which should be reserved only for those with longstanding ties to Spokane. For those who are from Spokane, the report recommends mandatory treatment services in order to receive housing, which city officials claim would violate state and federal law.

Marbut has spoken out for at least a decade against policies he believes are ""enabling"" the homeless with ""goodies,"" including Housing First policies that have been the national standard since 2013, in which homeless people are given stable housing upfront to enable them to then address addiction, mental health and social reintegration.

Attempts to relocate the homeless en masse are even older. The phrase ""Greyhound therapy"" has been used to describe the practice since the 1970s and has been criticized by researchers for just as long for redistributing the social costs of homelessness rather than improving them. Many of America's largest cities have, at one point or another, attempted similar policies; between 2011 and 2017, the Guardian tracked over 20,000 homeless people given bus tickets out of and sometimes between 16 U.S. cities.

Proponents, including the Spokane Business Association, argue that such programs reconnect people to families and friends and can lead to a long-term improvement in their situation.

Spokane's homeless service providers have engaged in the practice for years, however.

If a homeless person requests a bus ticket, and a friend or family member declares they can take them in, they will be provided a ticket. Julie Garcia, who runs the homeless services organization Jewels Helping Hands, which manages several of the city's homeless shelters, estimated her organization hands out around 250 tickets a year.

There appears to be little academic research into whether these programs lead to long-term reductions of homelessness or just move it elsewhere. The Guardian reported that, of the thousands being bused from San Francisco through the Homeward Bound program between 2010 and 2015, the city had records of following up with only three people after they reached their destinations.

But the Spokane Business Association report goes further to suggest that the city should cut off people who decline these tickets from long-term homeless services and even emergency shelters after 21 days.

While much of the study copies nearly verbatim a similar report on King County that Marbut was commissioned to write for the Discovery Institute, Marbut claims that Spokane is unusual in one regard: Homeless people aren't coming to Spokane for its quality services, but for its lax enforcement.

""What we got on the street was generally, they treat me nice here, they don't hassle me,"" Marbut said.

""It wasn't that they came here because of the services — many communities I go to, it's, 'Oh, they have great services' — but here it was, 'They sort of let me be.' ""

This picture notably doesn't match what many homeless people on Spokane's streets have told The Spokesman-Review in recent years, who described being pushed from place to place throughout the day by law enforcement, security guards and business owners.

""We literally don't get to sit down like this,"" said Amber, a 32-year-old homeless woman interviewed under an overpass in August. ""We are moving constantly. ... So many people have cracked feet and heels.""

Cooley dismissed this type of enforcement as an ""occasional blow of the horn,"" and wants to see tougher laws and stricter enforcement — not because he wants them to go to jail, which he says would be ineffective and expensive — but to force people to change their lives.

Cooley acknowledged that Washington's involuntary treatment laws are not extensive enough to force a homeless person into drug or mental health treatment.

Instead, he argued, the city should use its tougher homelessness laws to offer them a choice: either go to jail, or enter ""voluntary"" treatment.

Or they could leave, Cooley noted.

""If you find that a great number of people have no connection to Spokane at all, and you suddenly begin to say you cannot use fentanyl in this community unfettered ... how many of those folks will stick around?"" Cooley asked.

In an interview, Mayor Lisa Brown dismissed the report as misinformed, arguing many of the report's claims about the city's policies were untrue and some of its recommendations were already standard practice.

""I believe this is really about the political campaigns in November,"" Brown said, noting Stone's longstanding funding of candidates opposing progressive policies and production of high-dollar videos to encourage tougher homelessness policies.

""I also believe that, with the resources they are apparently able to mobilize, it would be great if, as a show of good faith, they put them into an actual solution, rather than a propaganda campaign against the city and the majority on the city council,"" Brown added.

But Cooley believes the evidence was clear, regardless of the survey's findings, that what the city is doing is failing to have a significant impact on the city's visible homeless population or its soaring overdose deaths.

""I know Seattle really damn well, and I can't believe the rapid turnaround as it relates to enforcement,"" Cooley said. ""And what I don't know is where those people are ... but I know they've made a visible turn in on-street homelessness.""

The report has started to leak into the broader public conversation on Spokane's homelessness policies. Wendy Fishburne, vice president of the East Spokane Business Association, appeared to quote parts of it verbatim Monday before the Spokane City Council voted to reform its homelessness laws.

""Research shows that people do better recovering from addiction when they're surrounded by their families of origin,"" Fishburne said. ""Find out where people actually come from and compassionately send them home ... so that our resources could be used for our folks."""
https://www.yahoo.com/news/archaeologists-found-two-epic-treasures-143000269.html,2025-07-05 16:00:00,Archaeologists Found Two Epic Treasures Under the Floors of George Washington’s Mansion,"Here’s what you’ll learn when you read this story:

A renovation project at George Washington’s Mount Vernon mansion uncovered two sealed glass bottles full of cherries.

The cherries, complete with stems and pits, still had their signature scent.

The two bottles come characteristic of styles from the 1750s and were placed in a forgotten pit.

When archaeologists poured the liquid out of two European-manufactured bottles found under a brick floor atGeorge Washington’sMount Vernon mansion, they enjoyed the scent of cherry blossoms. The once-forgotten and now-found bottles were likely filled with cherries before the Revolutionary War in the mid-1770s and have sat sealed—and preserved—ever since.

As part of a privately funded revitalization project at the Virginia mansion, a brick floor originally laid in the 1770s was torn up, revealing a small pit and the two side-by-side dark green glass bottles, both upright and sealed.

Get the Issue

Get the Issue

Get the Issue

Get the Issue

Get the Issue

Get the Issue

Get the Issue

Get the Issue

Get the Issue

“Not only did we recover intact, sealed bottles, but they contained organic material that can provide us with valuable insight and perspective into 18th-century lives at Mount Vernon,” Jason Boroughs, Mount Vernon principal archaeologist, says in astatement. “These bottles have the potential to enrich the historic narrative, and we’re excited to have the contents analyzed so we can share this discovery with fellow researchers and the visiting public.”

Once the bottles were discovered, each was moved to the Mount Vernon archaeology lab. Experts determined removing the liquid content could help stabilize the glass that hadn’t been directly exposed to the atmosphere for approximately two centuries. Full cherries, including stems and pits, were part of the liquid content, giving off the signature scent of the region, a “blockbuster find of two fully intact glass bottles containing liquid that have not been seen since before the war for American independence,” Doug Bradburn, Mount Vernon president and CEO, says in a statement.

The glass bottles are from a European manufacturer and archaeologists say, based on shape and style, likely from the 1740s or 1750s, which fits the timeline of needing to be placed in the pit prior to the 1770s floor installation. That makes the cherries likely pre-Revolutionary War fruit.

While the Washingtons were known fans of cherries, the picking and storage of the two bottles likely never touched their hands as the sitewas known to haveover 300 enslaved individuals at the time of George Washington’s death.

The archaeological team plans to ship the bottles off for conservation efforts and the contents will be sent to a laboratory for scientific analysis and testing.

BoroughstellstheWashington Postthat the bottles likely held only cherries when they were originally placed in their location and that amber-colored liquid could be groundwater that got in the bottles once the corks sealing the bottles started to fail as the decades wore on. Despite the liquid and a sort of goo being inside the bottles, early analyses support the only cherry theory, likely stored away to help preserve the fruit for later use in cooking or baking.

“There are 18thcentury accounts that talk about proper ways of preserving fruits and vegetables,” Boroughs tells the newspaper. “One of the most common, especially for berries, is to dry them as much as possible … put them in a dry bottle, cork it … and then bury them.”

That advice may still hold true today, as the cherries held their shape and scent 250 years later.

Get the Guide

Get the Guide

Get the Guide

Get the Guide

Get the Guide

Get the Guide

Get the Guide

You Might Also Like

The Do’s and Don’ts of Using Painter’s Tape

The Best Portable BBQ Grills for Cooking Anywhere

Can a Smart Watch Prolong Your Life?"
https://www.yahoo.com/news/trump-big-bill-billions-added-211600368.html,2025-07-05 22:00:00,"Trump’s big bill has billions added for Artemis, KSC and moving a space shuttle","ORLANDO, Fla. — When President Donald Trump floated his budget for NASA for 2026, it slashed the science budget by half, proposed the end of the Artemis program’s Space Launch System rocket, Orion spacecraft and Gateway lunar station, and cut back support of the International Space Station.

While Congress will ultimately decide which programs get funded in the federal government’s budget, that may not happen for months. Instead of waiting, Sen. Ted Cruz, R-Texas, took aim at Trump’s tax and spending bill, which the president has been calling the “big, beautiful bill.”

Cruz spearheaded an amendment to shoehorn more than $10 billion into the legislation, also known as a reconciliation bill, to save some ofthose NASA targets. It also sets aside money to move retired Space Shuttle Discovery from its current home at the Smithsonian outside of Washington to Texas.

The bill was approved by both the Senate and House this week andsigned by Trump on July 4. The added funding falls outside of NASA’s annual budget, and would be available for use over the next seven years.

Cruz is the chair of the Senate Commerce, Science, and Transportation Committee, and initially proposed the amendment “ensuring the U.S. — not China — gets to Mars and gets back to the moon first.”

It ensures funding to a program that has endured heavy criticism because of years of delays and a ballooning price tag that has cost the nation nearly $100 billion, but has so far only managed one launch.

That funding includes $4.1 billion for the SLS rockets needed for the Artemis IV and V missions. That is a big win for prime contractor Boeing, which makes the rocket core stages as well as Melbourne-based L3Harris, which produces the core stages’four RS-25 engines.It’s also good news for Northrop Grumman, which makes the SLS’ twosolid rocket boosters, that when combined with the core stage produce 8.8 million pounds of thrust on liftoff.

The lone flight of SLS on Artemis I in 2022 remains the most powerful rocket to ever reach orbit. Artemis II, which will feature the first crewed flight of Orion, is slated for no later than April 2026 on a mission to fly around, but not land on the moon. Artemis III is still on the calendar for summer 2027, which looks to return humans to the lunar surface for the first time since the end of the Apollo program in 1972.

Trump’s proposed budget still looks to kill off the use of both SLS and the Orion spacecraft after Artemis III, and instead continue its moon and Mars missions using commercial rockets such as SpaceX’s Starship and Blue Origin’s New Glenn. It also looks to kill the Gateway lunar space station, parts of which were supposed to be launch on Artemis IV.

Cruz’s supplemental funding proposal instead adds $2.6 billion to fully fund Gateway.

By saving Artemis IV and V with the SLS, that also means the newmobile launcher 2 currently under constructionat Kennedy Space Center may actually get used. It’s designed for the larger versions of SLS on those two missions, which will use a more powerful upper stage designed by the European Space Agency. Those missions are still on NASA’s road map for 2028 and 2029.

By keeping them, it would also save jobs at KSC. Trump’s proposed budget also seeks to shutter the KSC-based Exploration Ground Systems program, which employs about 500 civil servants and 3,000 contractors. Among all Artemis programs, KSC employs about 700 civil servants and 3,850 contractors, according to NASA.

On a smaller scale, the proposal also sets aside $20 million toward Lockheed Martin’s Orion capsule for Artemis IV.

One late addition to the amendment that managed to get through was $85 million set aside to move Space Shuttle Discovery from its current home at the Smithsonian’s Udvar-Hazy Center in Virginia to Space Center Houston in Texas.

Other major funding adds include $700 million for a Mars Telecommunications Orbiter, which would support the beleaguered Mars Sample Return mission; $1.25 billion to support International Space Station operations over five years until its planned decommissioning in 2030; and $325 million to fund the deorbit vehicle, which is being designed by SpaceX, needed to bring the station back to burn up safely in Earth’s atmosphere.

It also features $885 million to upgrade NASA facilities including $250 million for Kennedy Space Center to support “construction, revitalization, recapitalization, or other infrastructure projects and improvements” to be allocated no later than fiscal year 2026.

“The One Big Beautiful Bill supports the Artemis Program and invests in NASA centers to keep the U.S. leading in space,” posted Rep. Mike Haridopolos, R-Fla., on X. The Space Coast congressman is chairman of the House Space Subcommittee and welcomed the Senate additions to the reconciliation bill. “We’re going back to the moon, on to Mars, and beyond!”

Funding for fiscal 2026, which begins in October this year, won’t be determined until Congress passes that budget bill. But when that will happen is uncertain. The federal government this year is actually running under a continuing resolution that maintained levels from the 2024 budget, meaning NASA’s take has been about $25 billion

It’s possible funding for fiscal year 2026 will continue under similar resolutions until a full budget is agreed upon.

Trump’s proposal still looks to slash NASA’s budget to $18.8 billion. The biggest loser is more than $3.4 billion cut from science, including $1.15 billion from Earth science, $1 billion from astrophysics, more than $800 million from planetary science and $370 million from heliophysics. It also slashes space technology and zeros out STEM education.

Nonprofit group The Planetary Society said the overall budget would be the smallest for NASA since 1961, and called it an “extinction-level event” for NASA’s science efforts, killing 41 science projects, or one-third of NASA’s science portfolio.

That includes 19 existing missions “that are currently active, healthy, and producing invaluable science,” according to a statement from the Planetary Society. Among them are New Horizons that visited Pluto and is now in the Kuiper Belt; Juno, the only mission near Jupiter; and the Chandra X-ray Observatory. It would also end the UCF-ledGOLD atmospheric science missionthat launched in 2018.

“These represent a cumulative investment of over $12 billion and years of work to design and build. These are irreplaceable assets,” the statement reads."
