URL,Date,News_title,News_text
https://finance.yahoo.com/news/chugai-gero-antibody-drugs-age-143251422.html,2025-07-08 15:00:00,Yahoo Finance,"Chugai Pharmaceutical has signed a joint research and licensing agreement with Singapore-based biotechnology firm Gero to create new antibody drug candidates for age-related conditions.

Their collaboration will utilise Chugai's antibody engineering technologies to develop new treatments for targets identified by Gero's AI platform, which analyses human datasets.

Chugai gains exclusive global rights to research, develop, manufacture and commercialise antibodies for these targets.

Gero CEO Peter Fedichev stated: “Our AI platform is built to identify therapeutic targets that drive multiple age-related diseases and potentially ageing itself.

“In this collaboration, we aim to translate those insights into therapeutics that can help restore the lost function. This partnership with Chugai is an important step toward achieving Gero’s mission: to meaningfully target the biological processes of human ageing.”

The financial terms include an initial payment from Chugai to Gero, with the potential for additional payments totalling up to $250m, contingent on achieving specific development or sales milestones.

If Chugai successfully brings a product to market, it will also pay Gero royalties on sales.

Chugai president and CEO Dr Osamu Okuda stated: “We believe that open innovation with external partners, including leading global players, is extremely important for achieving global first-class drug discovery outlined in our growth strategy toward 2030, TOP I 2030.

“By combining Gero’s target discovery technology with Chugai’s drug discovery technologies, we will accelerate the creation of innovation.”

Gero was represented by Ropes & Gray, with a team led by life sciences licensing partner Hannah England and associate Ian Nilsen, along with IP transactions counsel Ryan Murphey and life sciences licensing associates Mallory Ursul and Ben Ellington.

In January 2025, Chugai and Araris Biotechformed a research collaborationand option-to-license agreement focused on antibody-drug conjugates, valued at up to $780m.

""Chugai and Gero link on antibody drugs for age-related conditions"" was originally created and published byPharmaceutical Technology, a GlobalData owned brand.

The information on this site has been included in good faith for general informational purposes only. It is not intended to amount to advice on which you should rely, and we give no representation, warranty or guarantee, whether express or implied as to its accuracy or completeness. You must obtain professional or specialist advice before taking, or refraining from, any action on the basis of the content on our site."
https://www.yahoo.com/news/astronomers-discover-fossil-galaxy-3-150640206.html,2025-07-08 16:45:00,Astronomers discover ‘fossil galaxy’ 3 billion light-years away,"A galaxy that has remained unchanged for 7 billion years — a rarity in the universe — has been observed by astronomers, offering a glimpse into cosmic history and adding to an enigmatic collection of objects called relics or “fossil galaxies.”

These space oddities are galaxies that, after an initial phase of intense star formation, escape their expected evolutionary path. While other galaxies expand and merge with one another, the fossil galaxies remain virtually inactive. Like celestial time capsules, they provide a snapshot into the ancient universe and allow astronomers to examine the mechanism of galaxy formation.

The newly discovered fossil galaxy — named KiDS J0842+0059 — is about3 billion light-yearsfrom Earth, making it both the most distant and the first of its kind observed outside the local universe, the region of space closest to Earth that is approximately 1 billion light-years in radius. It was found by a team of astronomers led by the Italian National Institute for Astrophysics (INAF), using high-resolution imaging from the Large Binocular Telescope in Arizona.

“Relic galaxies, just by chance, did not merge with any other galaxy, remaining more or less intact through time,” said Crescenzo Tortora, a researcher at INAF and first author of a study on the findingpublishedMay 31 in the journal Monthly Notices of the Royal Astronomical Society. “These objects are very rare because, as time goes on, the probability to merge with another galaxy naturally increases.”

Astronomers believe that the most massive galaxies form in two phases, according to study coauthor Chiara Spiniello, a researcher at the University of Oxford in the UK.

“First, there’s an early burst of star formation, a very quick and violent activity,” she said. “We end up having something very compact and small, the progenitor of this relic.”

The second phase, she added, is a protracted process during which galaxies that are in close proximity start interacting, merging and eating each other, causing a very dramatic change in their shapes, sizes and star populations. “We define a relic as an object that missed almost completely this second phase, having formed at least 75% of its mass in the first phase,” Spiniello explained.

The telltale feature of fossil galaxies is that they are very old, compact and dense, much more so than our own galaxy.

“They contain (billions) of stars as massive as the sun and they are not forming any new stars — they’re doing essentially nothing, and they are the fossil records of the very ancient universe,” she said. “They formed when the universe was really, really young. And then, for some reasons that we honestly don’t understand yet, they did not interact. They didn’t merge with other systems. They evolved undisturbed, and they remained as they were.”

Fossil galaxies are crucial because they are a direct link to the massive galaxy population that existed billions of years ago, said Michele Cappellari, a professor of astrophysics at the University of Oxford who was not involved with the study. “As ‘living fossils,’ they have avoided the chaotic mergers and growth that most other massive galaxies have experienced. Studying them allows us to reconstruct the conditions of the universe in its infancy and understand the initial bursts of star formation,” he said.

What caused these galaxies to stop forming stars so abruptly is a major question, he added. “Evidence from both local and (distant) observations suggests that feedback from supermassive black holes may be responsible,” Cappellari said. “These black holes can produce powerful winds that expel or heat the gas in a galaxy, preventing further star formation. However, this remains an active area of research.”

Scientists initially identified KiDS J0842+0059 in 2018 using theVLT Survey Telescope(VST) at the Paranal Observatory in Chile. That observation revealed that the galaxy was populated by very old stars but only provided an estimate of its mass and size, so a more detailed observation was required to confirm it was a relic. The Large Binocular Telescope used for this confirmation can render very sharp images due to its ability to compensate for atmospheric turbulence, which otherwise can make it difficult for Earth-based telescopes to focus on distant objects.

The newly found fossil galaxy joins a group of only a handful of others that have been observed at the same level of detail, the most pristine of which — called NGC 1277 — wasconfirmedby the Hubble Space Telescope in 2018.

NGC 1277 and KiDS J0842+0059 are very similar, but the latter is much farther away from Earth. It fits the definition of fossil galaxy almost perfectly, according to Spiniello.

“This is what we call an extreme relic,” she said, “because almost all, or 99.5% of its stars were formed incredibly early on in cosmic time, and the galaxy did absolutely nothing thereafter.”

The fossil galaxy has stars and planets, just like our own galaxy, but it is much more dense, Spiniello added. “There will be many more stars in a tiny, tiny volume, so it’ll be super crowded,” she said. “And it will be much harder to find solar systems like ours, with many planets orbiting around it, just because of the chances of getting companion stars interfering nearby.”

KiDS J0842+0059 looks to observers like it did 3 billion years ago, because that’s how long it takes for the light coming from the galaxy to reach Earth. Spiniello hypothesized that the relic will likely remain as it is forever, but scientists can’t be certain since they still don’t know what keeps it from interacting with other galaxies.

“There must be something that prevents them from merging, but without knowing what, we cannot really predict what’s going to happen in the future,” Spiniello said.

It is very hard to identify fossil galaxies and confirm their nature, partly because they’re relatively rare and small compared with regular galaxies such as the Milky Way, according to Sébastien Comerón, an extragalactic astronomer at the Universidad de La Laguna and the Instituto de Astrofísica de Canarias in Spain. The confirmation of a distant relic galaxy is a credit to the search strategies used to identify these objects and of modern instruments, he said.

“Relic galaxies are mysterious,” added Comerón, who was not involved with the study, in an email. “The fact that a few galaxies are nowadays untouched relics of the first large galaxies needs an explanation.”

Astronomers can’t say for certain how rare relics are, but Spiniello estimates there might be “one in millions” among all the galaxies in the universe. TheINSPIREproject — which aims to find and catalogue fossil galaxies and spawned the discovery of KiDS J0842+0059 — has already identified several dozen other candidates that are in the pipeline for further scrutiny, Spiniello said.

New instruments could make this search even more effective. Both Spiniello and Tortora are excited about Euclid, a European Space Agency telescope launched in 2023 with the goal ofexploring dark matterand dark energy that will also be useful for observing fossil galaxies.

“Euclid will be transformational,” Spiniello said, “because rather than observing one single object at a time, its wide sky survey configuration will cover a lot more. The idea is to find all the galaxies in a patch of sky, and then isolate all the ones that are ultra compact. And if you do that, then you can actually estimate how rare (fossil galaxies) are.”

Confirming relic galaxy KiDS J0842+0059 at such a distance is a remarkable achievement, and the future of this field is very promising, Cappellari said in an email. “With powerful new telescopes like James Webb and Euclid (which produced its first images just a few months ago), and on the ground with advanced adaptive optics, we can expect to find and study more of these relics at even greater distances.”

For more CNN news and newsletters create an account atCNN.com"
https://www.yahoo.com/news/boyfriend-slain-morgan-hill-teen-161230302.html,2025-07-08 18:30:00,Slain Morgan Hill teen Marissa DiNapoli was stabbed in back: police,"SAN JOSE, Calif. (KRON) — Marissa DiNapoli’s accused killer hid behind his defense attorney Tuesday afternoon at the Hall of Justice in San Jose. Martin Mendoza is charged with murdering 18-year-old DiNapoli in Morgan Hill. As he declined to enter a plea, Mendoza stood in a courtroom doorway just out of view from a large group of DiNapoli’s family and friends, who were sitting in the gallery.

Investigators believe that the murder weapon was a knife, Morgan Hill Police Department Detective Kyle Tolentino wrote in a police report. “Marissa was found with five stab wounds to her back” near Anderson Lake, Tolentino wrote.

“It was a lethal and brutal attack. She was then just left there,” District Attorney Jeff Rosen said.

The victim’s friends described Mendoza, 20, as a possessive and violent boyfriend. One friend, Vienna Chambers, said DiNapoli was in love with Mendoza, and she warned DiNapoli to stay away from him. Leading up to her death, the teenager was in the process of breaking up with her boyfriend, Chambers told reporters outside the courthouse.

“If she was in the car with him, and he wanted to see her phone, he would try to break a window. Two years ago I told her, ‘he’s going to kill you.’ (For) two years I tried to tell her, ‘he’s going to kill you.’ I told her father that she was still seeing him,” Chambers said.

DiNapoli was first reported to police as missing on June 30, when DiNapoli’s father and sister went to the police station. On June 28, DiNapoli texted her father telling him that she was staying at a friend’s house and she would return home on June 29 at 8 p.m., Tolentino wrote.

The detective wrote, “Marissa never returned home, and was not responding to any text messages or phone calls from family members” on June 30. DiNapoli worked as a barista at a Starbucks coffee shop, but she never showed up for her shift, the police report states.

Mendoza was with DiNapoli when she was last seen alive on June 29, police said. That morning, home surveillance camera recorded them together at Mendoza’s residence on Trail Drive in Morgan Hill.

In the surveillance video, DiNapoli and Mendoza both appear to be upset. “Marissa and Martin were seen on internal surveillance video. Marissa and Martin were walking down the stairs together while Martin was confronting her about contacting her ex-boyfriend. Marissa’s facial expression was visibly apprehensive,” Tolentino wrote.

After the teenager disappeared, Mendoza refused to cooperate with police, MHPD said. He also refused to talk to her family when they demanded to know where she was, the police report states.

To raise awareness that DiNapoli was missing, her sisterposted a copy of the surveillance videoon Instagram.

Following a missing person search,her remains were discovered at Anderson Lake County Parkin the Woodchoppers Flat Picnic Area on July 2. The lifeless teenager was still wearing the same clothing that she was wearing in the June 29 surveillance video, according to the police report. Detective Tolentino also recognized DiNapoli’s black necklace with a cross.

“Witness interviews and forensic evidence support our conclusion that Martin Mendoza Jr. stabbed and killed Marissa DiNapoli,” Tolentino wrote.

Last week, FBI agents, officers with the U.S. Department of Homeland Security, and U.S. border control agents teamed up with Morgan Hill police to find DiNapoli’s killer.

On July 1, Mendoza had his cellphone with him as he drove his car across the U.S.-Mexico border, according to prosecutors. Traffic cameras recorded his car traveling into Mexico at the San Ysidro border crossing, the police report states.

Mendoza later re-entered the U.S. by walking on foot, without his car and cellphone, Rosen told reporters. He was captured and arrested Sunday by United States Marshals in El Centro, California.

Within the past 48 hours, Mendoza transported from a jail near the border to San Jose to face charges. A Santa Clara County judge ordered the defendant to remain in custody without bail. He is scheduled to return to court for an arraignment on September 9.

DiNapoli’s friends described Mendoza’s courtroom behavior as cowardly. “I saw his face and he hid behind the doorway, and hid behind his lawyer. I think he’s scared because we have so much on him to pin him,” Chambers told reporters.

DiNapoli’s sister held up a poster with the message “Long Live Marissa. Forever 18.”

If Mendoza is found guilty of first-degree murder, he could face 26 years to life in prison, District Attorney Rosen said.

Copyright 2025 Nexstar Media, Inc. All rights reserved. This material may not be published, broadcast, rewritten, or redistributed.

For the latest news, weather, sports, and streaming video, head to KRON4."
https://www.yahoo.com/news/el-salvador-detained-migrants-responsibility-154648516.html,2025-07-08 18:45:00,El Salvador: Detained migrants are responsibility of US,"The government of El Salvador has formally asserted it is the U.S., not the Central American nation, that retains “legal responsibility” for Venezuelans held in a Salvadoran megaprison, contracting Trump administration claims.

The disclosure was made to the United Nations Office of the High Commissioner for Human Rights and submitted in court filings by those challenging President Trump’s use of the Alien Enemies Act to send some 200 Venezuelan men to be held in the country’s most notorious prison.

“The jurisdiction and legal responsibility for these persons lie exclusively with the competent foreign authorities, by virtue of international agreements signed and in accordance with the principles of sovereignty and international cooperation in criminal matters,” El Salvador said, referring to the U.S.

The comments are at odds with statements given by White House and Department of Justice officials, who have claimed they cannot seek the return of the men, as they are now in the custody of the Salvadoran government.

“El Salvador has confirmed what we and everyone else understood: it is the United States that controls what happens to the Venezuelans languishing at CECOT. Remarkably the U.S. government didn’t provide this information to us or the court,” American Civil Liberties Union (ACLU) lawyer Lee Gelernt, who is representing some of the men, said in an email.

The filing from the ACLU seeks to order additional discovery in the case and argues the Trump administration violated its obligation to share information about its arrangement with El Savlador.

In an April meeting in the White House with Salvadoran President Nayib Bukele, President Trump said it was up to the Salvadoran leader whether to release a man who was the subject of another case — mistakenly deported Maryland man Kilmar Abrego Garcia.

And in court, the Trump administration has argued it was powerless in any effort to secure the return of the men, saying they were beyond the reach of the U.S. legal system and that their fate rests with El Salvador.

The Trump administration in mid-March deported Venezuelans to the infamous CECOT prison, known by its acronym in Spanish, as well as some Salvadorans.

A Justice Department whistleblower has accused Principal Associate Deputy Attorney General Emil Bove of suggesting the department may need to defy court orders grounding flights set to deport men under the Alien Enemies Act.

The Trump administration has agreed to pay El Salvador $15 million to imprison the men, according to Sen. Chris Van Hollen (D-Md.), who shared the figure after traveling to El Salvador to meet with government officials as well as Abrego Garcia.

Copyright 2025 Nexstar Media, Inc. All rights reserved. This material may not be published, broadcast, rewritten, or redistributed.

For the latest news, weather, sports, and streaming video, head to The Hill."
https://www.yahoo.com/news/adds-cultural-tapestry-unpublished-handwritten-172936319.html,2025-07-08 19:30:00,"‘Adds to the cultural tapestry’: Unpublished, handwritten poem by James Whitcomb Riley discovered by Chicago-based coin dealer","CHICAGO — A Chicago-based coin and antiquities dealer claims it has uncovered a previously unknown poem by American poet James Whitcomb Riley.

Harlan J. Berk, Ltd. announced Tuesday that it had discovered the unpublished and handwritten work, titled “Roses,” among a collection of 19th-century ephemera recently acquired by the firm.

Read more: Latest Chicago news and headlines

The firm claims that the poem, which is dated August 1879, was handwritten by Riley and bears his signature as well as a Greenfield, Indiana, location.

“The find offers a rare glimpse into Riley’s early poetic voice before he rose to national fame as the ‘Hoosier Poet,'” a spokesperson for the firm said in a news release Tuesday.

Riley, an Indiana native, was known for works like “The Raggedy Man” and “Little Orphant Annie, which later inspired the comic strip and musical.

Riley’s unique dialect and heartwarming tales captivated audiences.

‘Maybe the greatest opportunity ever’: Researchers announce new expedition to locate Amelia Earhart’s lost plane

“Riley was one of the most beloved poets of his time, capturing the spirit and sentiment of rural Americana. The discovery of Roses adds to the cultural tapestry of his legacy and will be of interest to scholars, collectors, and lovers of American literature alike,” a spokesperson said.

Harlan J. Berk, Ltd. has arranged for the unpublished piece and supporting documents to be donated to the James Whitcomb Riley Museum in Indianapolis.

Located in the historic Chicago Temple Building in the Loop, Harlan J. Berk, Ltd. has offered an array of ancient coins, currency, and antiquities since opening in 1964.

Copyright 2025 Nexstar Media, Inc. All rights reserved. This material may not be published, broadcast, rewritten, or redistributed.

For the latest news, weather, sports, and streaming video, head to WGN-TV."
https://www.yahoo.com/news/severed-bow-famed-u-ship-205638500.html,2025-07-08 21:45:00,Severed bow of famed U.S. ship torpedoed in WWII found on Pacific seafloor,"The severed bow of the famed American warship USS New Orleans has been found by researchers during seafloor mapping operations in the Pacific Ocean.

The bow was discovered resting about 675 meters deep in the Solomon Islands' Iron Bottom Sound, the site of five major naval battles, the Ocean Exploration TrustsaidTuesday in a statement.

Scientific collaborators, including archaeologists and experts from all the former combatant nations, spent four hours imaging the site to assess whether the bow came from the embattled USS New Orleans. They found distinctive details in the ship's structure, painting and anchor, which allowed them to positively identify the bow.

""This imagery was viewed in real-time by hundreds of experts around the world, who all worked together to make a positive identification of the findings,"" aid Ocean Exploration Trust's chief scientist Daniel Wagner. ""The discovery highlights the power of having multiple scientists and technologies work together to achieve a common goal.""

The first of seven New Orleans-class heavy cruisers built during the 1930s, the USS New Orleanssawsome of the heaviest fighting during the Pacific war, beginning on Dec. 7, 1941,at Pearl Harbor. The commanding officerwroteat the time that the crew helped thwart a dive-bombing attack by about 10 enemy planes, and ""the action of the crew under fire was most commendable.""

The USS New Orleans then moved on to battle in various locations, including the Battle of Midway, beforereturningto the Solomons.

USS New Orleans' bow hasn't been seen since November 1942, during the World War II Battle of Tassafaronga, offshore of Guadalcanal, when a Japanesetorpedoslammed into the ship. It tore off nearly one-third of the ship, including the bow, and killed over 180 crew members.

The crew managed to get the ship into a good enough condition to sail for Australia for repairs,accordingto the National WWII Museum in New Orleans. On March 7, 1943, the USS New Orleansheadedto Puget Sound Navy Yard, where a new bow was fitted and the battle damage repaired.

""By all rights, this ship should have sunk, but due to the heroic damage control efforts of her crew, USS New Orleans became the most grievously damaged U.S. cruiser in WWII to actually survive,"" said Naval History and Heritage Command Director Samuel J. Cox, retired U.S. Navy Rear Admiral, in a statement. ""To find the bow of this ship is an opportunity to remember the sacrifice of this valiant crew, even on one of the worst nights in U.S. Navy history.""

Sneak peek: Who Killed Aileen Seiden in Room 15?

Everything we know so far about the deadly Texas floods

Texas dad who lost family in 2015 flood joins search to help others today"
https://www.yahoo.com/news/us-click-cancel-rule-blocked-211855238.html,2025-07-08 21:45:00,US 'click to cancel' rule blocked by appeals court,"By Jody Godoy

(Reuters) -A U.S. appeals court blocked a rule that would have required businesses to make it as easy to cancel subscriptions and memberships as it is to sign up, saying the agency that created it did not follow protocol.

The U.S. Federal Trade Commission, which passed the rule under former Democratic Chair Lina Khan, failed to conduct a preliminary analysis of the costs and benefits of the rule, said the 8th U.S. Circuit Court of Appeals in St. Louis. The rule was set to take effect on July 14.

A spokesperson for the FTC declined to comment on Tuesday.

The rule would have required retailers, gyms and other businesses to provide cancellation methods for subscriptions, auto-renewals and free trials that convert to paid memberships that are ""at least as easy to use"" as the sign up process.

It also aimed to keep companies from making consumers who signed up through an app or a website go through a chatbot or agent to cancel.

The U.S. Chamber of Commerce and a trade group representing major cable and internet providers such as Charter Communications, Comcast, and Cox Communications, and media companies like Disney Entertainment and Warner Bros. Discovery are among those suing to block the rule.

(Reporting by Jody Godoy in New York; Editing by Sonali Paul)"
