URL,Date,News_title,News_text
https://www.yahoo.com/news/rural-hospitals-brace-financial-hits-040635478.html,2025-07-04 04:45:00,Rural hospitals brace for financial hits or even closure under Republicans' $1 trillion Medicaid cut,"OMAHA, Neb. (AP) — Tyler Sherman, a nurse at a rural Nebraska hospital, is used to the area's aging farmers delaying care until they end up in his emergency room.

Now, with Congress planning around $1 trillion in Medicaid cuts over 10 years, he fears those farmers and the more than 3,000 residents of Webster County could lose not just the ER, but also the clinic and nursing home tied to the hospital.

“Our budget is pretty heavily reliant on the Medicaid reimbursement, so if we do see a cut of that, it’ll be difficult to keep the doors open,” said Sherman, who works at Webster County Community Hospital in the small Nebraska town of Red Cloud just north of the Kansas border.

If those facilities close, many locals would see their five-minute trip to Webster County hospital turn into a nearly hour-long ride to the nearest hospital offering the same services.

“That's a long way for an emergency,” Sherman said. “Some won't make it.”

Already struggling hospitals would be hit particularly hard

States and rural health advocacy groups warn thatcutting Medicaid— a program serving millions of low-income and disabled Americans — would hit already fragile rural hospitals hard and could force hundreds to close, stranding some people in remote areas without nearby emergency care.

More than 300 hospitals could beat risk for closureunder the Republican bill, according to an analysis by the Cecil G. Sheps Center at the University of North Carolina at Chapel Hill, which tracks rural hospital closures. Even as Congress haggled over the controversial bill, a health clinic in the southwest Nebraska town of Curtis announced Wednesday it will close in the coming months, in part blaming the anticipated Medicaid cuts.

Bruce Shay, of Pomfret, Connecticut, fears he and his wife could be among those left in the lurch. At 70, they're both in good health, he said. But that likely means that if either needs to go to a hospital, “it's going to be an emergency.”

Day Kimball Hospital is nearby in Putnam, but it has facedrecent financial challenges. Day Kimball's CEO R. Kyle Kramer acknowledged that a Senate bill passed Tuesday — estimated to cut federal Medicaid spending in rural areas by $155 billion over 10 years — would further hurt his rural hospital's bottom line. Roughly 30% of Day Kimball’s current patients receive Medicaid benefits, a figure that’s even higher for specific, critical services like obstetrics and behavioral health.

“An emergency means I’m 45 minutes to an hour away from the nearest hospital, and that’s a problem,"" Shay said. And he and his wife wouldn't be the only ones having to make that trip.

“You’ve got, I’m sure, thousands of people who rely on Day Kimball Hospital. If it closed, thousands of people would have to go to another hospital,” he said. “That’s a huge load to suddenly impose on a hospital system that’s probably already stretched thin.”

Experts say the bill's $50 billion fund for rural hospitals isn't enough

Rural hospitals havelong operated on the financial edge, especially in recent years as Medicaid payments have continuously fallen below the actual cost to provide health care. More than 20% of Americans live in rural areas, where Medicaid covers 1 in 4 adults, according to the nonprofit KFF, which studies health care issues.

President Donald Trump’s$4.5 trillion tax breaks and spending cuts bill,which passed Thursday, would worsen rural hospitals' struggles by cutting a key federal program that helps states fund Medicaid payments to health care providers. To help offset the lost tax revenue, the package includes $1.2 trillion in cuts to Medicaid and other social safety net programs — cuts they insist only root out fraud and waste in the system.

But public outcry over Medicaid cuts led Republicans to include a provision that will provide $10 billion annually to buttress rural hospitals over the next five years, or $50 billion in total. Many rural hospital advocates are wary that it won't be enough to cover the shortfall.

Carrie Cochran-McClain, chief policy officer with the National Rural Health Association, said rural hospitals already struggle to break even, citing a recent American Hospital Association report that found that hospitals in 2023 got nearly $28 billion less from Medicaid than the actual cost of treating Medicaid patients.

“We see rural hospitals throughout the country really operating on either negative or very small operating margins,"" Cochran-McClain said. ""Meaning that any amount of cut to a payer — especially a payer like Medicaid that makes up a significant portion of rural provider funding — is going to be consequential to the rural hospitals' ability to provide certain services or maybe even keep their doors open at the end of the day.”

Kentucky is expected to be hit especially hard

AKFF reportshows 36 states losing $1 billion or more over 10 years in Medicaid funding for rural areas under the Republican bill, even with the $50 billion rural fund. No state stands to lose more than Kentucky.

The report estimates the Bluegrass State would lose a whopping $12.3 billion — nearly $5 billion more than the next state on the list. That's because the bill ends Kentucky's unique Medicaid reimbursement system and reduces it to Medicare reimbursement levels.

Kentucky currently has one of the lowest Medicare reimbursement rates in the country. It also has one of the highest poverty rates, leading to a third of its population being covered by Medicaid.

Kentucky Gov. Andy Beshear, a two-term Democrat widely seen as a potential candidate for president in 2028, said the bill would close 35 hospitals in his state and pull health care coverage for 200,000 residents.

“Half of Kentucky’s kids are covered under Medicaid. They lose their coverage and you are scrambling over that next prescription,” Beshear said during an appearance on MSNBC. “This is going to impact the life of every single American negatively. It is going to hammer our economy.""

___

Haigh reported from Hartford, Connecticut."
https://www.yahoo.com/news/hiding-florida-lawmakers-shut-alligator-220940211.html,2025-07-04 04:45:00,‘What are they hiding?’ Florida lawmakers shut out of Alligator Alcatraz,"In a surprising and possibly unlawful act, five state legislators were denied entry Thursday into a taxpayer-funded migrant detention center deep in the Everglades, raising questions about what will happen behind the razor-wire fences that are being erected surrounding the controversial facility the state has named Alligator Alcatraz.

Armed only with state law and a growing list of humanitarian concerns, state Senators Shevrin Jones and Carlos Guillermo Smith, along with Representatives Anna V. Eskamani, Angie Nixon and Michele Rayner, arrived at the gates of the facility to conduct what they saw as a legally authorized inspection. What they encountered instead was silence, locked doors and a bureaucratic wall.

The state’s shifting justification for not letting them in — first a flat denial, then vague “safety concerns” — only fueled suspicions.

“This is a blatant abuse of power and an attempt to conceal human rights violations from the public eye,” the legislators said in a joint statement. “If the facility is unsafe for elected officials to enter, then how can it possibly be safe for those being detained inside?”

Just hours earlier, Republican officials and even former President Donald Trump had toured the same site without issue. When the lawmakers attempted to speak with Florida Department of Emergency Management officials by phone, the call was abruptly cut off.

Now, with reports of flooding, extreme heat and detainees allegedly being held without due process, legislators say the administration of Gov. Ron DeSantis is operating a secretive, $450 million detention network with no oversight— and no regard for the law.

The state legislators Michele Rayner arrived at the site to conduct what they said was a lawful inspection under Florida Statutes 944.23 and 951.225, which grant legislators access to state-operated detention centers without advance notice. Instead of transparency, they were met with locked gates and silence.

Under Florida law, members of the Legislature have the clear right to access any state-run detention facility, including prisons and jails, without needing prior approval or notification. That legal mandate was ignored, according to Representative Michele Rayner, a civil rights attorney who represents parts of Pinellas and Hillsborough counties.

“For two hours, we waited. We cited the law. We cited the press release announcing our visit. Still, we were denied,” said Rayner. “They cited ‘safety concerns,’ even though just hours earlier President Trump and GOP lawmakers had toured the very same facility.”

Rayner said that when she asked whether she could visit a client being detained inside, she was again refused—contradicting statements made to her moments earlier by Florida Department of Emergency Management officials. When legislators tried to clarify the denial with the agency’s general counsel and legislative affairs director, the call was abruptly disconnected.

“This is America right now,” Rayner said. “And everyone should be concerned.”

The delegation’s visit came just one day after migrants were transferred into the detention center despite flooding caused by ongoing summer storms. Lawmakers say they’ve received reports of extreme heat, poor infrastructure, and a lack of mosquito protection, conditions they say that may be endangering the health and safety of detainees.

“I was bitten by insects as soon as I got here. My lips started to swell. And I’m outside for just a few minutes,” said Rep. Angie Nixon of Jacksonville. “Imagine what it’s like for the people inside who don’t have bug spray or clean bedding.”

Nixon expressed particular concern over reports in the Miami Herald that pregnant womenand childrencould be housed in the facility. “We’re spending $450 million on this while refusing to expand Medicaid and closing public schools in Duval County,” she said. “This is not about public safety—it’s about cruelty as campaign theater.”

Smith did not mince words, calling the site a “makeshift immigrant detainment camp in the middle of the Everglades swamp,” built through no-bid contracts awarded to major Republican campaign donors.

“This isn’t about detaining dangerous criminals,” Smith said. “It’s about detaining housekeepers, cooks, and immigrants who had legal status five minutes ago—until it was stripped away by policy.”

Smith referenced a Miami Herald story that revealed the state may bring pregnant women and children to the site, despite public claims that the facility was intended for “the worst of the worst.” ICE data shows that fewer than 10% of current immigration detainees in Florida have any violent criminal history, and the majority had no prior offenses.

“We’re detaining vulnerable people for political spectacle,” Smith said. “And it’s not a coincidence this facility was unveiled just days after our legislative session ended—avoiding any real oversight.”

Jones added that the facility, built with $450 million in state funds, does not qualify for federal support. “The federal government has said this facility is ineligible for grants,” he said. “That means it’s 100% on Florida taxpayers—and it was done without a single committee hearing or floor debate.”

Jones emphasized that both Democratic and Republican lawmakers should be concerned. “This is not a partisan issue,” he said. “We have a duty to ensure that state-funded operations uphold basic standards of decency and legality.”

Rep. Anna Eskamani from Orlando described the detention center as a “political stunt” orchestrated by DeSantis. “Hundreds of millions of taxpayer dollars are being spent to build what is essentially a concentration camp,” she said. “This is government by press conference and no-bid contract.”

Eskamani said reports indicate that the first detainees arrived without due process, and flooding had already compromised parts of the facility. “We’re here because the people of Florida deserve transparency. What is being hidden behind these walls?”

All five lawmakers said they plan to pursue legal remedies and initiate legislative inquiries into the construction, contracting, and operation of Alligator Alcatraz.

They also demanded that the Florida Division of Emergency Management and the governor’s office provide a full accounting of who is detained at the facility, what conditions exist inside, and which companies received contracts—particularly those with political ties to the DeSantis administration.

“This is not over,” said Smith. “We will be back, and we will not stop until we get the answers Floridians deserve.”"
https://www.yahoo.com/news/nightmare-nightclub-looking-back-eight-022000227.html,2025-07-04 05:00:00,Nightmare at the Nightclub: Looking back eight years after Power Ultra Lounge mass shooting,"PULASKI COUNTY, Ark. – This July marks eight years since the mass shooting at the Power Ultra Lounge in Little Rock.

Police responded to the nightclub on July 1, 2017. Twenty-five people were shot and another three were injured running from the chaos inside.

Nightclub Shooting Victim Determined to ‘Keep Moving’ After Being Shot

The rapper who was performing that night, Ricky Hampton aka ‘Finesse2Tymes’, will be back in Little Rock this weekend for yet another concert.

He will be performing at the Bada Bing Grille 2 out in Pulaski County.

On the 8-year anniversary, FOX 16 News’ Jessica Rockwell takes a look back on the nightmare that unfolded in this Little Rock nightclub. What did we learn from the events in 2017? And what measures, if any, are being taken to prevent it from happening again?

The second you step out of the car, you’re hit with a wave of silence.

It’s as if a piece of history has been erased.

Doors are locked.

Lights are turned off.

All that remains are the haunting stories of years prior.

“I remember what I saw in the news footage, and what the talk around the town was about it. That was concerning,” said Willie Davis, OK Program Coordinator.

Davis was an officer at the Little Rock Police Department in 2017.

Are Guns in Little Rock Clubs a Problem?

Though he didn’t respond to the shooting, he says the events of that night opened up a bigger conversation in the department and in the community.

“[We were] finding ways to address it, interrupt it, to disrupt it,” Davis said.

It was all hands on deck.

The U.S. Attorney’s Office created a task force to crack down on repeat gun crime offenders.

Little Rock officers spent more time checking into nightclub security, and in each one of their cars, officers carried a trauma kit.

“Those kinds of incidents can be traumatic: physically, socially, and psychologically,” Davis said.

Davis works on the side as a coordinator for the OK Program, mentoring young boys.

He says what happened at the Power Ultra Lounge is a teachable moment about communication and channeling emotion.

Davis says he challenges his students to think before acting.

“Should I or shouldn’t I do this? What do my parents think about this? Could this cause me to lose my life,” Davis said.

Suspect in LR mass shooting never extradited, wanted again

This weekend, Hampton will be back in Pulaski County, almost 8 years to the day.

“Whether we get 200 or 2,000, we just want a successful event,” said AMS Music Events CEO Alvin Mays.

FOX 16 News spoke with the promoter of this weekend’s event over the phone.

Alvin Mays says he was originally cautious about organizing an event with the rapper but ultimately decided the shooting in 2017 was more about improper security rather than the artist.

“You prepare accordingly for crowd size, you prepare for crowd control and you prepare for life safety,” Mays said.

Mays says he has put several protocols in place to ensure a safe event including:

Over 40 security guards in and outside the building

Metal detectors

Bag Checks

Uniformed and undercover officers on site

Team to handle emergency response and crowd management

“It’s overkill but you know there is no such thing as overkill when you are protecting people,” Mays said.

The Pulaski County Sheriff’s Office says it will have increased patrol that evening.

Though the memories of 2017 are hard to relive, Davis says there is something we can learn from it.

“Knowing where you are and what’s going on around you is so extremely important,” Davis said. “If you hear arguing or conversation with loud voices raised, leave.”

A point in time, that can spark change and make a better future.

Rapper Faces Federal Complaint in Forrest City Shooting

The Memphis-based rapper has been at the center of several violent nights.

In June 2017, Hampton was arrested after threatening to shoot a woman outside a Forrest City nightclub where he was performing.

A week later, 25 people were shot at the Power Ultra Lounge in Little Rock.

In January 2023, two men started shooting at Hampton’s concert in Knoxville.

Copyright 2025 Nexstar Media, Inc. All rights reserved. This material may not be published, broadcast, rewritten, or redistributed.

For the latest news, weather, sports, and streaming video, head to KLRT - FOX16.com."
https://www.yahoo.com/news/firefighters-working-start-recovery-efforts-223827657.html,2025-07-04 05:00:00,Firefighters working to start recovery efforts after Esparto fireworks blast,"Firefighters are working to begin efforts to recoverseven individuals who are “unaccounted for” at the site ofmultiple fireworks explosions that destroyed a pyrotechnics warehousein Esparto, officials said at a news conference Thursday afternoon.

Mathew Davis, a spokesperson for the Yolo County Sheriff’s Office, addressed the families of the missing individuals, acknowledging their concerns but saying personnel cannot move forward with the recovery effort until the scene is safe.

“It’s important that we operate safely, carefully and securely and in a dignified manner that respects all involved,” Davis said. “We cannot move forward and risk any more injury to anyone else on this scene.”

Esparto Fire Chief Curtis Lawrence on Wednesday said conditions were too dangerous for crews to search for the missing individuals on scene, calling it a “once-in-a-career incident.”

At Thursday’s briefing, Lawrence said firefighters had begun “targeted fire suppression efforts” to mitigate the risks of recovery and said the area was “a little bit” safer for responders.

Lawrence and Davis did not answer questions from the media or families.

While Lawrence could not confirm the number of individuals forced to evacuate, he said more than 150 PG&E customers were affected by power outages from the incident.

As of Thursday afternoon, 89 customers connected to a substation on the 18500 block of County Road 89, roughly two miles east of the fire, remained disconnected, according to data collected by the Governor’s Office of Emergency Services.

Supervisor Angel Barajas, who represents the western portion of Yolo County including Winters and Esparto, said that the board, along with various agencies, were investigating the incident to see whether proper procedures were followed. Barajas said if protocols were violated, the board would “revise and modify” them to prevent similar incidents from occurring in the future.

“We have trust in our partners and our agencies that the investigation is going to be transparent,” he said. “We want to make sure that it becomes a quick and a timely investigation, but we’re going to leave the subject-matter experts to perform those duties.”

Barajas said the county was providing the families of those unaccounted for with food and hotel vouchers as well as counseling services.

“First and foremost, our priority is the families making sure that they’re comfortable during this investigation and this recovery procedure,” Barajas said.

At a Wednesday news conference, family members of three of the missing individuals — Jesus Ramos, Jhonny Ramos and Joel “Junior” Melendezconfronted fire officials about their handling of the eventafter Lawrence said firefighters’ next priority was decreasing the evacuation zone, rather than locating the missing individuals.

Lawrence later said finding the missing was a “big concern” for the department.

“You guys should be more worried about finding the people first and then worrying about the people when evacuating,” said Syanna Ruiz, the girlfriend of Jesus Ramos. “Those are people who possibly lost their lives because of you guys not doing your job well enough, and because you guys are not taking your job as serious as you guys supposedly do.”

In a statement, officials at Devastating Pyrotechnics, whose facilities were destroyed in the explosion, offered thoughts to the families of those believed lost in the blast and gratitude to first responders who rushed to the scene.

“Our hearts and thoughts are with those we lost, their families, and everyone impacted in our community,” the statement read. “We are grateful for the swift response of law enforcement and emergency personnel. Our focus will remain on those directly impacted by this tragedy, and we will cooperate fully with the proper authorities in their investigation.”

The company’s attorney, Douglas Horngrad, offered little else, saying that “while we understand the public’s need for more information about the warehouse facility in Esparto, we cannot provide any further comment at this time.”

No other officials from the San Francisco-based company have discussed the incident with The Sacramento Bee or responded to repeated inquiries about the inferno.

A State Fire Marshal’s Arson and Bomb Unit has been on scene investigating the incident since Tuesday, but currently has no updates on their investigation, Lawrence said.

Questions about the investigation sent to officials at the Cal Fire division remained unanswered, too.

Anational Bureau of Alcohol, Tobacco and Firearms response team, which typically assembles for major fire and explosion incidents, was called to the Oakdale incident in Esparto, Cal Fire officials said on Wednesday.

On Wednesday, Cal Fire spokesperson Jason Clay said the investigation would be “lengthy.”

Julie Heckman, executive director of the American Pyrotechnics Association, an industry group representing all aspects of the fireworks business, saidexplosions like the Oakdale incident are often human caused.

“Usually when a bad incident happens, there are workers dealing with the product,” Heckman said. “Fireworks do not just ignite on their own.”

The Office of the State Fire Marshal on Wednesday emphasized that incidents like this are rare due to stringent licensing standards. Still, the agency said its team would investigate whether activities at the site complied with both state and federal regulations.

The Bee’s Darrell Smith, Daniel Hunt, Jake Goodrick and Sharon Bernstein contributed to this story."
